processed_cache_files/convolution_MI250X_processed.json
{"device_name": "", "kernel_name": "convolution_kernel", "problem_size": [4096, 4096], "tune_params_keys": ["block_size_x", "block_size_y", "tile_size_x", "tile_size_y", "read_only", "use_padding"], "tune_params": {"block_size_x": [16, 32, 48, 64, 80, 96, 112, 128, 144, 160, 176, 192, 208, 224, 240, 256], "block_size_y": [1, 2, 4, 8, 16], "tile_size_x": [1, 2, 3, 4], "tile_size_y": [1, 2, 3, 4], "read_only": [0, 1], "use_padding": [0, 1]}, "objective": "time", "cache": {"16,1,1,1,0,0": {"block_size_x": 16, "block_size_y": 1, "tile_size_x": 1, "tile_size_y": 1, "read_only": 0, "use_padding": 0, "time": 16.046276926994324, "times": [16.052446365356445, 16.03740692138672, 16.033885955810547, 16.041799545288086, 16.04012680053711, 16.047327041625977, 16.039005279541016, 16.037057876586914, 16.03852653503418, 16.04124641418457, 16.042526245117188, 16.047334671020508, 16.042686462402344, 16.03964614868164, 16.040285110473633, 16.036767959594727, 16.03852653503418, 16.04716682434082, 16.040287017822266, 16.03972625732422, 16.047006607055664, 16.041566848754883, 16.04204559326172, 16.043087005615234, 16.03804588317871, 16.175487518310547, 16.039005279541016, 16.04617691040039, 16.051965713500977, 16.044925689697266, 16.041086196899414, 16.046680450439453], "compile_time": 355.5396660231054, "verification_time": 0, "benchmark_time": 514.7434121463448, "GFLOP/s": 470.4983738189894, "strategy_time": 0, "framework_time": 36.38749779202044, "timestamp": "2023-11-22 10:22:26.177363+00:00"}, "16,1,1,1,0,1": {"block_size_x": 16, "block_size_y": 1, "tile_size_x": 1, "tile_size_y": 1, "read_only": 0, "use_padding": 1, "time": 16.050770580768585, "times": [16.06684684753418, 16.051326751708984, 16.043806076049805, 16.048049926757812, 16.048765182495117, 16.041406631469727, 16.053085327148438, 16.04953384399414, 16.044286727905273, 16.05020523071289, 16.053245544433594, 16.052099227905273, 16.049726486206055, 16.053726196289062, 16.051326751708984, 16.04969024658203, 16.053247451782227, 16.051166534423828, 16.052127838134766, 16.064664840698242, 16.047645568847656, 16.04556655883789, 16.049406051635742, 16.044553756713867, 16.044925689697266, 16.051166534423828, 16.050046920776367, 16.05262565612793, 16.05292510986328, 16.054845809936523, 16.050846099853516, 16.05177116394043], "compile_time": 357.799518853426, "verification_time": 0, "benchmark_time": 515.0371009949595, "GFLOP/s": 470.36665074795945, "strategy_time": 0, "framework_time": 1.9328612834215164, "timestamp": "2023-11-22 10:22:27.052191+00:00"}, "16,1,1,1,1,0": {"block_size_x": 16, "block_size_y": 1, "tile_size_x": 1, "tile_size_y": 1, "read_only": 1, "use_padding": 0, "time": 16.018388032913208, "times": [16.031166076660156, 16.01532554626465, 16.01404571533203, 16.01325225830078, 16.015165328979492, 16.014686584472656, 16.01644515991211, 16.020551681518555, 16.01724624633789, 16.021406173706055, 16.01964569091797, 16.021072387695312, 16.01836585998535, 16.018047332763672, 16.018205642700195, 16.0185489654541, 16.01372528076172, 16.015806198120117, 16.012285232543945, 16.022083282470703, 16.013565063476562, 16.023006439208984, 16.022846221923828, 16.015718460083008, 16.023006439208984, 16.015806198120117, 16.013885498046875, 16.018112182617188, 16.022205352783203, 16.029245376586914, 16.017086029052734, 16.016857147216797], "compile_time": 354.2142300866544, "verification_time": 0, "benchmark_time": 514.3245321232826, "GFLOP/s": 471.31753735066394, "strategy_time": 0, "framework_time": 0.9398176334798336, "timestamp": "2023-11-22 10:22:27.921686+00:00"}, "16,1,1,1,1,1": {"block_size_x": 16, "block_size_y": 1, "tile_size_x": 1, "tile_size_y": 1, "read_only": 1, "use_padding": 1, "time": 16.018339157104492, "times": [16.027326583862305, 16.018205642700195, 16.014686584472656, 16.01396942138672, 16.012765884399414, 16.013887405395508, 16.01404571533203, 16.01711654663086, 16.013565063476562, 16.018207550048828, 16.023326873779297, 16.019590377807617, 16.01884651184082, 16.022367477416992, 16.017406463623047, 16.020084381103516, 16.022045135498047, 16.012285232543945, 16.016605377197266, 16.018247604370117, 16.019325256347656, 16.016925811767578, 16.01404571533203, 16.013277053833008, 16.019166946411133, 16.017566680908203, 16.01932716369629, 16.02004051208496, 16.028606414794922, 16.022687911987305, 16.01836585998535, 16.02293586730957], "compile_time": 355.4789770860225, "verification_time": 0, "benchmark_time": 514.3461930565536, "GFLOP/s": 471.3189754539264, "strategy_time": 0, "framework_time": 1.020536758005619, "timestamp": "2023-11-22 10:22:28.792552+00:00"}, "16,1,1,2,0,0": {"block_size_x": 16, "block_size_y": 1, "tile_size_x": 1, "tile_size_y": 2, "read_only": 0, "use_padding": 0, "time": 8.5682213306427, "times": [8.585186958312988, 8.565828323364258, 8.575428009033203, 8.562467575073242, 8.570627212524414, 8.565506935119629, 8.569666862487793, 8.570303916931152, 8.567747116088867, 8.562787055969238, 8.56358814239502, 8.56470775604248, 8.565668106079102, 8.572226524353027, 8.56374740600586, 8.569437026977539, 8.565187454223633, 8.57222843170166, 8.566787719726562, 8.570146560668945, 8.567107200622559, 8.567748069763184, 8.569988250732422, 8.565911293029785, 8.567107200622559, 8.572708129882812, 8.576228141784668, 8.57222843170166, 8.5639066696167, 8.566946983337402, 8.561827659606934, 8.56209945678711], "compile_time": 421.3358440902084, "verification_time": 0, "benchmark_time": 275.33779409714043, "GFLOP/s": 881.1335408668411, "strategy_time": 0, "framework_time": 1.5186388045549393, "timestamp": "2023-11-22 10:22:29.490760+00:00"}, "16,1,1,2,0,1": {"block_size_x": 16, "block_size_y": 1, "tile_size_x": 1, "tile_size_y": 2, "read_only": 0, "use_padding": 1, "time": 8.586389034986496, "times": [8.592547416687012, 8.576547622680664, 8.585348129272461, 8.572708129882812, 8.582947731018066, 8.583106994628906, 8.576547622680664, 8.790807723999023, 8.579266548156738, 8.582307815551758, 8.58102798461914, 8.581027030944824, 8.580388069152832, 8.58166790008545, 8.581988334655762, 8.579148292541504, 8.577507019042969, 8.573348045349121, 8.57990837097168, 8.575748443603516, 8.57526683807373, 8.575906753540039, 8.582468032836914, 8.579282760620117, 8.580866813659668, 8.582947731018066, 8.581828117370605, 8.577986717224121, 8.578948020935059, 8.579587936401367, 8.57398796081543, 8.581476211547852], "compile_time": 422.31947695836425, "verification_time": 0, "benchmark_time": 275.65145189873874, "GFLOP/s": 879.2691746480915, "strategy_time": 0, "framework_time": 1.4023941475898027, "timestamp": "2023-11-22 10:22:30.190150+00:00"}, "16,1,1,2,1,0": {"block_size_x": 16, "block_size_y": 1, "tile_size_x": 1, "tile_size_y": 2, "read_only": 1, "use_padding": 0, "time": 8.55759260058403, "times": [8.581027030944824, 8.563108444213867, 8.556387901306152, 8.556387901306152, 8.551587104797363, 8.555267333984375, 8.554628372192383, 8.553105354309082, 8.552387237548828, 8.554786682128906, 8.556708335876465, 8.556548118591309, 8.556866645812988, 8.554786682128906, 8.55878734588623, 8.564901351928711, 8.558306694030762, 8.557026863098145, 8.557188034057617, 8.554146766662598, 8.556386947631836, 8.557188034057617, 8.555107116699219, 8.554411888122559, 8.554946899414062, 8.557506561279297, 8.562467575073242, 8.558148384094238, 8.557827949523926, 8.5571870803833, 8.561187744140625, 8.556656837463379], "compile_time": 415.05724121816456, "verification_time": 0, "benchmark_time": 275.46189492568374, "GFLOP/s": 882.2279293226406, "strategy_time": 0, "framework_time": 1.4101897832006216, "timestamp": "2023-11-22 10:22:30.882096+00:00"}, "16,1,1,2,1,1": {"block_size_x": 16, "block_size_y": 1, "tile_size_x": 1, "tile_size_y": 2, "read_only": 1, "use_padding": 1, "time": 8.5656478703022, "times": [8.58022689819336, 8.569348335266113, 8.558788299560547, 8.566786766052246, 8.555267333984375, 8.553668022155762, 8.556227684020996, 8.556745529174805, 8.556386947631836, 8.557988166809082, 8.560708045959473, 8.556386947631836, 8.555907249450684, 8.556068420410156, 8.557348251342773, 8.566919326782227, 8.721348762512207, 8.561026573181152, 8.559906959533691, 8.559586524963379, 8.560708045959473, 8.568548202514648, 8.561186790466309, 8.561270713806152, 8.55894660949707, 8.559586524963379, 8.564067840576172, 8.558307647705078, 8.560546875, 8.559906959533691, 8.558148384094238, 8.5628662109375], "compile_time": 416.53945902362466, "verification_time": 0, "benchmark_time": 275.5508970003575, "GFLOP/s": 881.3982683289595, "strategy_time": 0, "framework_time": 1.3479988556355238, "timestamp": "2023-11-22 10:22:31.575551+00:00"}, "16,1,1,3,0,0": {"block_size_x": 16, "block_size_y": 1, "tile_size_x": 1, "tile_size_y": 3, "read_only": 0, "use_padding": 0, "time": 35.59964597225189, "times": [35.93595886230469, 35.55470275878906, 35.62411880493164, 35.5953483581543, 35.555641174316406, 35.566795349121094, 35.64812088012695, 35.53677749633789, 35.50444030761719, 35.568809509277344, 35.703800201416016, 35.59552001953125, 35.55179977416992, 35.53960037231445, 35.62300109863281, 35.70024871826172, 35.56251907348633, 35.598533630371094, 35.540279388427734, 35.53794479370117, 35.570838928222656, 35.585994720458984, 35.62379837036133, 35.623958587646484, 35.543800354003906, 35.57792663574219, 35.69147872924805, 35.564476013183594, 35.53276062011719, 35.586181640625, 35.577239990234375, 35.666255950927734], "compile_time": 503.4894209820777, "verification_time": 0, "benchmark_time": 1140.8210131339729, "GFLOP/s": 212.0736595494417, "strategy_time": 0, "framework_time": 1.3308851048350334, "timestamp": "2023-11-22 10:22:33.221208+00:00"}, "16,1,1,3,0,1": {"block_size_x": 16, "block_size_y": 1, "tile_size_x": 1, "tile_size_y": 3, "read_only": 0, "use_padding": 1, "time": 37.24826419353485, "times": [37.36061477661133, 37.309085845947266, 37.241416931152344, 37.21371841430664, 37.279014587402344, 37.285987854003906, 37.28317642211914, 37.355918884277344, 37.24909210205078, 37.29772186279297, 37.24861145019531, 37.20710372924805, 37.19021224975586, 37.25626754760742, 37.19293212890625, 37.17657470703125, 37.30989456176758, 37.13804626464844, 37.20573043823242, 37.232295989990234, 37.321414947509766, 37.22024154663086, 37.193092346191406, 37.246421813964844, 37.29117202758789, 37.35170364379883, 37.239013671875, 37.167884826660156, 37.22285079956055, 37.22557067871094, 37.21037292480469, 37.22129821777344], "compile_time": 504.7749320510775, "verification_time": 0, "benchmark_time": 1193.5484891291708, "GFLOP/s": 202.68722216887633, "strategy_time": 0, "framework_time": 1.4656768180429935, "timestamp": "2023-11-22 10:22:34.921013+00:00"}, "16,1,1,3,1,0": {"block_size_x": 16, "block_size_y": 1, "tile_size_x": 1, "tile_size_y": 3, "read_only": 1, "use_padding": 0, "time": 35.42320895195007, "times": [35.431640625, 35.52146911621094, 35.464759826660156, 35.4167594909668, 35.436279296875, 35.36498260498047, 35.376121520996094, 35.40594482421875, 35.40428161621094, 35.35151290893555, 35.43947982788086, 35.508270263671875, 35.38603973388672, 35.34040069580078, 35.47883987426758, 35.45970916748047, 35.371639251708984, 35.37744140625, 35.464599609375, 35.45154571533203, 35.421878814697266, 35.35203170776367, 35.46699905395508, 35.39590072631836, 35.4898796081543, 35.39691162109375, 35.41707992553711, 35.448631286621094, 35.50379943847656, 35.45500946044922, 35.36283874511719, 35.380008697509766], "compile_time": 499.2630418855697, "verification_time": 0, "benchmark_time": 1135.0385760888457, "GFLOP/s": 213.1299626253759, "strategy_time": 0, "framework_time": 1.5538169536739588, "timestamp": "2023-11-22 10:22:36.556884+00:00"}, "16,1,1,3,1,1": {"block_size_x": 16, "block_size_y": 1, "tile_size_x": 1, "tile_size_y": 3, "read_only": 1, "use_padding": 1, "time": 36.53710210323334, "times": [36.769569396972656, 36.52372741699219, 36.51180648803711, 36.49746322631836, 36.521888732910156, 36.47135543823242, 36.507328033447266, 36.48366928100586, 36.48604965209961, 36.530029296875, 36.55052947998047, 36.52412033081055, 36.55740737915039, 36.49602127075195, 36.5618896484375, 36.49509048461914, 36.51020812988281, 36.49650573730469, 36.48076629638672, 36.543888092041016, 36.54492950439453, 36.517303466796875, 36.52796936035156, 36.56788635253906, 36.532928466796875, 36.601531982421875, 36.55036926269531, 36.577327728271484, 36.560768127441406, 36.59403991699219, 36.529727935791016, 36.56317138671875], "compile_time": 502.5735378731042, "verification_time": 0, "benchmark_time": 1170.83779303357, "GFLOP/s": 206.63234809013184, "strategy_time": 0, "framework_time": 1.5243799425661564, "timestamp": "2023-11-22 10:22:38.231836+00:00"}, "16,1,1,4,0,0": {"block_size_x": 16, "block_size_y": 1, "tile_size_x": 1, "tile_size_y": 4, "read_only": 0, "use_padding": 0, "time": 4.80516704916954, "times": [4.8269171714782715, 4.979238986968994, 4.797956943511963, 4.799077987670898, 4.798597812652588, 4.798916816711426, 4.797478199005127, 4.803877830505371, 4.796998023986816, 4.798597812652588, 4.797478199005127, 4.79683780670166, 4.800490856170654, 4.799558162689209, 4.799397945404053, 4.7981181144714355, 4.797317981719971, 4.7971577644348145, 4.800037860870361, 4.798758029937744, 4.798117160797119, 4.800198078155518, 4.798917770385742, 4.79923677444458, 4.798597812652588, 4.800200939178467, 4.801476955413818, 4.797637939453125, 4.7880377769470215, 4.800518035888672, 4.799397945404053, 4.800198078155518], "compile_time": 533.0001069232821, "verification_time": 0, "benchmark_time": 155.88986803777516, "GFLOP/s": 1571.1726819788282, "strategy_time": 0, "framework_time": 1.5293199103325605, "timestamp": "2023-11-22 10:22:38.922270+00:00"}, "16,1,1,4,0,1": {"block_size_x": 16, "block_size_y": 1, "tile_size_x": 1, "tile_size_y": 4, "read_only": 0, "use_padding": 1, "time": 4.863359451293945, "times": [4.889957904815674, 4.864199161529541, 4.86179780960083, 4.867077827453613, 4.85955810546875, 4.860198020935059, 4.859879016876221, 4.861158847808838, 4.871717929840088, 4.859238147735596, 4.861318111419678, 4.862598896026611, 4.861577987670898, 4.864357948303223, 4.861478805541992, 4.862119197845459, 4.864677906036377, 4.862117767333984, 4.860838890075684, 4.863399028778076, 4.8617987632751465, 4.862438201904297, 4.864037990570068, 4.862117767333984, 4.860678195953369, 4.867015838623047, 4.860837936401367, 4.861638069152832, 4.861318111419678, 4.865797996520996, 4.860678195953369, 4.859878063201904], "compile_time": 530.9585058130324, "verification_time": 0, "benchmark_time": 157.61156985536218, "GFLOP/s": 1552.372855761528, "strategy_time": 0, "framework_time": 1.5489684883505106, "timestamp": "2023-11-22 10:22:39.612405+00:00"}, "16,1,1,4,1,0": {"block_size_x": 16, "block_size_y": 1, "tile_size_x": 1, "tile_size_y": 4, "read_only": 1, "use_padding": 0, "time": 4.801561489701271, "times": [4.818596839904785, 4.793316841125488, 4.79459810256958, 4.7941179275512695, 4.794277191162109, 4.796517848968506, 4.798917770385742, 4.79683780670166, 4.7934770584106445, 4.795557975769043, 4.9723591804504395, 4.8011579513549805, 4.795025825500488, 4.794917106628418, 4.798597812652588, 4.795718193054199, 4.79843807220459, 4.795077800750732, 4.798277854919434, 4.792197227478027, 4.796357154846191, 4.794918060302734, 4.79459810256958, 4.7960381507873535, 4.792838096618652, 4.7965288162231445, 4.792518138885498, 4.793317794799805, 4.794437885284424, 4.79539680480957, 4.792198181152344, 4.792838096618652], "compile_time": 524.1332058794796, "verification_time": 0, "benchmark_time": 155.27268312871456, "GFLOP/s": 1572.3524974517627, "strategy_time": 0, "framework_time": 1.3148549478501081, "timestamp": "2023-11-22 10:22:40.293141+00:00"}, "16,1,1,4,1,1": {"block_size_x": 16, "block_size_y": 1, "tile_size_x": 1, "tile_size_y": 4, "read_only": 1, "use_padding": 1, "time": 4.844187527894974, "times": [4.868358135223389, 4.842278003692627, 4.8387579917907715, 4.841157913208008, 4.842438220977783, 4.844198226928711, 4.839717864990234, 4.84099817276001, 4.842119216918945, 4.838438034057617, 4.84083890914917, 4.845317840576172, 4.8511857986450195, 4.841157913208008, 4.844997882843018, 4.840357780456543, 4.848038196563721, 4.840198993682861, 4.84099817276001, 4.841157913208008, 4.8437180519104, 4.851558208465576, 4.84755802154541, 4.848358154296875, 4.845798969268799, 4.842789173126221, 4.8406782150268555, 4.848837852478027, 4.852038860321045, 4.840517997741699, 4.840198040008545, 4.839238166809082], "compile_time": 524.3484219536185, "verification_time": 0, "benchmark_time": 156.1346622183919, "GFLOP/s": 1558.5167082251082, "strategy_time": 0, "framework_time": 1.3100358191877604, "timestamp": "2023-11-22 10:22:40.974949+00:00"}, "16,1,2,1,0,0": {"block_size_x": 16, "block_size_y": 1, "tile_size_x": 2, "tile_size_y": 1, "read_only": 0, "use_padding": 0, "time": 15.191518515348434, "times": [15.205558776855469, 15.191160202026367, 15.18828010559082, 15.186840057373047, 15.182544708251953, 15.182839393615723, 15.1873197555542, 15.182040214538574, 15.177559852600098, 15.194552421569824, 15.187318801879883, 15.183638572692871, 15.18220043182373, 15.173078536987305, 15.185598373413086, 15.180278778076172, 15.184598922729492, 15.19756031036377, 15.186039924621582, 15.359366416931152, 15.191479682922363, 15.185720443725586, 15.186038970947266, 15.187958717346191, 15.185853004455566, 15.18411922454834, 15.183158874511719, 15.184279441833496, 15.183479309082031, 15.184290885925293, 15.183319091796875, 15.190520286560059], "compile_time": 487.43519792333245, "verification_time": 0, "benchmark_time": 487.4265531543642, "GFLOP/s": 496.97120089557006, "strategy_time": 0, "framework_time": 1.4091869816184044, "timestamp": "2023-11-22 10:22:41.951234+00:00"}, "16,1,2,1,0,1": {"block_size_x": 16, "block_size_y": 1, "tile_size_x": 2, "tile_size_y": 1, "read_only": 0, "use_padding": 1, "time": 15.183694869279861, "times": [15.204278945922852, 15.181079864501953, 15.17516040802002, 15.182040214538574, 15.18303108215332, 15.181239128112793, 15.175000190734863, 15.191160202026367, 15.18235969543457, 15.18551254272461, 15.18075942993164, 15.174519538879395, 15.189559936523438, 15.182198524475098, 15.18505859375, 15.19867992401123, 15.191800117492676, 15.185879707336426, 15.183159828186035, 15.179936408996582, 15.172919273376465, 15.177399635314941, 15.182680130004883, 15.185720443725586, 15.185811996459961, 15.181400299072266, 15.180760383605957, 15.179960250854492, 15.183480262756348, 15.1858491897583, 15.18411922454834, 15.185720443725586], "compile_time": 487.0307061355561, "verification_time": 0, "benchmark_time": 487.18193895183504, "GFLOP/s": 497.22727340068525, "strategy_time": 0, "framework_time": 1.5619120094925165, "timestamp": "2023-11-22 10:22:42.927023+00:00"}, "16,1,2,1,1,0": {"block_size_x": 16, "block_size_y": 1, "tile_size_x": 2, "tile_size_y": 1, "read_only": 1, "use_padding": 0, "time": 15.164908021688461, "times": [15.182198524475098, 15.159318923950195, 15.1589994430542, 15.156759262084961, 15.149484634399414, 15.154679298400879, 15.15835952758789, 15.154999732971191, 15.150039672851562, 15.153363227844238, 15.16011905670166, 15.152918815612793, 15.163958549499512, 15.155479431152344, 15.151419639587402, 15.15419864654541, 15.158039093017578, 15.165079116821289, 15.162359237670898, 15.16007137298584, 15.166358947753906, 15.157078742980957, 15.156599998474121, 15.155159950256348, 15.159034729003906, 15.158839225769043, 15.161879539489746, 15.154520034790039, 15.346840858459473, 15.162821769714355, 15.173398971557617, 15.162678718566895], "compile_time": 481.8960768170655, "verification_time": 0, "benchmark_time": 486.7609338834882, "GFLOP/s": 497.8432568929891, "strategy_time": 0, "framework_time": 1.4517202507704496, "timestamp": "2023-11-22 10:22:43.897147+00:00"}, "16,1,2,1,1,1": {"block_size_x": 16, "block_size_y": 1, "tile_size_x": 2, "tile_size_y": 1, "read_only": 1, "use_padding": 1, "time": 15.162285417318344, "times": [15.193718910217285, 15.151800155639648, 15.16779899597168, 15.155158996582031, 15.154302597045898, 15.15419864654541, 15.16156005859375, 15.157719612121582, 15.156279563903809, 15.157417297363281, 15.158039093017578, 15.157879829406738, 15.16187858581543, 15.160438537597656, 15.16275405883789, 15.16891860961914, 15.159158706665039, 15.160438537597656, 15.168119430541992, 15.165414810180664, 15.162199020385742, 15.159319877624512, 15.161879539489746, 15.169878959655762, 15.157364845275879, 15.159639358520508, 15.162678718566895, 15.164599418640137, 15.162359237670898, 15.168620109558105, 15.163639068603516, 15.167960166931152], "compile_time": 482.76812583208084, "verification_time": 0, "benchmark_time": 486.60409008152783, "GFLOP/s": 497.9293683112367, "strategy_time": 0, "framework_time": 1.351265935227275, "timestamp": "2023-11-22 10:22:44.867885+00:00"}, "16,1,2,2,0,0": {"block_size_x": 16, "block_size_y": 1, "tile_size_x": 2, "tile_size_y": 2, "read_only": 0, "use_padding": 0, "time": 8.134749412536621, "times": [8.16198444366455, 8.133824348449707, 8.129983901977539, 8.144864082336426, 8.132704734802246, 8.133824348449707, 8.132063865661621, 8.133605003356934, 8.137344360351562, 8.13094425201416, 8.1298246383667, 8.133024215698242, 8.137663841247559, 8.131584167480469, 8.129183769226074, 8.135793685913086, 8.132063865661621, 8.132224082946777, 8.133343696594238, 8.133983612060547, 8.132384300231934, 8.134464263916016, 8.130624771118164, 8.131678581237793, 8.14038372039795, 8.136063575744629, 8.137985229492188, 8.13270378112793, 8.13542366027832, 8.13542366027832, 8.131744384765625, 8.133268356323242], "compile_time": 706.1815720517188, "verification_time": 0, "benchmark_time": 262.42082309909165, "GFLOP/s": 928.0860192650724, "strategy_time": 0, "framework_time": 1.370251877233386, "timestamp": "2023-11-22 10:22:45.837873+00:00"}, "16,1,2,2,0,1": {"block_size_x": 16, "block_size_y": 1, "tile_size_x": 2, "tile_size_y": 2, "read_only": 0, "use_padding": 1, "time": 8.138030678033829, "times": [8.14902400970459, 8.12934398651123, 8.12822437286377, 8.127904891967773, 8.122143745422363, 8.31910514831543, 8.139904022216797, 8.129979133605957, 8.12934398651123, 8.130304336547852, 8.135904312133789, 8.133344650268555, 8.129183769226074, 8.128864288330078, 8.13094425201416, 8.136968612670898, 8.132384300231934, 8.131904602050781, 8.130784034729004, 8.141023635864258, 8.133504867553711, 8.130784034729004, 8.12934398651123, 8.13009262084961, 8.129504203796387, 8.132384300231934, 8.131264686584473, 8.131263732910156, 8.130784034729004, 8.132545471191406, 8.136384010314941, 8.13254165649414], "compile_time": 704.7845688648522, "verification_time": 0, "benchmark_time": 262.4605312012136, "GFLOP/s": 927.7118136674364, "strategy_time": 0, "framework_time": 1.3971729204058647, "timestamp": "2023-11-22 10:22:46.806529+00:00"}, "16,1,2,2,1,0": {"block_size_x": 16, "block_size_y": 1, "tile_size_x": 2, "tile_size_y": 2, "read_only": 1, "use_padding": 0, "time": 8.116916179656982, "times": [8.137824058532715, 8.112223625183105, 8.107104301452637, 8.114463806152344, 8.11190414428711, 8.121983528137207, 8.110143661499023, 8.116409301757812, 8.110624313354492, 8.12230396270752, 8.115743637084961, 8.114784240722656, 8.113984107971191, 8.122783660888672, 8.112704277038574, 8.116498947143555, 8.110624313354492, 8.11894416809082, 8.118464469909668, 8.121024131774902, 8.120223999023438, 8.11894416809082, 8.126145362854004, 8.115463256835938, 8.120063781738281, 8.117024421691895, 8.118783950805664, 8.113504409790039, 8.114784240722656, 8.116064071655273, 8.1133451461792, 8.116430282592773], "compile_time": 698.5519360750914, "verification_time": 0, "benchmark_time": 260.80614794045687, "GFLOP/s": 930.1250663301847, "strategy_time": 0, "framework_time": 1.2728930450975895, "timestamp": "2023-11-22 10:22:47.767175+00:00"}, "16,1,2,2,1,1": {"block_size_x": 16, "block_size_y": 1, "tile_size_x": 2, "tile_size_y": 2, "read_only": 1, "use_padding": 1, "time": 8.122860819101334, "times": [8.142144203186035, 8.121824264526367, 8.113504409790039, 8.117664337158203, 8.114303588867188, 8.112223625183105, 8.115424156188965, 8.116266250610352, 8.115584373474121, 8.115263938903809, 8.114944458007812, 8.1179838180542, 8.115584373474121, 8.115424156188965, 8.307106018066406, 8.118700981140137, 8.116064071655273, 8.118464469909668, 8.117505073547363, 8.115424156188965, 8.119104385375977, 8.116064071655273, 8.11302375793457, 8.1162109375, 8.116543769836426, 8.112223625183105, 8.117024421691895, 8.11302375793457, 8.116703987121582, 8.116864204406738, 8.113823890686035, 8.11953067779541], "compile_time": 698.6768778879195, "verification_time": 0, "benchmark_time": 261.20570208877325, "GFLOP/s": 929.4443630311099, "strategy_time": 0, "framework_time": 1.3277789112180471, "timestamp": "2023-11-22 10:22:48.728400+00:00"}, "16,1,2,3,0,0": {"block_size_x": 16, "block_size_y": 1, "tile_size_x": 2, "tile_size_y": 3, "read_only": 0, "use_padding": 0, "time": 46.868573784828186, "times": [47.18149185180664, 46.63595962524414, 46.91700744628906, 46.88296890258789, 46.967891693115234, 46.90617370605469, 46.841007232666016, 46.85898971557617, 46.88724899291992, 46.88625717163086, 46.93285369873047, 46.84531021118164, 46.85140609741211, 46.98873519897461, 46.889808654785156, 46.84136962890625, 46.95109176635742, 46.888885498046875, 46.76084899902344, 46.839683532714844, 46.6554069519043, 46.92449951171875, 46.86260986328125, 46.89445877075195, 46.741966247558594, 46.752967834472656, 46.84388732910156, 46.966697692871094, 46.90100860595703, 46.90306854248047, 46.78148651123047, 46.81131362915039], "compile_time": 1036.4816130604595, "verification_time": 0, "benchmark_time": 1501.3636311050504, "GFLOP/s": 161.08335693466154, "strategy_time": 0, "framework_time": 1.3572168536484241, "timestamp": "2023-11-22 10:22:51.267618+00:00"}, "16,1,2,3,0,1": {"block_size_x": 16, "block_size_y": 1, "tile_size_x": 2, "tile_size_y": 3, "read_only": 0, "use_padding": 1, "time": 46.836631178855896, "times": [46.88532638549805, 46.86104965209961, 46.87493133544922, 46.89003372192383, 46.90133285522461, 46.7166862487793, 46.989013671875, 46.94572448730469, 46.91269302368164, 46.928504943847656, 46.77220916748047, 46.78760528564453, 46.83348846435547, 46.87681579589844, 46.81844711303711, 46.73646545410156, 46.7166862487793, 46.83736801147461, 46.8582878112793, 46.928627014160156, 46.802127838134766, 46.89564895629883, 46.583248138427734, 47.01797103881836, 46.64276885986328, 46.73035430908203, 46.9205322265625, 46.8804817199707, 46.72964859008789, 46.94133377075195, 46.73044967651367, 46.82633590698242], "compile_time": 1035.5327061843127, "verification_time": 0, "benchmark_time": 1500.4531180020422, "GFLOP/s": 161.19321586494218, "strategy_time": 0, "framework_time": 1.4666297938674688, "timestamp": "2023-11-22 10:22:53.805087+00:00"}, "16,1,2,3,1,0": {"block_size_x": 16, "block_size_y": 1, "tile_size_x": 2, "tile_size_y": 3, "read_only": 1, "use_padding": 0, "time": 46.72968769073486, "times": [46.68452835083008, 46.959835052490234, 46.741966247558594, 46.76383590698242, 46.734127044677734, 46.803253173828125, 46.722129821777344, 46.699241638183594, 46.810447692871094, 46.6399040222168, 46.806766510009766, 46.76607894897461, 46.79140853881836, 46.67670440673828, 46.71588897705078, 46.699859619140625, 46.86356735229492, 46.47496795654297, 46.75316619873047, 46.67554473876953, 46.902130126953125, 46.76008987426758, 46.59892654418945, 46.70150375366211, 46.57556915283203, 46.74586486816406, 46.52756881713867, 46.782127380371094, 46.72196960449219, 46.79180908203125, 46.74900817871094, 46.7102165222168], "compile_time": 1028.9361788891256, "verification_time": 0, "benchmark_time": 1496.786001836881, "GFLOP/s": 161.56211550065407, "strategy_time": 0, "framework_time": 1.5199922490864992, "timestamp": "2023-11-22 10:22:56.332345+00:00"}, "16,1,2,3,1,1": {"block_size_x": 16, "block_size_y": 1, "tile_size_x": 2, "tile_size_y": 3, "read_only": 1, "use_padding": 1, "time": 46.74250602722168, "times": [46.89508819580078, 46.813880920410156, 46.81828689575195, 46.73334503173828, 46.831729888916016, 46.7391357421875, 46.87061309814453, 46.60755157470703, 46.68916702270508, 46.576141357421875, 46.688209533691406, 46.758995056152344, 46.835731506347656, 46.74470520019531, 46.75764846801758, 46.79957580566406, 46.830772399902344, 46.79710388183594, 46.678287506103516, 46.765804290771484, 46.75252914428711, 46.733943939208984, 46.6450080871582, 46.736122131347656, 46.681007385253906, 46.72738265991211, 46.77492904663086, 46.60340118408203, 46.685489654541016, 46.66466522216797, 46.83156967163086, 46.6923713684082], "compile_time": 1031.3030099496245, "verification_time": 0, "benchmark_time": 1497.400931082666, "GFLOP/s": 161.517809841073, "strategy_time": 0, "framework_time": 1.479625003412366, "timestamp": "2023-11-22 10:22:58.862549+00:00"}, "16,1,2,4,0,0": {"block_size_x": 16, "block_size_y": 1, "tile_size_x": 2, "tile_size_y": 4, "read_only": 0, "use_padding": 0, "time": 4.624465450644493, "times": [4.858757972717285, 4.625476837158203, 4.62019681930542, 4.618916988372803, 4.615877151489258, 4.615877151489258, 4.616197109222412, 4.616036891937256, 4.6160359382629395, 4.617156028747559, 4.613475799560547, 4.617156028747559, 4.61491584777832, 4.6157307624816895, 4.616355895996094, 4.617315769195557, 4.617315769195557, 4.616355895996094, 4.618435859680176, 4.614116191864014, 4.615715980529785, 4.615076065063477, 4.6181159019470215, 4.616197109222412, 4.616517066955566, 4.61635684967041, 4.616036891937256, 4.616951942443848, 4.616196155548096, 4.615555763244629, 4.616836071014404, 4.621635913848877], "compile_time": 1203.6595980171114, "verification_time": 0, "benchmark_time": 149.65863805264235, "GFLOP/s": 1632.5664621297628, "strategy_time": 0, "framework_time": 1.5212649013847113, "timestamp": "2023-11-22 10:23:00.217404+00:00"}, "16,1,2,4,0,1": {"block_size_x": 16, "block_size_y": 1, "tile_size_x": 2, "tile_size_y": 4, "read_only": 0, "use_padding": 1, "time": 4.618897169828415, "times": [4.644996166229248, 4.624835968017578, 4.615076065063477, 4.61491584777832, 4.6160359382629395, 4.618435859680176, 4.616836071014404, 4.617956161499023, 4.625156879425049, 4.617156982421875, 4.617476940155029, 4.613956928253174, 4.620515823364258, 4.616542816162109, 4.616675853729248, 4.617956161499023, 4.616675853729248, 4.617795944213867, 4.618596076965332, 4.62035608291626, 4.624516010284424, 4.617636203765869, 4.616995811462402, 4.61875581741333, 4.617956161499023, 4.616196155548096, 4.617796897888184, 4.618442058563232, 4.618276119232178, 4.616995811462402, 4.616355895996094, 4.616836071014404], "compile_time": 1200.3379899542779, "verification_time": 0, "benchmark_time": 149.5724800042808, "GFLOP/s": 1634.5345917888149, "strategy_time": 0, "framework_time": 1.4804359525442123, "timestamp": "2023-11-22 10:23:01.568810+00:00"}, "16,1,2,4,1,0": {"block_size_x": 16, "block_size_y": 1, "tile_size_x": 2, "tile_size_y": 4, "read_only": 1, "use_padding": 0, "time": 4.6100767105817795, "times": [4.630596160888672, 4.604196071624756, 4.5993971824646, 4.602276802062988, 4.603716850280762, 4.6005167961120605, 4.605637073516846, 4.603877067565918, 4.602597236633301, 4.793158054351807, 4.608036041259766, 4.603715896606445, 4.605475902557373, 4.6028218269348145, 4.601955890655518, 4.604355812072754, 4.602595806121826, 4.604996204376221, 4.6048359870910645, 4.60451602935791, 4.602756023406982, 4.604675769805908, 4.603876113891602, 4.604355812072754, 4.603556156158447, 4.60451602935791, 4.6017961502075195, 4.599503993988037, 4.602756023406982, 4.602116107940674, 4.60019588470459, 4.603075981140137], "compile_time": 1186.8580300360918, "verification_time": 0, "benchmark_time": 149.62772699072957, "GFLOP/s": 1637.6619466375955, "strategy_time": 0, "framework_time": 1.3595018535852432, "timestamp": "2023-11-22 10:23:02.906670+00:00"}, "16,1,2,4,1,1": {"block_size_x": 16, "block_size_y": 1, "tile_size_x": 2, "tile_size_y": 4, "read_only": 1, "use_padding": 1, "time": 4.606464847922325, "times": [4.642275810241699, 4.6110758781433105, 4.607235908508301, 4.603236198425293, 4.61491584777832, 4.605795860290527, 4.601955890655518, 4.606435775756836, 4.603556156158447, 4.602116107940674, 4.610276222229004, 4.603876113891602, 4.604675769805908, 4.602294921875, 4.602756977081299, 4.604996204376221, 4.605796813964844, 4.606276035308838, 4.605155944824219, 4.6017961502075195, 4.602595806121826, 4.604355812072754, 4.611236095428467, 4.606276035308838, 4.604675769805908, 4.6029157638549805, 4.605155944824219, 4.60493803024292, 4.611237049102783, 4.603236198425293, 4.600996017456055, 4.602756023406982], "compile_time": 1197.345116874203, "verification_time": 0, "benchmark_time": 149.4860139209777, "GFLOP/s": 1638.946013753952, "strategy_time": 0, "framework_time": 1.425368245691061, "timestamp": "2023-11-22 10:23:04.254942+00:00"}, "16,1,3,1,0,0": {"block_size_x": 16, "block_size_y": 1, "tile_size_x": 3, "tile_size_y": 1, "read_only": 0, "use_padding": 0, "time": 50.05089581012726, "times": [50.14695739746094, 50.08248519897461, 49.96919631958008, 50.05377197265625, 50.01479721069336, 50.059844970703125, 50.03719711303711, 50.0748176574707, 50.00519561767578, 49.97288131713867, 50.05287551879883, 50.09389877319336, 50.023597717285156, 50.066383361816406, 50.02311706542969, 49.97995376586914, 50.06887435913086, 50.04126739501953, 50.34360122680664, 50.03179931640625, 50.00167465209961, 50.028465270996094, 50.062477111816406, 50.051025390625, 50.02295684814453, 50.021907806396484, 50.070796966552734, 50.075408935546875, 50.090476989746094, 49.985313415527344, 50.09991455078125, 49.97573471069336], "compile_time": 667.7724837791175, "verification_time": 0, "benchmark_time": 1603.391069918871, "GFLOP/s": 150.84140009482888, "strategy_time": 0, "framework_time": 1.4080454129725695, "timestamp": "2023-11-22 10:23:06.527529+00:00"}, "16,1,3,1,0,1": {"block_size_x": 16, "block_size_y": 1, "tile_size_x": 3, "tile_size_y": 1, "read_only": 0, "use_padding": 1, "time": 54.078261971473694, "times": [54.26683044433594, 54.05318832397461, 54.16107177734375, 54.09941864013672, 54.18443298339844, 54.105350494384766, 54.018028259277344, 54.103816986083984, 54.17483139038086, 54.01719284057617, 54.0599479675293, 54.11600112915039, 54.04202651977539, 54.0274658203125, 53.98074722290039, 54.07264709472656, 54.078826904296875, 54.022342681884766, 54.178993225097656, 54.04591751098633, 54.046669006347656, 54.106544494628906, 54.05066680908203, 54.101158142089844, 54.12074661254883, 54.119083404541016, 54.01258850097656, 53.997432708740234, 54.05242919921875, 54.05015563964844, 53.93370819091797, 54.104122161865234], "compile_time": 673.7163171637803, "verification_time": 0, "benchmark_time": 1732.059432193637, "GFLOP/s": 139.60780033911766, "strategy_time": 0, "framework_time": 1.4452675823122263, "timestamp": "2023-11-22 10:23:08.934766+00:00"}, "16,1,3,1,1,0": {"block_size_x": 16, "block_size_y": 1, "tile_size_x": 3, "tile_size_y": 1, "read_only": 1, "use_padding": 0, "time": 50.06213879585266, "times": [50.131595611572266, 50.108943939208984, 50.05559539794922, 50.0623664855957, 50.06471633911133, 50.09756088256836, 50.075435638427734, 50.082061767578125, 50.01751708984375, 50.07575988769531, 50.093360900878906, 50.081111907958984, 49.9909553527832, 50.046592712402344, 50.054317474365234, 50.01668167114258, 50.07815933227539, 50.10905838012695, 50.02887725830078, 49.990535736083984, 50.00471496582031, 49.96632766723633, 50.047115325927734, 50.05058670043945, 50.17975997924805, 50.041534423828125, 49.95127487182617, 50.26045608520508, 50.070159912109375, 50.095245361328125, 50.01303482055664, 50.047027587890625], "compile_time": 665.8936471212655, "verification_time": 0, "benchmark_time": 1603.805162012577, "GFLOP/s": 150.8075240410114, "strategy_time": 0, "framework_time": 1.5357218217104673, "timestamp": "2023-11-22 10:23:11.206017+00:00"}, "16,1,3,1,1,1": {"block_size_x": 16, "block_size_y": 1, "tile_size_x": 3, "tile_size_y": 1, "read_only": 1, "use_padding": 1, "time": 54.07527685165405, "times": [54.114349365234375, 54.11793899536133, 54.0511474609375, 54.1855354309082, 54.08938980102539, 54.09501647949219, 54.011146545410156, 54.06262969970703, 54.123313903808594, 54.03652572631836, 54.01530838012695, 54.042213439941406, 54.0764274597168, 54.09709930419922, 53.99658966064453, 54.08009338378906, 54.03434753417969, 54.093727111816406, 53.99482727050781, 54.10693359375, 54.12027359008789, 54.126495361328125, 54.15243148803711, 54.05372619628906, 54.10331344604492, 54.07720184326172, 54.08987045288086, 54.18402099609375, 54.08379364013672, 53.96276092529297, 53.99178695678711, 54.03862380981445], "compile_time": 670.0247430708259, "verification_time": 0, "benchmark_time": 1732.092296006158, "GFLOP/s": 139.6155071144877, "strategy_time": 0, "framework_time": 1.4009508304297924, "timestamp": "2023-11-22 10:23:13.609551+00:00"}, "16,1,3,2,0,0": {"block_size_x": 16, "block_size_y": 1, "tile_size_x": 3, "tile_size_y": 2, "read_only": 0, "use_padding": 0, "time": 63.39782238006592, "times": [63.691654205322266, 63.46555709838867, 63.38547897338867, 63.491554260253906, 63.38652801513672, 63.57647705078125, 63.39883041381836, 63.421791076660156, 63.54949188232422, 63.437721252441406, 63.37403106689453, 63.3271369934082, 63.33442306518555, 63.21816635131836, 63.33325958251953, 63.33515167236328, 63.44474411010742, 63.48882293701172, 63.238887786865234, 63.35033416748047, 63.3012809753418, 63.30952835083008, 63.38291931152344, 63.3974723815918, 63.44411849975586, 63.45173645019531, 63.4633903503418, 63.278255462646484, 63.32819366455078, 63.38380813598633, 63.32148361206055, 63.418087005615234], "compile_time": 1116.6135848034173, "verification_time": 0, "benchmark_time": 2030.5592650547624, "GFLOP/s": 119.08527637967981, "strategy_time": 0, "framework_time": 1.5466141048818827, "timestamp": "2023-11-22 10:23:16.758285+00:00"}, "16,1,3,2,0,1": {"block_size_x": 16, "block_size_y": 1, "tile_size_x": 3, "tile_size_y": 2, "read_only": 0, "use_padding": 1, "time": 68.82046031951904, "times": [68.84552001953125, 68.77689361572266, 68.86382293701172, 69.0827865600586, 68.76190185546875, 68.84900665283203, 68.73040008544922, 68.81877899169922, 68.74046325683594, 68.84424591064453, 68.77740478515625, 68.77117919921875, 68.72008514404297, 68.73253631591797, 68.83330535888672, 68.82835388183594, 68.80191802978516, 68.80172729492188, 68.88456726074219, 68.8287582397461, 68.72733306884766, 68.7778549194336, 68.84241485595703, 68.91814422607422, 68.81983947753906, 68.82411193847656, 68.84820556640625, 68.74806213378906, 68.88165283203125, 68.83092498779297, 68.87506103515625, 68.86746978759766], "compile_time": 1139.3300520721823, "verification_time": 0, "benchmark_time": 2203.914575977251, "GFLOP/s": 109.70207355411601, "strategy_time": 0, "framework_time": 1.538907876238227, "timestamp": "2023-11-22 10:23:20.103085+00:00"}, "16,1,3,2,1,0": {"block_size_x": 16, "block_size_y": 1, "tile_size_x": 3, "tile_size_y": 2, "read_only": 1, "use_padding": 0, "time": 60.37522625923157, "times": [60.500160217285156, 60.39069747924805, 60.391361236572266, 60.312904357910156, 60.41312026977539, 60.441673278808594, 60.333438873291016, 60.15986251831055, 60.370880126953125, 60.407081604003906, 60.34832000732422, 60.396705627441406, 60.375518798828125, 60.399845123291016, 60.43824005126953, 60.41818618774414, 60.36975860595703, 60.35337448120117, 60.34703826904297, 60.37540054321289, 60.26688003540039, 60.36924362182617, 60.30160140991211, 60.239601135253906, 60.44047927856445, 60.32775115966797, 60.38032150268555, 60.42027282714844, 60.4505615234375, 60.343936920166016, 60.44736099243164, 60.47566223144531], "compile_time": 1103.4160919953138, "verification_time": 0, "benchmark_time": 1933.5607488173991, "GFLOP/s": 125.04710404866795, "strategy_time": 0, "framework_time": 1.5463631134480238, "timestamp": "2023-11-22 10:23:23.141624+00:00"}, "16,1,3,2,1,1": {"block_size_x": 16, "block_size_y": 1, "tile_size_x": 3, "tile_size_y": 2, "read_only": 1, "use_padding": 1, "time": 66.05077481269836, "times": [66.07108306884766, 66.04656219482422, 65.98689270019531, 66.03731536865234, 66.05867767333984, 66.02718353271484, 66.00271606445312, 66.10145568847656, 66.0637435913086, 66.01422119140625, 66.057373046875, 65.98473358154297, 66.21080017089844, 65.94043731689453, 66.10002136230469, 66.0873031616211, 66.0220718383789, 66.07989501953125, 66.03268432617188, 66.09007263183594, 66.12964630126953, 66.02608489990234, 66.01898956298828, 66.05413818359375, 66.00679779052734, 66.07054138183594, 66.06783294677734, 66.10301971435547, 66.05116271972656, 66.05516052246094, 65.98162841796875, 66.04454803466797], "compile_time": 1124.763289000839, "verification_time": 0, "benchmark_time": 2115.20200711675, "GFLOP/s": 114.30217467408951, "strategy_time": 0, "framework_time": 1.4987799804657698, "timestamp": "2023-11-22 10:23:26.383103+00:00"}, "16,1,3,3,0,0": {"block_size_x": 16, "block_size_y": 1, "tile_size_x": 3, "tile_size_y": 3, "read_only": 0, "use_padding": 0, "time": 11.823852211236954, "times": [11.996575355529785, 11.812093734741211, 11.808573722839355, 11.80825424194336, 11.809213638305664, 11.816900253295898, 11.815773963928223, 11.824254989624023, 11.81529426574707, 11.818814277648926, 11.814173698425293, 11.819347381591797, 11.814173698425293, 11.817694664001465, 11.820094108581543, 11.823134422302246, 11.821535110473633, 11.821704864501953, 11.816734313964844, 11.823775291442871, 11.816413879394531, 11.821853637695312, 11.822013854980469, 11.818989753723145, 11.821534156799316, 11.82553482055664, 11.819133758544922, 11.82409381866455, 11.819934844970703, 11.818663597106934, 11.81865406036377, 11.818334579467773], "compile_time": 917.3162539955229, "verification_time": 0, "benchmark_time": 380.1211169920862, "GFLOP/s": 638.5184003589792, "strategy_time": 0, "framework_time": 1.5996959991753101, "timestamp": "2023-11-22 10:23:27.682156+00:00"}, "16,1,3,3,0,1": {"block_size_x": 16, "block_size_y": 1, "tile_size_x": 3, "tile_size_y": 3, "read_only": 0, "use_padding": 1, "time": 11.8325816988945, "times": [11.851613998413086, 11.840574264526367, 11.8202543258667, 11.813055038452148, 11.815613746643066, 11.81808853149414, 11.822653770446777, 11.815773963928223, 11.81961441040039, 11.82745361328125, 11.830015182495117, 11.823973655700684, 11.831133842468262, 11.827613830566406, 11.825214385986328, 11.824414253234863, 11.829693794250488, 11.828715324401855, 11.828093528747559, 11.831774711608887, 11.82297420501709, 12.018335342407227, 11.829693794250488, 11.826780319213867, 11.8367338180542, 11.829215049743652, 11.828093528747559, 11.821534156799316, 11.82601547241211, 11.829071998596191, 11.82297420501709, 11.825854301452637], "compile_time": 920.5784080550075, "verification_time": 0, "benchmark_time": 380.1650709938258, "GFLOP/s": 638.0473333816373, "strategy_time": 0, "framework_time": 1.433033961802721, "timestamp": "2023-11-22 10:23:28.984347+00:00"}, "16,1,3,3,1,0": {"block_size_x": 16, "block_size_y": 1, "tile_size_x": 3, "tile_size_y": 3, "read_only": 1, "use_padding": 0, "time": 11.819207340478897, "times": [11.834653854370117, 11.817694664001465, 11.811774253845215, 11.811934471130371, 11.818174362182617, 11.820122718811035, 11.818814277648926, 11.81689453125, 11.819933891296387, 11.816893577575684, 11.822013854980469, 11.820711135864258, 11.820094108581543, 11.81865406036377, 11.817534446716309, 11.818014144897461, 11.81945514678955, 11.816478729248047, 11.817534446716309, 11.81977367401123, 11.81945514678955, 11.822013854980469, 11.825533866882324, 11.819267272949219, 11.819293975830078, 11.818015098571777, 11.81961441040039, 11.814654350280762, 11.815134048461914, 11.825270652770996, 11.820094108581543, 11.819133758544922], "compile_time": 916.0859130788594, "verification_time": 0, "benchmark_time": 379.8687590751797, "GFLOP/s": 638.7693338912266, "strategy_time": 0, "framework_time": 1.3739587739109993, "timestamp": "2023-11-22 10:23:30.281691+00:00"}, "16,1,3,3,1,1": {"block_size_x": 16, "block_size_y": 1, "tile_size_x": 3, "tile_size_y": 3, "read_only": 1, "use_padding": 1, "time": 11.820590734481812, "times": [11.839934349060059, 11.81241512298584, 11.818973541259766, 11.80665397644043, 11.813694953918457, 11.810746192932129, 11.809694290161133, 11.810654640197754, 11.809853553771973, 11.806333541870117, 11.814495086669922, 11.812289237976074, 11.814014434814453, 11.812734603881836, 11.81545352935791, 11.816253662109375, 11.818975448608398, 11.812865257263184, 11.812093734741211, 11.814973831176758, 11.813855171203613, 11.814973831176758, 11.809853553771973, 11.817606925964355, 11.815773963928223, 11.823934555053711, 11.814494132995605, 11.82121467590332, 11.813054084777832, 11.816129684448242, 11.99897575378418, 11.815934181213379], "compile_time": 924.2950109764934, "verification_time": 0, "benchmark_time": 379.91830497048795, "GFLOP/s": 638.69457708037, "strategy_time": 0, "framework_time": 1.4245170168578625, "timestamp": "2023-11-22 10:23:31.587344+00:00"}, "16,1,3,4,0,0": {"block_size_x": 16, "block_size_y": 1, "tile_size_x": 3, "tile_size_y": 4, "read_only": 0, "use_padding": 0, "time": 16.22637641429901, "times": [16.422529220581055, 16.223970413208008, 16.218368530273438, 16.209030151367188, 16.219968795776367, 16.228288650512695, 16.218048095703125, 16.219194412231445, 16.217248916625977, 16.223329544067383, 16.222209930419922, 16.203271865844727, 16.217729568481445, 16.214529037475586, 16.219648361206055, 16.220077514648438, 16.21660804748535, 16.225568771362305, 16.208450317382812, 16.224336624145508, 16.22732925415039, 16.219648361206055, 16.214689254760742, 16.219970703125, 16.215009689331055, 16.229248046875, 16.213890075683594, 16.220380783081055, 16.233888626098633, 16.23676872253418, 16.21436882019043, 16.2264461517334], "compile_time": 1257.8463938552886, "verification_time": 0, "benchmark_time": 520.9023631177843, "GFLOP/s": 465.27622725102134, "strategy_time": 0, "framework_time": 1.4016530476510525, "timestamp": "2023-11-22 10:23:33.367509+00:00"}, "16,1,3,4,0,1": {"block_size_x": 16, "block_size_y": 1, "tile_size_x": 3, "tile_size_y": 4, "read_only": 0, "use_padding": 1, "time": 17.60393464565277, "times": [17.648460388183594, 17.6241397857666, 17.620460510253906, 17.59526824951172, 17.596939086914062, 17.587020874023438, 17.61054039001465, 17.599821090698242, 17.60685920715332, 17.597259521484375, 17.610380172729492, 17.60128402709961, 17.609739303588867, 17.59950065612793, 17.598220825195312, 17.60833168029785, 17.609100341796875, 17.609739303588867, 17.59630012512207, 17.596216201782227, 17.598859786987305, 17.60845947265625, 17.598539352416992, 17.60468864440918, 17.59902000427246, 17.601900100708008, 17.604459762573242, 17.58957290649414, 17.593420028686523, 17.595020294189453, 17.60222053527832, 17.60416603088379], "compile_time": 1253.3875950612128, "verification_time": 0, "benchmark_time": 565.28728781268, "GFLOP/s": 428.8670318294088, "strategy_time": 0, "framework_time": 1.4850632287561893, "timestamp": "2023-11-22 10:23:35.187685+00:00"}, "16,1,3,4,1,0": {"block_size_x": 16, "block_size_y": 1, "tile_size_x": 3, "tile_size_y": 4, "read_only": 1, "use_padding": 0, "time": 16.203664541244507, "times": [16.224288940429688, 16.2030086517334, 16.19580841064453, 16.200843811035156, 16.192609786987305, 16.199169158935547, 16.202688217163086, 16.390235900878906, 16.211488723754883, 16.196449279785156, 16.195810317993164, 16.19993782043457, 16.18844985961914, 16.197250366210938, 16.202369689941406, 16.198001861572266, 16.190528869628906, 16.19516944885254, 16.205730438232422, 16.191177368164062, 16.195968627929688, 16.19148826599121, 16.18893051147461, 16.19010353088379, 16.197729110717773, 16.199970245361328, 16.1942081451416, 16.198902130126953, 16.19244956970215, 16.186370849609375, 16.20029067993164, 16.19983673095703], "compile_time": 1255.3768849465996, "verification_time": 0, "benchmark_time": 520.3339220024645, "GFLOP/s": 465.9283818659053, "strategy_time": 0, "framework_time": 1.3951710425317287, "timestamp": "2023-11-22 10:23:36.964806+00:00"}, "16,1,3,4,1,1": {"block_size_x": 16, "block_size_y": 1, "tile_size_x": 3, "tile_size_y": 4, "read_only": 1, "use_padding": 1, "time": 17.83799457550049, "times": [17.875022888183594, 17.838382720947266, 17.84846305847168, 17.83466148376465, 17.856462478637695, 17.850061416625977, 17.8388614654541, 17.833742141723633, 17.85198211669922, 17.825101852416992, 17.838224411010742, 17.831443786621094, 17.83614158630371, 17.83518409729004, 17.836624145507812, 17.836843490600586, 17.84046173095703, 17.826541900634766, 17.83342170715332, 17.835071563720703, 17.825101852416992, 17.82798194885254, 17.817262649536133, 17.844263076782227, 17.84606170654297, 17.831024169921875, 17.8265438079834, 17.83278465270996, 17.820781707763672, 17.841264724731445, 17.843503952026367, 17.856552124023438], "compile_time": 1255.3254880476743, "verification_time": 0, "benchmark_time": 572.1548569854349, "GFLOP/s": 423.23968471036346, "strategy_time": 0, "framework_time": 1.4390950091183186, "timestamp": "2023-11-22 10:23:38.793741+00:00"}, "16,1,4,1,0,0": {"block_size_x": 16, "block_size_y": 1, "tile_size_x": 4, "tile_size_y": 1, "read_only": 0, "use_padding": 0, "time": 14.39819809794426, "times": [14.417235374450684, 14.393875122070312, 14.385714530944824, 14.390034675598145, 14.386673927307129, 14.389715194702148, 14.384275436401367, 14.395635604858398, 14.394835472106934, 14.392215728759766, 14.391315460205078, 14.388915061950684, 14.39339542388916, 14.392595291137695, 14.390881538391113, 14.39787483215332, 14.590836524963379, 14.392754554748535, 14.396915435791016, 14.395090103149414, 14.388114929199219, 14.393714904785156, 14.386195182800293, 14.394515037536621, 14.391365051269531, 14.380274772644043, 14.390995025634766, 14.38475513458252, 14.395634651184082, 14.389678955078125, 14.388915061950684, 14.397395133972168], "compile_time": 804.4323050417006, "verification_time": 0, "benchmark_time": 462.2977569233626, "GFLOP/s": 524.3536134620856, "strategy_time": 0, "framework_time": 1.4532229397445917, "timestamp": "2023-11-22 10:23:40.061940+00:00"}, "16,1,4,1,0,1": {"block_size_x": 16, "block_size_y": 1, "tile_size_x": 4, "tile_size_y": 1, "read_only": 0, "use_padding": 1, "time": 14.394483625888824, "times": [14.434035301208496, 14.400755882263184, 14.396595001220703, 14.393876075744629, 14.391570091247559, 14.400435447692871, 14.389875411987305, 14.392595291137695, 14.391155242919922, 14.392266273498535, 14.391474723815918, 14.394035339355469, 14.392914772033691, 14.39323616027832, 14.388422012329102, 14.395315170288086, 14.394835472106934, 14.386835098266602, 14.40715503692627, 14.385720252990723, 14.398674964904785, 14.387795448303223, 14.389875411987305, 14.391955375671387, 14.390739440917969, 14.38475513458252, 14.394515037536621, 14.388594627380371, 14.385074615478516, 14.405681610107422, 14.39179515838623, 14.400915145874023], "compile_time": 804.7147719189525, "verification_time": 0, "benchmark_time": 462.2773570008576, "GFLOP/s": 524.4889220215998, "strategy_time": 0, "framework_time": 1.5300121158361435, "timestamp": "2023-11-22 10:23:41.330477+00:00"}, "16,1,4,1,1,0": {"block_size_x": 16, "block_size_y": 1, "tile_size_x": 4, "tile_size_y": 1, "read_only": 1, "use_padding": 0, "time": 14.334914326667786, "times": [14.364913940429688, 14.32763385772705, 14.32475471496582, 14.326515197753906, 14.325115203857422, 14.323314666748047, 14.338834762573242, 14.330835342407227, 14.327795028686523, 14.32718276977539, 14.32491397857666, 14.325554847717285, 14.329395294189453, 14.325875282287598, 14.33191967010498, 14.329073905944824, 14.327795028686523, 14.325394630432129, 14.332915306091309, 14.325350761413574, 14.326515197753906, 14.325394630432129, 14.325554847717285, 14.323474884033203, 14.32889175415039, 14.514355659484863, 14.329554557800293, 14.328754425048828, 14.334354400634766, 14.33021354675293, 14.327315330505371, 14.327795028686523], "compile_time": 793.9394970890135, "verification_time": 0, "benchmark_time": 460.4303331580013, "GFLOP/s": 526.668456326587, "strategy_time": 0, "framework_time": 1.4741627965122461, "timestamp": "2023-11-22 10:23:42.586335+00:00"}, "16,1,4,1,1,1": {"block_size_x": 16, "block_size_y": 1, "tile_size_x": 4, "tile_size_y": 1, "read_only": 1, "use_padding": 1, "time": 14.32723131775856, "times": [14.353553771972656, 14.3237943649292, 14.336274147033691, 14.329554557800293, 14.315568923950195, 14.320274353027344, 14.322195053100586, 14.32795524597168, 14.323795318603516, 14.329221725463867, 14.32475471496582, 14.32475471496582, 14.32907485961914, 14.325235366821289, 14.322656631469727, 14.324435234069824, 14.327795028686523, 14.325394630432129, 14.325875282287598, 14.326218605041504, 14.329713821411133, 14.334834098815918, 14.32219409942627, 14.326193809509277, 14.322498321533203, 14.32971477508545, 14.32971477508545, 14.327315330505371, 14.32907485961914, 14.327136039733887, 14.324914932250977, 14.32971477508545], "compile_time": 797.0953141339123, "verification_time": 0, "benchmark_time": 460.0723700132221, "GFLOP/s": 526.9508834300811, "strategy_time": 0, "framework_time": 1.3522577937692404, "timestamp": "2023-11-22 10:23:43.844872+00:00"}, "16,1,4,2,0,0": {"block_size_x": 16, "block_size_y": 1, "tile_size_x": 4, "tile_size_y": 2, "read_only": 0, "use_padding": 0, "time": 7.9239819049835205, "times": [7.95222282409668, 7.926464080810547, 7.919743061065674, 7.918142795562744, 7.918943881988525, 7.920063018798828, 7.920703887939453, 7.925118923187256, 7.923263072967529, 7.920544147491455, 7.924063205718994, 7.923742771148682, 7.922783851623535, 7.921343803405762, 7.925502777099609, 7.918553829193115, 7.922782897949219, 7.922304153442383, 7.9219841957092285, 7.929343223571777, 7.925182819366455, 7.925662994384766, 7.923102855682373, 7.923344135284424, 7.923583984375, 7.919424057006836, 7.923742771148682, 7.926464080810547, 7.926303863525391, 7.927264213562012, 7.922143936157227, 7.923586845397949], "compile_time": 1243.0893459822983, "verification_time": 0, "benchmark_time": 255.16591896302998, "GFLOP/s": 952.7718879887701, "strategy_time": 0, "framework_time": 1.4566690661013126, "timestamp": "2023-11-22 10:23:45.344599+00:00"}, "16,1,4,2,0,1": {"block_size_x": 16, "block_size_y": 1, "tile_size_x": 4, "tile_size_y": 2, "read_only": 0, "use_padding": 1, "time": 7.929004907608032, "times": [7.9560627937316895, 8.139425277709961, 7.924863815307617, 7.921023845672607, 7.914463996887207, 7.925023078918457, 7.919424057006836, 7.926613807678223, 7.921823024749756, 7.924222946166992, 7.9154229164123535, 7.923583984375, 7.917664051055908, 7.918942928314209, 7.918942928314209, 7.927159786224365, 7.920863151550293, 7.924863815307617, 7.920223236083984, 7.923583984375, 7.913022994995117, 7.922303199768066, 7.921342849731445, 7.9266180992126465, 7.920863151550293, 7.920382976531982, 7.920224189758301, 7.921184062957764, 7.917183876037598, 7.920864105224609, 7.917983055114746, 7.921987056732178], "compile_time": 1235.3623181115836, "verification_time": 0, "benchmark_time": 255.29317511245608, "GFLOP/s": 952.1683096394445, "strategy_time": 0, "framework_time": 1.3335219118744135, "timestamp": "2023-11-22 10:23:46.836604+00:00"}, "16,1,4,2,1,0": {"block_size_x": 16, "block_size_y": 1, "tile_size_x": 4, "tile_size_y": 2, "read_only": 1, "use_padding": 0, "time": 7.752639979124069, "times": [7.784381866455078, 7.758461952209473, 7.746781826019287, 7.747581958770752, 7.748541831970215, 7.750942230224609, 7.74982213973999, 7.7501420974731445, 7.753005027770996, 7.753022193908691, 7.754143238067627, 7.752222061157227, 7.7487030029296875, 7.748702049255371, 7.751582145690918, 7.751421928405762, 7.7507829666137695, 7.74990701675415, 7.750462055206299, 7.752862930297852, 7.751262187957764, 7.75350284576416, 7.751741886138916, 7.754143238067627, 7.751101970672607, 7.750943183898926, 7.75399923324585, 7.751421928405762, 7.75510311126709, 7.751582145690918, 7.752542972564697, 7.753662109375], "compile_time": 1237.390564987436, "verification_time": 0, "benchmark_time": 249.7252479661256, "GFLOP/s": 973.8292014500338, "strategy_time": 0, "framework_time": 1.4046290889382362, "timestamp": "2023-11-22 10:23:48.325139+00:00"}, "16,1,4,2,1,1": {"block_size_x": 16, "block_size_y": 1, "tile_size_x": 4, "tile_size_y": 2, "read_only": 1, "use_padding": 1, "time": 7.758111089468002, "times": [7.780221939086914, 7.749022006988525, 7.749502182006836, 7.753182888031006, 7.746781826019287, 7.745983123779297, 7.743902206420898, 7.752542018890381, 7.749640941619873, 7.749981880187988, 7.952544212341309, 7.754302024841309, 7.751582145690918, 7.751421928405762, 7.748541831970215, 7.754461765289307, 7.758537769317627, 7.749502182006836, 7.751262187957764, 7.749661922454834, 7.74966287612915, 7.759582042694092, 7.7578229904174805, 7.750942230224609, 7.753023147583008, 7.7487688064575195, 7.745341777801514, 7.753663063049316, 7.752542018890381, 7.748542785644531, 7.746622085571289, 7.750462055206299], "compile_time": 1236.5324550773948, "verification_time": 0, "benchmark_time": 249.95632586069405, "GFLOP/s": 973.142445749344, "strategy_time": 0, "framework_time": 1.431429060176015, "timestamp": "2023-11-22 10:23:49.813075+00:00"}, "16,1,4,3,0,0": {"block_size_x": 16, "block_size_y": 1, "tile_size_x": 4, "tile_size_y": 3, "read_only": 0, "use_padding": 0, "time": 12.083779573440552, "times": [12.1448974609375, 12.095457077026367, 12.089217185974121, 12.073217391967773, 12.079936981201172, 12.08423900604248, 12.080257415771484, 12.076416969299316, 12.073057174682617, 12.076577186584473, 12.08057689666748, 12.08556842803955, 12.074176788330078, 12.085697174072266, 12.077695846557617, 12.077536582946777, 12.093216896057129, 12.093878746032715, 12.082656860351562, 12.086816787719727, 12.093216896057129, 12.080256462097168, 12.082977294921875, 12.08632755279541, 12.077056884765625, 12.073376655578613, 12.077376365661621, 12.07625675201416, 12.079936981201172, 12.076155662536621, 12.0848970413208, 12.082016944885254], "compile_time": 1174.9670240096748, "verification_time": 0, "benchmark_time": 388.31082289107144, "GFLOP/s": 624.7835914347451, "strategy_time": 0, "framework_time": 1.4519600663334131, "timestamp": "2023-11-22 10:23:51.377819+00:00"}, "16,1,4,3,0,1": {"block_size_x": 16, "block_size_y": 1, "tile_size_x": 4, "tile_size_y": 3, "read_only": 0, "use_padding": 1, "time": 12.085427641868591, "times": [12.137697219848633, 12.089536666870117, 12.085057258605957, 12.081697463989258, 12.083136558532715, 12.077730178833008, 12.068416595458984, 12.07193660736084, 12.074816703796387, 12.07945728302002, 12.081056594848633, 12.080263137817383, 12.072736740112305, 12.078657150268555, 12.068096160888672, 12.078336715698242, 12.076577186584473, 12.06945514678955, 12.082337379455566, 12.267139434814453, 12.080737113952637, 12.086977005004883, 12.074816703796387, 12.080404281616211, 12.074976921081543, 12.077217102050781, 12.077217102050781, 12.077056884765625, 12.072577476501465, 12.077131271362305, 12.073857307434082, 12.076577186584473], "compile_time": 1177.1444878540933, "verification_time": 0, "benchmark_time": 388.605291955173, "GFLOP/s": 624.6983907995741, "strategy_time": 0, "framework_time": 1.4196892734616995, "timestamp": "2023-11-22 10:23:52.945003+00:00"}, "16,1,4,3,1,0": {"block_size_x": 16, "block_size_y": 1, "tile_size_x": 4, "tile_size_y": 3, "read_only": 1, "use_padding": 0, "time": 12.207524061203003, "times": [12.262818336486816, 12.208897590637207, 12.200258255004883, 12.206018447875977, 12.212738037109375, 12.197155952453613, 12.211777687072754, 12.207138061523438, 12.202017784118652, 12.203618049621582, 12.20313835144043, 12.196441650390625, 12.204578399658203, 12.209378242492676, 12.205537796020508, 12.21785831451416, 12.214497566223145, 12.200613021850586, 12.2015380859375, 12.206337928771973, 12.200258255004883, 12.217698097229004, 12.206658363342285, 12.207439422607422, 12.209538459777832, 12.20921802520752, 12.200258255004883, 12.202817916870117, 12.206177711486816, 12.200311660766602, 12.205698013305664, 12.202338218688965], "compile_time": 1181.9225158542395, "verification_time": 0, "benchmark_time": 392.6425271201879, "GFLOP/s": 618.450323108026, "strategy_time": 0, "framework_time": 1.4217630960047245, "timestamp": "2023-11-22 10:23:54.521005+00:00"}, "16,1,4,3,1,1": {"block_size_x": 16, "block_size_y": 1, "tile_size_x": 4, "tile_size_y": 3, "read_only": 1, "use_padding": 1, "time": 12.213875710964203, "times": [12.275137901306152, 12.21513843536377, 12.210658073425293, 12.2015380859375, 12.204418182373047, 12.209527969360352, 12.202817916870117, 12.203937530517578, 12.206977844238281, 12.199137687683105, 12.209538459777832, 12.205120086669922, 12.20585823059082, 12.202498435974121, 12.191617012023926, 12.2048978805542, 12.205377578735352, 12.203252792358398, 12.208738327026367, 12.201377868652344, 12.20921802520752, 12.205218315124512, 12.20329761505127, 12.217535018920898, 12.202657699584961, 12.206658363342285, 12.200898170471191, 12.201377868652344, 12.423619270324707, 12.20322036743164, 12.203618049621582, 12.199137687683105], "compile_time": 1177.9874491039664, "verification_time": 0, "benchmark_time": 392.76680909097195, "GFLOP/s": 618.1287069445705, "strategy_time": 0, "framework_time": 1.4286348596215248, "timestamp": "2023-11-22 10:23:56.093202+00:00"}, "16,1,4,4,0,0": {"block_size_x": 16, "block_size_y": 1, "tile_size_x": 4, "tile_size_y": 4, "read_only": 0, "use_padding": 0, "time": 26.879439055919647, "times": [26.94549560546875, 26.892215728759766, 26.88942527770996, 26.873336791992188, 26.86181640625, 26.87296485900879, 26.880695343017578, 26.87941551208496, 26.890047073364258, 26.888696670532227, 26.85797691345215, 26.878047943115234, 26.88101577758789, 26.877656936645508, 26.866004943847656, 26.877336502075195, 26.86373519897461, 26.866445541381836, 26.870935440063477, 26.87125587463379, 26.873132705688477, 26.880056381225586, 26.876375198364258, 26.865924835205078, 26.880535125732422, 26.86805534362793, 26.885852813720703, 26.91717529296875, 26.869016647338867, 26.886571884155273, 26.87477684020996, 26.880056381225586], "compile_time": 1711.896070977673, "verification_time": 0, "benchmark_time": 861.9305640459061, "GFLOP/s": 280.87443284413786, "strategy_time": 0, "framework_time": 1.433773897588253, "timestamp": "2023-11-22 10:23:58.668478+00:00"}, "16,1,4,4,0,1": {"block_size_x": 16, "block_size_y": 1, "tile_size_x": 4, "tile_size_y": 4, "read_only": 0, "use_padding": 1, "time": 26.87655597925186, "times": [26.949495315551758, 26.917015075683594, 26.883819580078125, 26.882776260375977, 26.884376525878906, 26.864078521728516, 26.87045669555664, 26.878456115722656, 26.893463134765625, 26.866615295410156, 26.88373565673828, 26.870664596557617, 26.876855850219727, 26.87749671936035, 26.873023986816406, 26.863256454467773, 26.8685359954834, 26.871776580810547, 26.878135681152344, 26.869815826416016, 26.86865997314453, 26.871416091918945, 26.877975463867188, 26.86536407470703, 26.852535247802734, 26.877016067504883, 26.892175674438477, 26.861495971679688, 26.866775512695312, 26.86457633972168, 26.85381507873535, 26.874135971069336], "compile_time": 1708.6267229169607, "verification_time": 0, "benchmark_time": 861.9285910390317, "GFLOP/s": 280.90456254247187, "strategy_time": 0, "framework_time": 1.5585359651595354, "timestamp": "2023-11-22 10:24:01.240607+00:00"}, "16,1,4,4,1,0": {"block_size_x": 16, "block_size_y": 1, "tile_size_x": 4, "tile_size_y": 4, "read_only": 1, "use_padding": 0, "time": 27.79330539703369, "times": [27.855424880981445, 27.80726432800293, 27.782115936279297, 27.78438377380371, 27.752704620361328, 27.99679946899414, 27.788223266601562, 27.772384643554688, 27.77281379699707, 27.77782440185547, 27.7840633392334, 27.783910751342773, 27.780704498291016, 27.786144256591797, 27.773080825805664, 27.79110336303711, 