processed_cache_files/convolution_A100_processed.json
{"device_name": "NVIDIA A100-PCIE-40GB", "kernel_name": "convolution_kernel", "problem_size": [4096, 4096], "tune_params_keys": ["block_size_x", "block_size_y", "tile_size_x", "tile_size_y", "read_only", "use_padding"], "tune_params": {"block_size_x": [16, 32, 48, 64, 80, 96, 112, 128, 144, 160, 176, 192, 208, 224, 240, 256], "block_size_y": [1, 2, 4, 8, 16], "tile_size_x": [1, 2, 3, 4], "tile_size_y": [1, 2, 3, 4], "read_only": [0, 1], "use_padding": [0, 1]}, "objective": "time", "cache": {"16,1,1,1,0,0": {"block_size_x": 16, "block_size_y": 1, "tile_size_x": 1, "tile_size_y": 1, "read_only": 0, "use_padding": 0, "time": 4.146815985441208, "times": [4.1943039894104, 4.154367923736572, 4.150271892547607, 4.149248123168945, 4.146175861358643, 4.149248123168945, 4.146175861358643, 4.1451520919799805, 4.1451520919799805, 4.146175861358643, 4.147200107574463, 4.1451520919799805, 4.146175861358643, 4.14412784576416, 4.14412784576416, 4.14412784576416, 4.143104076385498, 4.1451520919799805, 4.14412784576416, 4.143104076385498, 4.1451520919799805, 4.143104076385498, 4.143104076385498, 4.14412784576416, 4.142079830169678, 4.143104076385498, 4.143104076385498, 4.143104076385498, 4.1451520919799805, 4.1451520919799805, 4.14412784576416, 4.14412784576416], "compile_time": 1034.7906979732215, "verification_time": 0, "benchmark_time": 133.94198194146156, "GFLOP/s": 1820.6130261159228, "strategy_time": 0, "framework_time": 73.70227831415832, "timestamp": "2023-06-23 07:44:25.158307+00:00"}, "16,1,1,1,0,1": {"block_size_x": 16, "block_size_y": 1, "tile_size_x": 1, "tile_size_y": 1, "read_only": 0, "use_padding": 1, "time": 4.164224073290825, "times": [4.212736129760742, 4.170752048492432, 4.166656017303467, 4.164608001708984, 4.163584232330322, 4.163584232330322, 4.1656317710876465, 4.162559986114502, 4.162559986114502, 4.16153621673584, 4.163584232330322, 4.162559986114502, 4.1605119705200195, 4.162559986114502, 4.163584232330322, 4.163584232330322, 4.159488201141357, 4.1656317710876465, 4.162559986114502, 4.16153621673584, 4.1605119705200195, 4.16153621673584, 4.159488201141357, 4.1605119705200195, 4.162559986114502, 4.16153621673584, 4.16153621673584, 4.16153621673584, 4.1605119705200195, 4.1605119705200195, 4.162559986114502, 4.162559986114502], "compile_time": 1032.546625006944, "verification_time": 0, "benchmark_time": 135.34249807707965, "GFLOP/s": 1813.0021504903618, "strategy_time": 0, "framework_time": 1.6041379421949387, "timestamp": "2023-06-23 07:44:26.327837+00:00"}, "16,1,1,1,1,0": {"block_size_x": 16, "block_size_y": 1, "tile_size_x": 1, "tile_size_y": 1, "read_only": 1, "use_padding": 0, "time": 4.204319939017296, "times": [4.256768226623535, 4.208640098571777, 4.207615852355957, 4.205567836761475, 4.205567836761475, 4.205567836761475, 4.2045440673828125, 4.203519821166992, 4.203519821166992, 4.20147180557251, 4.2045440673828125, 4.20147180557251, 4.200448036193848, 4.200448036193848, 4.200448036193848, 4.20147180557251, 4.20147180557251, 4.203519821166992, 4.20249605178833, 4.20147180557251, 4.20147180557251, 4.200448036193848, 4.200448036193848, 4.20249605178833, 4.200448036193848, 4.199423789978027, 4.20249605178833, 4.20147180557251, 4.20249605178833, 4.20147180557251, 4.20249605178833, 4.20249605178833], "compile_time": 1032.4971529189497, "verification_time": 0, "benchmark_time": 135.8997500501573, "GFLOP/s": 1795.7118652974475, "strategy_time": 0, "framework_time": 1.5967530198395252, "timestamp": "2023-06-23 07:44:27.497865+00:00"}, "16,1,1,1,1,1": {"block_size_x": 16, "block_size_y": 1, "tile_size_x": 1, "tile_size_y": 1, "read_only": 1, "use_padding": 1, "time": 4.229599952697754, "times": [4.275199890136719, 4.236288070678711, 4.233215808868408, 4.231167793273926, 4.231167793273926, 4.229119777679443, 4.229119777679443, 4.229119777679443, 4.228096008300781, 4.226047992706299, 4.228096008300781, 4.228096008300781, 4.228096008300781, 4.229119777679443, 4.226047992706299, 4.226047992706299, 4.225024223327637, 4.232192039489746, 4.229119777679443, 4.228096008300781, 4.227071762084961, 4.227071762084961, 4.225024223327637, 4.225024223327637, 4.225024223327637, 4.231167793273926, 4.228096008300781, 4.225024223327637, 4.226047992706299, 4.227071762084961, 4.227071762084961, 4.225024223327637], "compile_time": 1026.362620992586, "verification_time": 0, "benchmark_time": 137.0699959807098, "GFLOP/s": 1784.979025069396, "strategy_time": 0, "framework_time": 1.5661059878766537, "timestamp": "2023-06-23 07:44:28.662895+00:00"}, "16,1,1,2,0,0": {"block_size_x": 16, "block_size_y": 1, "tile_size_x": 1, "tile_size_y": 2, "read_only": 0, "use_padding": 0, "time": 3.925952062010765, "times": [3.970047950744629, 3.9290881156921387, 3.926016092300415, 3.924992084503174, 3.924992084503174, 3.924992084503174, 3.926016092300415, 3.9239680767059326, 3.92192006111145, 3.935231924057007, 3.930111885070801, 3.920896053314209, 3.9229440689086914, 3.926016092300415, 3.9239680767059326, 3.9229440689086914, 3.9239680767059326, 3.924992084503174, 3.9239680767059326, 3.92192006111145, 3.924992084503174, 3.9239680767059326, 3.9229440689086914, 3.9229440689086914, 3.920896053314209, 3.924992084503174, 3.9239680767059326, 3.9229440689086914, 3.9229440689086914, 3.9229440689086914, 3.924992084503174, 3.9229440689086914], "compile_time": 1148.0011041276157, "verification_time": 0, "benchmark_time": 128.34490393288434, "GFLOP/s": 1923.0360128577895, "strategy_time": 0, "framework_time": 1.6475389711558819, "timestamp": "2023-06-23 07:44:29.940921+00:00"}, "16,1,1,2,0,1": {"block_size_x": 16, "block_size_y": 1, "tile_size_x": 1, "tile_size_y": 2, "read_only": 0, "use_padding": 1, "time": 2.709760010242462, "times": [2.7586560249328613, 2.716671943664551, 2.7105278968811035, 2.708479881286621, 2.7115519046783447, 2.7095038890838623, 2.7095038890838623, 2.7095038890838623, 2.708479881286621, 2.7095038890838623, 2.708479881286621, 2.707456111907959, 2.708479881286621, 2.707456111907959, 2.7064321041107178, 2.707456111907959, 2.7054080963134766, 2.7095038890838623, 2.708479881286621, 2.7064321041107178, 2.707456111907959, 2.7054080963134766, 2.7064321041107178, 2.707456111907959, 2.707456111907959, 2.7064321041107178, 2.707456111907959, 2.7064321041107178, 2.707456111907959, 2.7064321041107178, 2.707456111907959, 2.708479881286621], "compile_time": 1158.0266759265214, "verification_time": 0, "benchmark_time": 88.77136395312846, "GFLOP/s": 2786.1313073715587, "strategy_time": 0, "framework_time": 1.5597741585224867, "timestamp": "2023-06-23 07:44:31.189311+00:00"}, "16,1,1,2,1,0": {"block_size_x": 16, "block_size_y": 1, "tile_size_x": 1, "tile_size_y": 2, "read_only": 1, "use_padding": 0, "time": 3.3052799478173256, "times": [3.348479986190796, 3.3075199127197266, 3.304447889328003, 3.3034238815307617, 3.304447889328003, 3.305471897125244, 3.3034238815307617, 3.304447889328003, 3.309567928314209, 3.3034238815307617, 3.3034238815307617, 3.3034238815307617, 3.3024001121520996, 3.3024001121520996, 3.304447889328003, 3.3034238815307617, 3.3034238815307617, 3.305471897125244, 3.3024001121520996, 3.3034238815307617, 3.3024001121520996, 3.304447889328003, 3.305471897125244, 3.3024001121520996, 3.3034238815307617, 3.3024001121520996, 3.3034238815307617, 3.3034238815307617, 3.3024001121520996, 3.3034238815307617, 3.304447889328003, 3.3024001121520996], "compile_time": 1159.436710877344, "verification_time": 0, "benchmark_time": 107.25063108839095, "GFLOP/s": 2284.1475818063614, "strategy_time": 0, "framework_time": 0.49108779057860374, "timestamp": "2023-06-23 07:45:23.192706+00:00"}, "16,1,1,2,1,1": {"block_size_x": 16, "block_size_y": 1, "tile_size_x": 1, "tile_size_y": 2, "read_only": 1, "use_padding": 1, "time": 2.6480319425463676, "times": [2.6951680183410645, 2.6521599292755127, 2.649087905883789, 2.6470398902893066, 2.649087905883789, 2.648063898086548, 2.6470398902893066, 2.6470398902893066, 2.6470398902893066, 2.648063898086548, 2.6470398902893066, 2.6449921131134033, 2.6470398902893066, 2.6449921131134033, 2.6460158824920654, 2.6460158824920654, 2.6460158824920654, 2.6460158824920654, 2.6460158824920654, 2.6460158824920654, 2.6470398902893066, 2.6470398902893066, 2.6460158824920654, 2.6449921131134033, 2.6460158824920654, 2.6460158824920654, 2.6449921131134033, 2.643968105316162, 2.6449921131134033, 2.6460158824920654, 2.6460158824920654, 2.643968105316162], "compile_time": 1160.6915260199457, "verification_time": 0, "benchmark_time": 86.71818696893752, "GFLOP/s": 2851.0785986743444, "strategy_time": 0, "framework_time": 1.6373090911656618, "timestamp": "2023-06-23 07:45:24.441785+00:00"}, "16,1,1,3,0,0": {"block_size_x": 16, "block_size_y": 1, "tile_size_x": 1, "tile_size_y": 3, "read_only": 0, "use_padding": 0, "time": 2.5795520693063736, "times": [2.6265599727630615, 2.589695930480957, 2.5804800987243652, 2.5804800987243652, 2.5804800987243652, 2.5815041065216064, 2.579456090927124, 2.578432083129883, 2.578432083129883, 2.578432083129883, 2.578432083129883, 2.5774080753326416, 2.575360059738159, 2.578432083129883, 2.5774080753326416, 2.5763840675354004, 2.5774080753326416, 2.578432083129883, 2.5774080753326416, 2.5774080753326416, 2.5763840675354004, 2.5774080753326416, 2.574336051940918, 2.5763840675354004, 2.5774080753326416, 2.5763840675354004, 2.575360059738159, 2.5774080753326416, 2.5763840675354004, 2.5774080753326416, 2.5774080753326416, 2.575360059738159], "compile_time": 1292.2070629429072, "verification_time": 0, "benchmark_time": 83.97603407502174, "GFLOP/s": 2926.7667397890837, "strategy_time": 0, "framework_time": 1.589450053870678, "timestamp": "2023-06-23 07:45:25.819589+00:00"}, "16,1,1,3,0,1": {"block_size_x": 16, "block_size_y": 1, "tile_size_x": 1, "tile_size_y": 3, "read_only": 0, "use_padding": 1, "time": 2.5001599565148354, "times": [2.545664072036743, 2.504703998565674, 2.5026559829711914, 2.500607967376709, 2.500607967376709, 2.500607967376709, 2.4985599517822266, 2.4995839595794678, 2.4995839595794678, 2.4995839595794678, 2.4985599517822266, 2.4975359439849854, 2.4985599517822266, 2.4985599517822266, 2.4975359439849854, 2.496511936187744, 2.496511936187744, 2.500607967376709, 2.4975359439849854, 2.4975359439849854, 2.496511936187744, 2.4975359439849854, 2.496511936187744, 2.4985599517822266, 2.4975359439849854, 2.496511936187744, 2.4985599517822266, 2.4975359439849854, 2.4985599517822266, 2.4975359439849854, 2.4995839595794678, 2.4985599517822266], "compile_time": 1284.4757279381156, "verification_time": 0, "benchmark_time": 81.96408487856388, "GFLOP/s": 3019.7056713619922, "strategy_time": 0, "framework_time": 1.4039133675396442, "timestamp": "2023-06-23 07:45:27.187464+00:00"}, "16,1,1,3,1,0": {"block_size_x": 16, "block_size_y": 1, "tile_size_x": 1, "tile_size_y": 3, "read_only": 1, "use_padding": 0, "time": 3.9347519874572754, "times": [3.655679941177368, 3.94649600982666, 3.94649600982666, 3.9423999786376953, 3.949568033218384, 3.949568033218384, 3.94649600982666, 3.941375970840454, 3.945472002029419, 3.94649600982666, 3.9434239864349365, 3.9444479942321777, 3.941375970840454, 3.9434239864349365, 3.941375970840454, 3.9434239864349365, 3.9434239864349365, 3.94649600982666, 3.941375970840454, 3.9423999786376953, 3.9444479942321777, 3.941375970840454, 3.9423999786376953, 3.9423999786376953, 3.9434239864349365, 3.9423999786376953, 3.940351963043213, 3.9423999786376953, 3.940351963043213, 3.9434239864349365, 3.9434239864349365, 3.9444479942321777], "compile_time": 1279.5786180067807, "verification_time": 0, "benchmark_time": 127.76175397448242, "GFLOP/s": 1918.735214841029, "strategy_time": 0, "framework_time": 1.5468411147594452, "timestamp": "2023-06-23 07:45:28.596384+00:00"}, "16,1,1,3,1,1": {"block_size_x": 16, "block_size_y": 1, "tile_size_x": 1, "tile_size_y": 3, "read_only": 1, "use_padding": 1, "time": 2.631295993924141, "times": [2.6798079013824463, 2.6357760429382324, 2.632704019546509, 2.6306560039520264, 2.6316800117492676, 2.632704019546509, 2.629631996154785, 2.6275839805603027, 2.6306560039520264, 2.628607988357544, 2.6306560039520264, 2.629631996154785, 2.628607988357544, 2.6306560039520264, 2.629631996154785, 2.628607988357544, 2.629631996154785, 2.6306560039520264, 2.628607988357544, 2.6306560039520264, 2.6316800117492676, 2.6265599727630615, 2.629631996154785, 2.6265599727630615, 2.6255359649658203, 2.6275839805603027, 2.6316800117492676, 2.6275839805603027, 2.6306560039520264, 2.629631996154785, 2.628607988357544, 2.628607988357544], "compile_time": 1285.7573230285197, "verification_time": 0, "benchmark_time": 85.88414895348251, "GFLOP/s": 2869.2124403460994, "strategy_time": 0, "framework_time": 1.573499059304595, "timestamp": "2023-06-23 07:45:29.969633+00:00"}, "16,1,1,4,0,0": {"block_size_x": 16, "block_size_y": 1, "tile_size_x": 1, "tile_size_y": 4, "read_only": 0, "use_padding": 0, "time": 2.35180801153183, "times": [2.4053759574890137, 2.3562240600585938, 2.352128028869629, 2.3511040210723877, 2.352128028869629, 2.352128028869629, 2.35315203666687, 2.3500800132751465, 2.352128028869629, 2.3500800132751465, 2.3500800132751465, 2.3511040210723877, 2.3500800132751465, 2.3500800132751465, 2.348031997680664, 2.352128028869629, 2.3490560054779053, 2.3490560054779053, 2.348031997680664, 2.3500800132751465, 2.3490560054779053, 2.348031997680664, 2.3490560054779053, 2.347007989883423, 2.348031997680664, 2.3500800132751465, 2.3490560054779053, 2.348031997680664, 2.348031997680664, 2.348031997680664, 2.352128028869629, 2.3490560054779053], "compile_time": 1392.5623309332877, "verification_time": 0, "benchmark_time": 76.80847099982202, "GFLOP/s": 3210.1885710826105, "strategy_time": 0, "framework_time": 1.9384820479899645, "timestamp": "2023-06-23 07:45:31.440976+00:00"}, "16,1,1,4,0,1": {"block_size_x": 16, "block_size_y": 1, "tile_size_x": 1, "tile_size_y": 4, "read_only": 0, "use_padding": 1, "time": 3.7002240270376205, "times": [3.744767904281616, 3.7017600536346436, 3.699712038040161, 3.69868803024292, 3.7027840614318848, 3.7027840614318848, 3.699712038040161, 3.699712038040161, 3.69868803024292, 3.6976640224456787, 3.69868803024292, 3.69868803024292, 3.699712038040161, 3.6976640224456787, 3.6966400146484375, 3.69868803024292, 3.6966400146484375, 3.6976640224456787, 3.6976640224456787, 3.699712038040161, 3.69868803024292, 3.6976640224456787, 3.69868803024292, 3.6976640224456787, 3.6976640224456787, 3.6976640224456787, 3.7007360458374023, 3.6966400146484375, 3.69868803024292, 3.6976640224456787, 3.6966400146484375, 3.7007360458374023], "compile_time": 1393.5053232125938, "verification_time": 0, "benchmark_time": 120.43991382233799, "GFLOP/s": 2040.3486774946127, "strategy_time": 0, "framework_time": 1.6505240928381681, "timestamp": "2023-06-23 07:45:32.956606+00:00"}, "16,1,1,4,1,0": {"block_size_x": 16, "block_size_y": 1, "tile_size_x": 1, "tile_size_y": 4, "read_only": 1, "use_padding": 0, "time": 2.4893440902233124, "times": [2.535423994064331, 2.496511936187744, 2.4883201122283936, 2.4883201122283936, 2.4872961044311523, 2.4883201122283936, 2.4883201122283936, 2.4872961044311523, 2.4883201122283936, 2.4893438816070557, 2.4872961044311523, 2.4872961044311523, 2.4872961044311523, 2.486272096633911, 2.4883201122283936, 2.4872961044311523, 2.4883201122283936, 2.4872961044311523, 2.4872961044311523, 2.48524808883667, 2.4872961044311523, 2.486272096633911, 2.486272096633911, 2.4872961044311523, 2.4883201122283936, 2.4883201122283936, 2.4872961044311523, 2.4872961044311523, 2.4883201122283936, 2.4883201122283936, 2.4872961044311523, 2.4872961044311523], "compile_time": 1399.4441300164908, "verification_time": 0, "benchmark_time": 81.66196011006832, "GFLOP/s": 3032.825887610713, "strategy_time": 0, "framework_time": 1.8066647462546825, "timestamp": "2023-06-23 07:45:34.439553+00:00"}, "16,1,1,4,1,1": {"block_size_x": 16, "block_size_y": 1, "tile_size_x": 1, "tile_size_y": 4, "read_only": 1, "use_padding": 1, "time": 2.4895680397748947, "times": [2.53439998626709, 2.4924159049987793, 2.490367889404297, 2.490367889404297, 2.4872961044311523, 2.4893438816070557, 2.4883201122283936, 2.4872961044311523, 2.490367889404297, 2.4893438816070557, 2.4872961044311523, 2.4883201122283936, 2.4883201122283936, 2.48524808883667, 2.4883201122283936, 2.4883201122283936, 2.486272096633911, 2.4883201122283936, 2.4883201122283936, 2.4872961044311523, 2.4872961044311523, 2.4883201122283936, 2.486272096633911, 2.4872961044311523, 2.486272096633911, 2.4893438816070557, 2.4872961044311523, 2.4893438816070557, 2.4893438816070557, 2.486272096633911, 2.486272096633911, 2.4872961044311523], "compile_time": 1392.8320449776947, "verification_time": 0, "benchmark_time": 81.7107711918652, "GFLOP/s": 3032.553069199363, "strategy_time": 0, "framework_time": 1.5890889335423708, "timestamp": "2023-06-23 07:45:35.915717+00:00"}, "16,1,2,1,0,0": {"block_size_x": 16, "block_size_y": 1, "tile_size_x": 2, "tile_size_y": 1, "read_only": 0, "use_padding": 0, "time": 4.828831985592842, "times": [5.038080215454102, 4.994048118591309, 4.989952087402344, 4.993023872375488, 4.989952087402344, 4.994048118591309, 4.990975856781006, 4.987904071807861, 4.994048118591309, 4.994048118591309, 4.989952087402344, 4.988927841186523, 4.992000102996826, 4.990975856781006, 4.992000102996826, 4.992000102996826, 4.988927841186523, 4.990975856781006, 4.993023872375488, 4.993023872375488, 4.989952087402344, 4.990975856781006, 4.995071887969971, 4.992000102996826, 4.994048118591309, 4.990975856781006, 4.993023872375488, 4.993023872375488, 4.990975856781006, 3.655679941177368, 3.0300159454345703, 3.028991937637329], "compile_time": 1659.8569541238248, "verification_time": 0, "benchmark_time": 156.6384881734848, "GFLOP/s": 1563.4727450706916, "strategy_time": 0, "framework_time": 1.8723078537732363, "timestamp": "2023-06-23 07:45:37.734117+00:00"}, "16,1,2,1,0,1": {"block_size_x": 16, "block_size_y": 1, "tile_size_x": 2, "tile_size_y": 1, "read_only": 0, "use_padding": 1, "time": 4.430912017822266, "times": [3.0812160968780518, 3.039232015609741, 3.0361599922180176, 3.037184000015259, 3.0351359844207764, 3.037184000015259, 3.034111976623535, 3.034111976623535, 3.033087968826294, 4.588543891906738, 4.994048118591309, 4.990975856781006, 4.990975856781006, 4.992000102996826, 4.993023872375488, 4.992000102996826, 4.996096134185791, 4.995071887969971, 4.992000102996826, 4.992000102996826, 4.993023872375488, 4.992000102996826, 4.994048118591309, 4.989952087402344, 4.990975856781006, 4.988927841186523, 4.992000102996826, 4.994048118591309, 4.994048118591309, 4.992000102996826, 4.992000102996826, 4.992000102996826], "compile_time": 1772.775674937293, "verification_time": 0, "benchmark_time": 143.7508889939636, "GFLOP/s": 1703.8810903111996, "strategy_time": 0, "framework_time": 1.5643429942429066, "timestamp": "2023-06-23 07:45:39.652241+00:00"}, "16,1,2,1,1,0": {"block_size_x": 16, "block_size_y": 1, "tile_size_x": 2, "tile_size_y": 1, "read_only": 1, "use_padding": 0, "time": 3.4848960489034653, "times": [3.546112060546875, 3.49183988571167, 3.4856960773468018, 3.4836480617523193, 3.482624053955078, 3.4846720695495605, 3.4887681007385254, 3.481600046157837, 3.4836480617523193, 3.482624053955078, 3.482624053955078, 3.4836480617523193, 3.4846720695495605, 3.4836480617523193, 3.482624053955078, 3.481600046157837, 3.4836480617523193, 3.481600046157837, 3.482624053955078, 3.481600046157837, 3.482624053955078, 3.4785280227661133, 3.4805760383605957, 3.4785280227661133, 3.4805760383605957, 3.4785280227661133, 3.4785280227661133, 3.482624053955078, 3.4836480617523193, 3.487744092941284, 3.481600046157837, 3.4836480617523193], "compile_time": 1776.4666411094368, "verification_time": 0, "benchmark_time": 113.90067497268319, "GFLOP/s": 2166.4196274593482, "strategy_time": 0, "framework_time": 1.6667349264025688, "timestamp": "2023-06-23 07:45:41.544318+00:00"}, "16,1,2,1,1,1": {"block_size_x": 16, "block_size_y": 1, "tile_size_x": 2, "tile_size_y": 1, "read_only": 1, "use_padding": 1, "time": 2.9097279757261276, "times": [2.958336114883423, 2.9163520336151123, 2.9122560024261475, 2.909183979034424, 2.910207986831665, 2.915328025817871, 2.909183979034424, 2.910207986831665, 2.909183979034424, 2.909183979034424, 2.909183979034424, 2.909183979034424, 2.909183979034424, 2.9081599712371826, 2.905087947845459, 2.9061119556427, 2.9081599712371826, 2.905087947845459, 2.905087947845459, 2.9061119556427, 2.9061119556427, 2.905087947845459, 2.9061119556427, 2.905087947845459, 2.905087947845459, 2.910207986831665, 2.9061119556427, 2.9081599712371826, 2.9071359634399414, 2.9071359634399414, 2.9081599712371826, 2.9061119556427], "compile_time": 1711.1862690653652, "verification_time": 0, "benchmark_time": 94.69961002469063, "GFLOP/s": 2594.657391681416, "strategy_time": 0, "framework_time": 1.494141761213541, "timestamp": "2023-06-23 07:45:43.351736+00:00"}, "16,1,2,2,0,0": {"block_size_x": 16, "block_size_y": 1, "tile_size_x": 2, "tile_size_y": 2, "read_only": 0, "use_padding": 0, "time": 3.128895975649357, "times": [3.1723520755767822, 3.1344640254974365, 3.1293439865112305, 3.126271963119507, 3.127295970916748, 3.131392002105713, 3.127295970916748, 3.1283199787139893, 3.127295970916748, 3.1283199787139893, 3.1283199787139893, 3.1293439865112305, 3.1293439865112305, 3.127295970916748, 3.1303679943084717, 3.1252479553222656, 3.127295970916748, 3.1303679943084717, 3.1252479553222656, 3.126271963119507, 3.126271963119507, 3.1252479553222656, 3.1283199787139893, 3.1252479553222656, 3.1252479553222656, 3.1252479553222656, 3.1283199787139893, 3.1283199787139893, 3.1252479553222656, 3.1252479553222656, 3.1242239475250244, 3.126271963119507], "compile_time": 1862.8519971389323, "verification_time": 0, "benchmark_time": 101.67576489038765, "GFLOP/s": 2412.910898526487, "strategy_time": 0, "framework_time": 1.4783809892833233, "timestamp": "2023-06-23 07:45:45.317774+00:00"}, "16,1,2,2,0,1": {"block_size_x": 16, "block_size_y": 1, "tile_size_x": 2, "tile_size_y": 2, "read_only": 0, "use_padding": 1, "time": 3.1286719739437103, "times": [3.167232036590576, 3.131392002105713, 3.1303679943084717, 3.1283199787139893, 3.127295970916748, 3.1293439865112305, 3.1252479553222656, 3.1283199787139893, 3.1283199787139893, 3.126271963119507, 3.1283199787139893, 3.1252479553222656, 3.1303679943084717, 3.1283199787139893, 3.1242239475250244, 3.127295970916748, 3.126271963119507, 3.1293439865112305, 3.1252479553222656, 3.126271963119507, 3.127295970916748, 3.127295970916748, 3.1242239475250244, 3.1283199787139893, 3.127295970916748, 3.127295970916748, 3.127295970916748, 3.127295970916748, 3.1283199787139893, 3.126271963119507, 3.126271963119507, 3.127295970916748], "compile_time": 1871.1328189820051, "verification_time": 0, "benchmark_time": 101.68583295308053, "GFLOP/s": 2413.0836543031696, "strategy_time": 0, "framework_time": 1.8397870007902384, "timestamp": "2023-06-23 07:45:47.292465+00:00"}, "16,1,2,2,1,0": {"block_size_x": 16, "block_size_y": 1, "tile_size_x": 2, "tile_size_y": 2, "read_only": 1, "use_padding": 0, "time": 2.4809600487351418, "times": [2.1760001182556152, 2.135040044784546, 2.1319680213928223, 2.1319680213928223, 2.1319680213928223, 2.130944013595581, 2.141184091567993, 2.1288959980010986, 2.130944013595581, 2.1319680213928223, 2.6368000507354736, 2.6368000507354736, 2.637824058532715, 2.6357760429382324, 2.637824058532715, 2.637824058532715, 2.6368000507354736, 2.637824058532715, 2.6368000507354736, 2.6368000507354736, 2.6368000507354736, 2.637824058532715, 2.6368000507354736, 2.6357760429382324, 2.6357760429382324, 2.6368000507354736, 2.6368000507354736, 2.637824058532715, 2.637824058532715, 2.637824058532715, 2.6368000507354736, 2.6419200897216797], "compile_time": 1879.046986112371, "verification_time": 0, "benchmark_time": 80.98996500484645, "GFLOP/s": 3043.0748789562567, "strategy_time": 0, "framework_time": 1.6321178991347551, "timestamp": "2023-06-23 07:45:49.254166+00:00"}, "16,1,2,2,1,1": {"block_size_x": 16, "block_size_y": 1, "tile_size_x": 2, "tile_size_y": 2, "read_only": 1, "use_padding": 1, "time": 2.6395840495824814, "times": [2.7115519046783447, 2.6449921131134033, 2.643968105316162, 2.637824058532715, 2.637824058532715, 2.637824058532715, 2.6357760429382324, 2.634752035140991, 2.634752035140991, 2.6368000507354736, 2.637824058532715, 2.638848066329956, 2.6357760429382324, 2.6368000507354736, 2.637824058532715, 2.6357760429382324, 2.6357760429382324, 2.6368000507354736, 2.6368000507354736, 2.637824058532715, 2.6357760429382324, 2.6368000507354736, 2.637824058532715, 2.6357760429382324, 2.6357760429382324, 2.6368000507354736, 2.6368000507354736, 2.6357760429382324, 2.638848066329956, 2.637824058532715, 2.6357760429382324, 2.6368000507354736], "compile_time": 1871.7345630284399, "verification_time": 0, "benchmark_time": 85.7402600813657, "GFLOP/s": 2860.203372267759, "strategy_time": 0, "framework_time": 1.8663369119167328, "timestamp": "2023-06-23 07:45:51.213542+00:00"}, "16,1,2,3,0,0": {"block_size_x": 16, "block_size_y": 1, "tile_size_x": 2, "tile_size_y": 3, "read_only": 0, "use_padding": 0, "time": 3.0831680595874786, "times": [3.1385600566864014, 3.0863358974456787, 3.083264112472534, 3.0842878818511963, 3.0791680812835693, 3.082240104675293, 3.0812160968780518, 3.0842878818511963, 3.078144073486328, 3.082240104675293, 3.0812160968780518, 3.0791680812835693, 3.0801920890808105, 3.083264112472534, 3.082240104675293, 3.082240104675293, 3.0812160968780518, 3.0853118896484375, 3.082240104675293, 3.077120065689087, 3.0801920890808105, 3.0801920890808105, 3.0791680812835693, 3.082240104675293, 3.082240104675293, 3.0791680812835693, 3.0812160968780518, 3.078144073486328, 3.082240104675293, 3.0842878818511963, 3.078144073486328, 3.0801920890808105], "compile_time": 2046.1535940412432, "verification_time": 0, "benchmark_time": 100.09240615181625, "GFLOP/s": 2448.697915289814, "strategy_time": 0, "framework_time": 1.6572559252381325, "timestamp": "2023-06-23 07:45:53.361480+00:00"}, "16,1,2,3,0,1": {"block_size_x": 16, "block_size_y": 1, "tile_size_x": 2, "tile_size_y": 3, "read_only": 0, "use_padding": 1, "time": 3.084096036851406, "times": [3.1283199787139893, 3.0863358974456787, 3.0842878818511963, 3.0863358974456787, 3.0801920890808105, 3.0801920890808105, 3.0842878818511963, 3.0812160968780518, 3.0801920890808105, 3.083264112472534, 3.0853118896484375, 3.0904319286346436, 3.083264112472534, 3.083264112472534, 3.0801920890808105, 3.0812160968780518, 3.082240104675293, 3.083264112472534, 3.082240104675293, 3.078144073486328, 3.0842878818511963, 3.083264112472534, 3.0801920890808105, 3.0801920890808105, 3.0791680812835693, 3.0791680812835693, 3.0812160968780518, 3.0812160968780518, 3.082240104675293, 3.0863358974456787, 3.0863358974456787, 3.083264112472534], "compile_time": 2060.877963900566, "verification_time": 0, "benchmark_time": 100.13702907599509, "GFLOP/s": 2447.9611237098943, "strategy_time": 0, "framework_time": 1.7271880060434341, "timestamp": "2023-06-23 07:45:55.524265+00:00"}, "16,1,2,3,1,0": {"block_size_x": 16, "block_size_y": 1, "tile_size_x": 2, "tile_size_y": 3, "read_only": 1, "use_padding": 0, "time": 3.0055999904870987, "times": [3.048448085784912, 3.0115840435028076, 3.0064640045166016, 3.004415988922119, 3.003391981124878, 3.0023679733276367, 3.003391981124878, 3.0023679733276367, 3.012608051300049, 3.003391981124878, 3.0054399967193604, 3.0064640045166016, 3.0054399967193604, 3.009536027908325, 3.004415988922119, 3.003391981124878, 3.004415988922119, 3.003391981124878, 3.0023679733276367, 3.003391981124878, 3.003391981124878, 3.004415988922119, 3.0064640045166016, 3.0003199577331543, 3.0023679733276367, 3.004415988922119, 3.0064640045166016, 3.0003199577331543, 2.999295949935913, 3.0013439655303955, 3.0023679733276367, 3.0013439655303955], "compile_time": 2283.736613113433, "verification_time": 0, "benchmark_time": 97.9724891949445, "GFLOP/s": 2511.8935400237538, "strategy_time": 0, "framework_time": 1.592855667695403, "timestamp": "2023-06-23 07:45:57.907599+00:00"}, "16,1,2,3,1,1": {"block_size_x": 16, "block_size_y": 1, "tile_size_x": 2, "tile_size_y": 3, "read_only": 1, "use_padding": 1, "time": 3.0048639848828316, "times": [3.0453760623931885, 3.0105600357055664, 3.0064640045166016, 3.0013439655303955, 3.004415988922119, 3.004415988922119, 3.0023679733276367, 3.0013439655303955, 3.004415988922119, 3.003391981124878, 3.0013439655303955, 3.008512020111084, 3.004415988922119, 3.0013439655303955, 3.0023679733276367, 3.0023679733276367, 3.0003199577331543, 3.009536027908325, 3.003391981124878, 3.003391981124878, 3.0013439655303955, 3.0064640045166016, 3.0003199577331543, 3.0003199577331543, 3.004415988922119, 3.0003199577331543, 3.003391981124878, 3.0013439655303955, 3.004415988922119, 3.0064640045166016, 3.0013439655303955, 3.004415988922119], "compile_time": 2277.3399299476296, "verification_time": 0, "benchmark_time": 97.98139589838684, "GFLOP/s": 2512.508798395541, "strategy_time": 0, "framework_time": 1.5853613149374723, "timestamp": "2023-06-23 07:46:00.284538+00:00"}, "16,1,2,4,0,0": {"block_size_x": 16, "block_size_y": 1, "tile_size_x": 2, "tile_size_y": 4, "read_only": 0, "use_padding": 0, "time": 2.539488010108471, "times": [2.599936008453369, 2.545664072036743, 2.5374720096588135, 2.5425920486450195, 2.5384960174560547, 2.539520025253296, 2.5374720096588135, 2.5384960174560547, 2.535423994064331, 2.5364480018615723, 2.5436160564422607, 2.5333759784698486, 2.5384960174560547, 2.53439998626709, 2.5384960174560547, 2.535423994064331, 2.535423994064331, 2.5364480018615723, 2.540544033050537, 2.539520025253296, 2.5374720096588135, 2.5364480018615723, 2.535423994064331, 2.540544033050537, 2.53439998626709, 2.535423994064331, 2.5364480018615723, 2.535423994064331, 2.535423994064331, 2.5374720096588135, 2.5364480018615723, 2.535423994064331], "compile_time": 2268.1096030864865, "verification_time": 0, "benchmark_time": 83.34567910060287, "GFLOP/s": 2972.940675422808, "strategy_time": 0, "framework_time": 1.7626236658543348, "timestamp": "2023-06-23 07:46:02.637801+00:00"}, "16,1,2,4,0,1": {"block_size_x": 16, "block_size_y": 1, "tile_size_x": 2, "tile_size_y": 4, "read_only": 0, "use_padding": 1, "time": 2.5395200178027153, "times": [2.5825281143188477, 2.5384960174560547, 2.540544033050537, 2.540544033050537, 2.5364480018615723, 2.539520025253296, 2.5364480018615723, 2.5364480018615723, 2.544640064239502, 2.5425920486450195, 2.53439998626709, 2.5364480018615723, 2.5364480018615723, 2.535423994064331, 2.5425920486450195, 2.540544033050537, 2.5384960174560547, 2.5384960174560547, 2.5384960174560547, 2.5374720096588135, 2.5374720096588135, 2.535423994064331, 2.5374720096588135, 2.539520025253296, 2.5364480018615723, 2.539520025253296, 2.535423994064331, 2.5415680408477783, 2.539520025253296, 2.53439998626709, 2.535423994064331, 2.535423994064331], "compile_time": 2502.182131167501, "verification_time": 0, "benchmark_time": 83.07498320937157, "GFLOP/s": 2972.903204965604, "strategy_time": 0, "framework_time": 1.8016565591096878, "timestamp": "2023-06-23 07:46:05.224900+00:00"}, "16,1,2,4,1,0": {"block_size_x": 16, "block_size_y": 1, "tile_size_x": 2, "tile_size_y": 4, "read_only": 1, "use_padding": 0, "time": 2.1627840101718903, "times": [2.203648090362549, 2.1729280948638916, 2.1637120246887207, 2.1626880168914795, 2.160640001296997, 2.1626880168914795, 2.1637120246887207, 2.160640001296997, 2.160640001296997, 2.1626880168914795, 2.1616640090942383, 2.1585919857025146, 2.1637120246887207, 2.1616640090942383, 2.1616640090942383, 2.160640001296997, 2.1575679779052734, 2.1637120246887207, 2.1585919857025146, 2.160640001296997, 2.1616640090942383, 2.160640001296997, 2.1585919857025146, 2.1616640090942383, 2.1637120246887207, 2.160640001296997, 2.1626880168914795, 2.159615993499756, 2.1616640090942383, 2.1575679779052734, 2.1585919857025146, 2.159615993499756], "compile_time": 2274.4849051814526, "verification_time": 0, "benchmark_time": 71.28389202989638, "GFLOP/s": 3490.7541226920634, "strategy_time": 0, "framework_time": 1.5901608858257532, "timestamp": "2023-06-23 07:46:07.572294+00:00"}, "16,1,2,4,1,1": {"block_size_x": 16, "block_size_y": 1, "tile_size_x": 2, "tile_size_y": 4, "read_only": 1, "use_padding": 1, "time": 2.1633600145578384, "times": [2.2056961059570312, 2.1678080558776855, 2.1616640090942383, 2.159615993499756, 2.160640001296997, 2.1626880168914795, 2.1616640090942383, 2.1626880168914795, 2.1637120246887207, 2.1616640090942383, 2.1637120246887207, 2.1626880168914795, 2.1616640090942383, 2.1626880168914795, 2.1616640090942383, 2.165760040283203, 2.164736032485962, 2.1616640090942383, 2.159615993499756, 2.1575679779052734, 2.1575679779052734, 2.1616640090942383, 2.1626880168914795, 2.1616640090942383, 2.1637120246887207, 2.1616640090942383, 2.160640001296997, 2.1616640090942383, 2.1585919857025146, 2.1637120246887207, 2.1616640090942383, 2.1626880168914795], "compile_time": 2244.854961987585, "verification_time": 0, "benchmark_time": 71.28315092995763, "GFLOP/s": 3489.824693622742, "strategy_time": 0, "framework_time": 1.6464360523968935, "timestamp": "2023-06-23 07:46:09.890111+00:00"}, "16,1,3,1,0,0": {"block_size_x": 16, "block_size_y": 1, "tile_size_x": 3, "tile_size_y": 1, "read_only": 0, "use_padding": 0, "time": 4.43756802380085, "times": [4.477952003479004, 4.4410881996154785, 4.438015937805176, 4.438015937805176, 4.436992168426514, 4.438015937805176, 4.436992168426514, 4.434944152832031, 4.435967922210693, 4.435967922210693, 4.435967922210693, 4.434944152832031, 4.434944152832031, 4.435967922210693, 4.436992168426514, 4.435967922210693, 4.435967922210693, 4.436992168426514, 4.434944152832031, 4.435967922210693, 4.435967922210693, 4.435967922210693, 4.435967922210693, 4.435967922210693, 4.435967922210693, 4.435967922210693, 4.436992168426514, 4.435967922210693, 4.435967922210693, 4.434944152832031, 4.434944152832031, 4.434944152832031], "compile_time": 2666.7753690853715, "verification_time": 0, "benchmark_time": 144.0972820855677, "GFLOP/s": 1701.325401550356, "strategy_time": 0, "framework_time": 1.719422871246934, "timestamp": "2023-06-23 07:46:12.702746+00:00"}, "16,1,3,1,0,1": {"block_size_x": 16, "block_size_y": 1, "tile_size_x": 3, "tile_size_y": 1, "read_only": 0, "use_padding": 1, "time": 4.465376004576683, "times": [4.542463779449463, 4.467711925506592, 4.46668815612793, 4.462592124938965, 4.462592124938965, 4.468736171722412, 4.465663909912109, 4.462592124938965, 4.4615678787231445, 4.462592124938965, 4.4615678787231445, 4.4615678787231445, 4.463615894317627, 4.462592124938965, 4.4615678787231445, 4.460544109344482, 4.462592124938965, 4.46668815612793, 4.462592124938965, 4.463615894317627, 4.463615894317627, 4.462592124938965, 4.4615678787231445, 4.462592124938965, 4.462592124938965, 4.462592124938965, 4.4615678787231445, 4.4615678787231445, 4.459519863128662, 4.460544109344482, 4.4615678787231445, 4.4615678787231445], "compile_time": 2615.838013822213, "verification_time": 0, "benchmark_time": 144.5893810596317, "GFLOP/s": 1690.730454112277, "strategy_time": 0, "framework_time": 1.9719151314347982, "timestamp": "2023-06-23 07:46:15.465208+00:00"}, "16,1,3,1,1,0": {"block_size_x": 16, "block_size_y": 1, "tile_size_x": 3, "tile_size_y": 1, "read_only": 1, "use_padding": 0, "time": 4.4270079880952835, "times": [4.46668815612793, 4.429823875427246, 4.432896137237549, 4.426752090454102, 4.425727844238281, 4.427775859832764, 4.425727844238281, 4.424704074859619, 4.426752090454102, 4.424704074859619, 4.425727844238281, 4.425727844238281, 4.424704074859619, 4.424704074859619, 4.424704074859619, 4.423679828643799, 4.423679828643799, 4.425727844238281, 4.424704074859619, 4.424704074859619, 4.425727844238281, 4.424704074859619, 4.425727844238281, 4.425727844238281, 4.426752090454102, 4.424704074859619, 4.424704074859619, 4.424704074859619, 4.424704074859619, 4.424704074859619, 4.424704074859619, 4.427775859832764], "compile_time": 2674.3567339144647, "verification_time": 0, "benchmark_time": 143.43413314782083, "GFLOP/s": 1705.3836858442787, "strategy_time": 0, "framework_time": 1.6002210322767496, "timestamp": "2023-06-23 07:46:18.284636+00:00"}, "16,1,3,1,1,1": {"block_size_x": 16, "block_size_y": 1, "tile_size_x": 3, "tile_size_y": 1, "read_only": 1, "use_padding": 1, "time": 4.177312038838863, "times": [4.484096050262451, 4.447231769561768, 4.443136215209961, 4.444159984588623, 4.443136215209961, 4.442111968994141, 4.443136215209961, 4.442111968994141, 4.442111968994141, 4.442111968994141, 4.443136215209961, 4.442111968994141, 4.4410881996154785, 4.4410881996154785, 4.442111968994141, 4.442111968994141, 4.442111968994141, 4.442111968994141, 4.4410881996154785, 4.442111968994141, 4.442111968994141, 4.4410881996154785, 4.442111968994141, 3.8891520500183105, 3.4488320350646973, 3.4447360038757324, 3.4447360038757324, 3.4447360038757324, 3.4508800506591797, 3.443711996078491, 3.4447360038757324, 3.4447360038757324], "compile_time": 2363.611164968461, "verification_time": 0, "benchmark_time": 135.80329506658018, "GFLOP/s": 1807.3218207798877, "strategy_time": 0, "framework_time": 1.356614986434579, "timestamp": "2023-06-23 07:46:20.785440+00:00"}, "16,1,3,2,0,0": {"block_size_x": 16, "block_size_y": 1, "tile_size_x": 3, "tile_size_y": 2, "read_only": 0, "use_padding": 0, "time": 2.522880010306835, "times": [2.5630719661712646, 2.52620792388916, 2.5241599082946777, 2.5221118927001953, 2.5221118927001953, 2.5231359004974365, 2.520064115524292, 2.520064115524292, 2.519040107727051, 2.5221118927001953, 2.521087884902954, 2.520064115524292, 2.520064115524292, 2.521087884902954, 2.520064115524292, 2.521087884902954, 2.520064115524292, 2.5221118927001953, 2.5221118927001953, 2.520064115524292, 2.520064115524292, 2.520064115524292, 2.521087884902954, 2.520064115524292, 2.520064115524292, 2.520064115524292, 2.520064115524292, 2.520064115524292, 2.521087884902954, 2.520064115524292, 2.521087884902954, 2.5384960174560547], "compile_time": 2873.347664019093, "verification_time": 0, "benchmark_time": 82.11327693425119, "GFLOP/s": 2992.5114032996726, "strategy_time": 0, "framework_time": 1.612663036212325, "timestamp": "2023-06-23 07:46:23.742545+00:00"}, "16,1,3,2,0,1": {"block_size_x": 16, "block_size_y": 1, "tile_size_x": 3, "tile_size_y": 2, "read_only": 0, "use_padding": 1, "time": 2.6372480392456055, "times": [2.678783893585205, 2.6398720741271973, 2.634752035140991, 2.6398720741271973, 2.634752035140991, 2.6368000507354736, 2.6368000507354736, 2.6357760429382324, 2.632704019546509, 2.6357760429382324, 2.6368000507354736, 2.637824058532715, 2.63372802734375, 2.6368000507354736, 2.6368000507354736, 2.634752035140991, 2.6306560039520264, 2.637824058532715, 2.634752035140991, 2.638848066329956, 2.6368000507354736, 2.634752035140991, 2.634752035140991, 2.634752035140991, 2.63372802734375, 2.634752035140991, 2.634752035140991, 2.6357760429382324, 2.6357760429382324, 2.6357760429382324, 2.6368000507354736, 2.638848066329956], "compile_time": 2547.2995308227837, "verification_time": 0, "benchmark_time": 85.68031177856028, "GFLOP/s": 2862.7368710300125, "strategy_time": 0, "framework_time": 1.4465334825217724, "timestamp": "2023-06-23 07:46:26.377010+00:00"}, "16,1,3,2,1,0": {"block_size_x": 16, "block_size_y": 1, "tile_size_x": 3, "tile_size_y": 2, "read_only": 1, "use_padding": 0, "time": 2.4303039088845253, "times": [2.471935987472534, 2.4340479373931885, 2.4289278984069824, 2.4289278984069824, 2.427903890609741, 2.431999921798706, 2.427903890609741, 2.427903890609741, 2.430975914001465, 2.4289278984069824, 2.430975914001465, 2.4381439685821533, 2.427903890609741, 2.4268798828125, 2.4268798828125, 2.427903890609741, 2.4289278984069824, 2.4299519062042236, 2.427903890609741, 2.4299519062042236, 2.4268798828125, 2.427903890609741, 2.4289278984069824, 2.427903890609741, 2.427903890609741, 2.427903890609741, 2.425856113433838, 2.4268798828125, 2.427903890609741, 2.4268798828125, 2.430975914001465, 2.4289278984069824], "compile_time": 2867.5302248448133, "verification_time": 0, "benchmark_time": 79.35351994819939, "GFLOP/s": 3106.5033358174637, "strategy_time": 0, "framework_time": 1.444358378648758, "timestamp": "2023-06-23 07:46:29.325375+00:00"}, "16,1,3,2,1,1": {"block_size_x": 16, "block_size_y": 1, "tile_size_x": 3, "tile_size_y": 2, "read_only": 1, "use_padding": 1, "time": 2.4022399187088013, "times": [2.4842240810394287, 2.406399965286255, 2.40230393409729, 2.4002559185028076, 2.398207902908325, 2.4094719886779785, 2.4002559185028076, 2.3992319107055664, 2.3992319107055664, 2.401279926300049, 2.398207902908325, 2.398207902908325, 2.3992319107055664, 2.398207902908325, 2.3992319107055664, 2.3992319107055664, 2.4002559185028076, 2.398207902908325, 2.3992319107055664, 2.397183895111084, 2.398207902908325, 2.398207902908325, 2.3992319107055664, 2.397183895111084, 2.3992319107055664, 2.4002559185028076, 2.398207902908325, 2.397183895111084, 2.398207902908325, 2.3992319107055664, 2.3992319107055664, 2.3992319107055664], "compile_time": 2555.048421025276, "verification_time": 0, "benchmark_time": 78.6777869798243, "GFLOP/s": 3142.794831274793, "strategy_time": 0, "framework_time": 1.5044710598886013, "timestamp": "2023-06-23 07:46:31.960652+00:00"}, "16,1,3,3,0,0": {"block_size_x": 16, "block_size_y": 1, "tile_size_x": 3, "tile_size_y": 3, "read_only": 0, "use_padding": 0, "time": 2.4981439411640167, "times": [2.5384960174560547, 2.500607967376709, 2.504703998565674, 2.496511936187744, 2.4995839595794678, 2.4985599517822266, 2.495487928390503, 2.4924159049987793, 2.4985599517822266, 2.4975359439849854, 2.496511936187744, 2.4985599517822266, 2.4995839595794678, 2.4985599517822266, 2.4944639205932617, 2.4934399127960205, 2.4995839595794678, 2.4975359439849854, 2.4985599517822266, 2.495487928390503, 2.496511936187744, 2.496511936187744, 2.4944639205932617, 2.495487928390503, 2.496511936187744, 2.4944639205932617, 2.4944639205932617, 2.4944639205932617, 2.4934399127960205, 2.4975359439849854, 2.496511936187744, 2.495487928390503], "compile_time": 2770.631211111322, "verification_time": 0, "benchmark_time": 81.80020097643137, "GFLOP/s": 3022.1425897829467, "strategy_time": 0, "framework_time": 1.8065858166664839, "timestamp": "2023-06-23 07:46:34.814927+00:00"}, "16,1,3,3,0,1": {"block_size_x": 16, "block_size_y": 1, "tile_size_x": 3, "tile_size_y": 3, "read_only": 0, "use_padding": 1, "time": 2.6350080221891403, "times": [2.6808319091796875, 2.637824058532715, 2.632704019546509, 2.634752035140991, 2.632704019546509, 2.63372802734375, 2.6368000507354736, 2.6368000507354736, 2.6368000507354736, 2.634752035140991, 2.6368000507354736, 2.634752035140991, 2.63372802734375, 2.6306560039520264, 2.632704019546509, 2.6316800117492676, 2.632704019546509, 2.6306560039520264, 2.6316800117492676, 2.638848066329956, 2.632704019546509, 2.634752035140991, 2.6306560039520264, 2.6357760429382324, 2.632704019546509, 2.6306560039520264, 2.6316800117492676, 2.6306560039520264, 2.634752035140991, 2.628607988357544, 2.634752035140991, 2.6306560039520264], "compile_time": 2817.710026167333, "verification_time": 0, "benchmark_time": 85.62597003765404, "GFLOP/s": 2865.1704800988573, "strategy_time": 0, "framework_time": 1.586955739185214, "timestamp": "2023-06-23 07:46:37.719884+00:00"}, "16,1,3,3,1,0": {"block_size_x": 16, "block_size_y": 1, "tile_size_x": 3, "tile_size_y": 3, "read_only": 1, "use_padding": 0, "time": 2.3721599355340004, "times": [2.415616035461426, 2.3787519931793213, 2.3695359230041504, 2.3705599308013916, 2.371583938598633, 2.3705599308013916, 2.368511915206909, 2.371583938598633, 2.3695359230041504, 2.372607946395874, 2.371583938598633, 2.3736319541931152, 2.371583938598633, 2.3705599308013916, 2.3695359230041504, 2.3746559619903564, 2.371583938598633, 2.371583938598633, 2.3695359230041504, 2.371583938598633, 2.3695359230041504, 2.3705599308013916, 2.3705599308013916, 2.3705599308013916, 2.367487907409668, 2.371583938598633, 2.368511915206909, 2.3664638996124268, 2.3695359230041504, 2.3736319541931152, 2.3695359230041504, 2.3664638996124268], "compile_time": 2826.862407848239, "verification_time": 0, "benchmark_time": 77.48053991235793, "GFLOP/s": 3182.6467882320358, "strategy_time": 0, "framework_time": 1.6379512380808592, "timestamp": "2023-06-23 07:46:40.625896+00:00"}, "16,1,3,3,1,1": {"block_size_x": 16, "block_size_y": 1, "tile_size_x": 3, "tile_size_y": 3, "read_only": 1, "use_padding": 1, "time": 2.4445120096206665, "times": [2.4842240810394287, 2.456576108932495, 2.446336030960083, 2.4442880153656006, 2.4401919841766357, 2.447360038757324, 2.4432640075683594, 2.445312023162842, 2.445312023162842, 2.4432640075683594, 2.442239999771118, 2.447360038757324, 2.441215991973877, 2.441215991973877, 2.4442880153656006, 2.441215991973877, 2.441215991973877, 2.441215991973877, 2.445312023162842, 2.4401919841766357, 2.441215991973877, 2.4391679763793945, 2.441215991973877, 2.4432640075683594, 2.4381439685821533, 2.4442880153656006, 2.4442880153656006, 2.442239999771118, 2.442239999771118, 2.4432640075683594, 2.441215991973877, 2.442239999771118], "compile_time": 2826.714080059901, "verification_time": 0, "benchmark_time": 80.14718303456903, "GFLOP/s": 3088.44757983887, "strategy_time": 0, "framework_time": 1.4449898153543472, "timestamp": "2023-06-23 07:46:43.534240+00:00"}, "16,1,3,4,0,0": {"block_size_x": 16, "block_size_y": 1, "tile_size_x": 3, "tile_size_y": 4, "read_only": 0, "use_padding": 0, "time": 3.0481280460953712, "times": [3.08735990524292, 3.053567886352539, 3.0402560234069824, 3.0556159019470215, 3.048448085784912, 3.052544116973877, 3.0453760623931885, 3.0453760623931885, 3.052544116973877, 3.048448085784912, 3.043328046798706, 3.0504961013793945, 3.052544116973877, 3.0382080078125, 3.043328046798706, 3.052544116973877, 3.0320639610290527, 3.048448085784912, 3.0464000701904297, 3.0464000701904297, 3.0443520545959473, 3.0443520545959473, 3.042304039001465, 3.048448085784912, 3.0402560234069824, 3.0545918941497803, 3.042304039001465, 3.0443520545959473, 3.0453760623931885, 3.0494720935821533, 3.0515201091766357, 3.0494720935821533], "compile_time": 3453.282146016136, "verification_time": 0, "benchmark_time": 99.6318799443543, "GFLOP/s": 2476.8471290670245, "strategy_time": 0, "framework_time": 1.755099045112729, "timestamp": "2023-06-23 07:46:47.088941+00:00"}, "16,1,3,4,0,1": {"block_size_x": 16, "block_size_y": 1, "tile_size_x": 3, "tile_size_y": 4, "read_only": 0, "use_padding": 1, "time": 3.058143988251686, "times": [3.1334400177001953, 3.0545918941497803, 3.0402560234069824, 3.0504961013793945, 3.058687925338745, 3.0515201091766357, 3.0648319721221924, 3.066879987716675, 3.0617599487304688, 3.0515201091766357, 3.0597119331359863, 3.0566399097442627, 3.0504961013793945, 3.0453760623931885, 3.063807964324951, 3.042304039001465, 3.0556159019470215, 3.053567886352539, 3.0597119331359863, 3.0545918941497803, 3.0504961013793945, 3.0504961013793945, 3.052544116973877, 3.0617599487304688, 3.057663917541504, 3.0648319721221924, 3.053567886352539, 3.0504961013793945, 3.067903995513916, 3.053567886352539, 3.06278395652771, 3.058687925338745], "compile_time": 3450.8841659408063, "verification_time": 0, "benchmark_time": 99.94603600353003, "GFLOP/s": 2468.735033080023, "strategy_time": 0, "framework_time": 1.5742119867354631, "timestamp": "2023-06-23 07:46:50.641390+00:00"}, "16,1,3,4,1,0": {"block_size_x": 16, "block_size_y": 1, "tile_size_x": 3, "tile_size_y": 4, "read_only": 1, "use_padding": 0, "time": 2.4473600015044212, "times": [2.5118720531463623, 2.461695909500122, 2.4545280933380127, 2.451456069946289, 2.441215991973877, 2.4494080543518066, 2.456576108932495, 2.4350719451904297, 2.455552101135254, 2.4432640075683594, 2.4401919841766357, 2.4627199172973633, 2.4340479373931885, 2.430975914001465, 2.4596478939056396, 2.4524800777435303, 2.441215991973877, 2.446336030960083, 2.4432640075683594, 2.4340479373931885, 2.430975914001465, 2.442239999771118, 2.446336030960083, 2.4535040855407715, 2.4524800777435303, 2.4340479373931885, 2.4381439685821533, 2.4350719451904297, 2.450432062149048, 2.446336030960083, 2.436095952987671, 2.4442880153656006], "compile_time": 3459.0925129596144, "verification_time": 0, "benchmark_time": 80.10639692656696, "GFLOP/s": 3084.8535545890595, "strategy_time": 0, "framework_time": 2.030943986028433, "timestamp": "2023-06-23 07:46:54.182655+00:00"}, "16,1,3,4,1,1": {"block_size_x": 16, "block_size_y": 1, "tile_size_x": 3, "tile_size_y": 4, "read_only": 1, "use_padding": 1, "time": 2.4459520056843758, "times": [2.4934399127960205, 2.437119960784912, 2.4401919841766357, 2.442239999771118, 2.4483840465545654, 2.441215991973877, 2.431999921798706, 2.442239999771118, 2.437119960784912, 2.4381439685821533, 2.442239999771118, 2.450432062149048, 2.4381439685821533, 2.455552101135254, 2.447360038757324, 2.4494080543518066, 2.4391679763793945, 2.441215991973877, 2.470911979675293, 2.447360038757324, 2.455552101135254, 2.4401919841766357, 2.4483840465545654, 2.4330239295959473, 2.4524800777435303, 2.4483840465545654, 2.441215991973877, 2.4576001167297363, 2.442239999771118, 2.4442880153656006, 2.441215991973877, 2.431999921798706], "compile_time": 3214.134896174073, "verification_time": 0, "benchmark_time": 80.11478208936751, "GFLOP/s": 3086.629329788336, "strategy_time": 0, "framework_time": 1.397731713950634, "timestamp": "2023-06-23 07:46:57.478335+00:00"}, "16,1,4,1,0,0": {"block_size_x": 16, "block_size_y": 1, "tile_size_x": 4, "tile_size_y": 1, "read_only": 0, "use_padding": 0, "time": 4.438976034522057, "times": [4.484096050262451, 4.443136215209961, 4.444159984588623, 4.439040184020996, 4.438015937805176, 4.439040184020996, 4.438015937805176, 4.435967922210693, 4.436992168426514, 4.436992168426514, 4.438015937805176, 4.438015937805176, 4.435967922210693, 4.436992168426514, 4.438015937805176, 4.434944152832031, 4.436992168426514, 4.435967922210693, 4.438015937805176, 4.438015937805176, 4.434944152832031, 4.438015937805176, 4.435967922210693, 4.435967922210693, 4.435967922210693, 4.436992168426514, 4.439040184020996, 4.438015937805176, 4.438015937805176, 4.436992168426514, 4.436992168426514, 4.433919906616211], "compile_time": 3327.0865329541266, "verification_time": 0, "benchmark_time": 144.15516098961234, "GFLOP/s": 1700.785753580415, "strategy_time": 0, "framework_time": 1.7765979282557964, "timestamp": "2023-06-23 07:47:00.951385+00:00"}, "16,1,4,1,0,1": {"block_size_x": 16, "block_size_y": 1, "tile_size_x": 4, "tile_size_y": 1, "read_only": 0, "use_padding": 1, "time": 4.438368067145348, "times": [4.478975772857666, 4.442111968994141, 4.442111968994141, 4.436992168426514, 4.436992168426514, 4.436992168426514, 4.438015937805176, 4.436992168426514, 4.436992168426514, 4.434944152832031, 4.436992168426514, 4.438015937805176, 4.435967922210693, 4.434944152832031, 4.434944152832031, 4.436992168426514, 4.435967922210693, 4.439040184020996, 4.438015937805176, 4.435967922210693, 4.436992168426514, 4.439040184020996, 4.435967922210693, 4.436992168426514, 4.434944152832031, 4.433919906616211, 4.439040184020996, 4.434944152832031, 4.435967922210693, 4.439040184020996, 4.436992168426514, 4.435967922210693], "compile_time": 3000.5765478126705, "verification_time": 0, "benchmark_time": 144.03912401758134, "GFLOP/s": 1701.0187271052123, "strategy_time": 0, "framework_time": 1.6267483588308096, "timestamp": "2023-06-23 07:47:04.097660+00:00"}, "16,1,4,1,1,0": {"block_size_x": 16, "block_size_y": 1, "tile_size_x": 4, "tile_size_y": 1, "read_only": 1, "use_padding": 0, "time": 4.433279976248741, "times": [4.473855972290039, 4.436992168426514, 4.432896137237549, 4.4318718910217285, 4.432896137237549, 4.434944152832031, 4.4318718910217285, 4.432896137237549, 4.429823875427246, 4.434944152832031, 4.429823875427246, 4.4318718910217285, 4.4318718910217285, 4.429823875427246, 4.434944152832031, 4.4318718910217285, 4.429823875427246, 4.429823875427246, 4.4318718910217285, 4.4318718910217285, 4.429823875427246, 4.430848121643066, 4.4318718910217285, 4.4318718910217285, 4.429823875427246, 4.436992168426514, 4.4318718910217285, 4.430848121643066, 4.429823875427246, 4.4318718910217285, 4.430848121643066, 4.4318718910217285], "compile_time": 3327.659372938797, "verification_time": 0, "benchmark_time": 143.84273602627218, "GFLOP/s": 1702.9709922332236, "strategy_time": 0, "framework_time": 1.553463051095605, "timestamp": "2023-06-23 07:47:07.570758+00:00"}, "16,1,4,1,1,1": {"block_size_x": 16, "block_size_y": 1, "tile_size_x": 4, "tile_size_y": 1, "read_only": 1, "use_padding": 1, "time": 4.43436798453331, "times": [4.5107197761535645, 4.440063953399658, 4.4318718910217285, 4.4318718910217285, 4.432896137237549, 4.433919906616211, 4.430848121643066, 4.430848121643066, 4.4318718910217285, 4.4318718910217285, 4.432896137237549, 4.430848121643066, 4.4318718910217285, 4.4318718910217285, 4.428800106048584, 4.430848121643066, 4.433919906616211, 4.432896137237549, 4.4318718910217285, 4.430848121643066, 4.429823875427246, 4.430848121643066, 4.4318718910217285, 4.429823875427246, 4.428800106048584, 4.4318718910217285, 4.4318718910217285, 4.4318718910217285, 4.435967922210693, 4.4318718910217285, 4.430848121643066, 4.430848121643066], "compile_time": 3028.357184957713, "verification_time": 0, "benchmark_time": 143.9482441637665, "GFLOP/s": 1702.5531544366327, "strategy_time": 0, "framework_time": 1.7664199694991112, "timestamp": "2023-06-23 07:47:10.744873+00:00"}, "16,1,4,2,0,0": {"block_size_x": 16, "block_size_y": 1, "tile_size_x": 4, "tile_size_y": 2, "read_only": 0, "use_padding": 0, "time": 2.866655968129635, "times": [2.909183979034424, 2.8671998977661133, 2.865151882171631, 2.866175889968872, 2.865151882171631, 2.8692479133605957, 2.8671998977661133, 2.865151882171631, 2.8682239055633545, 2.866175889968872, 2.8620800971984863, 2.865151882171631, 2.866175889968872, 2.8692479133605957, 2.8620800971984863, 2.8641281127929688, 2.8682239055633545, 2.870271921157837, 2.8590080738067627, 2.865151882171631, 2.8620800971984863, 2.8631041049957275, 2.866175889968872, 2.8641281127929688, 2.861056089401245, 2.865151882171631, 2.865151882171631, 2.8590080738067627, 2.8641281127929688, 2.8631041049957275, 2.8671998977661133, 2.8723199367523193], "compile_time": 3532.0194349624217, "verification_time": 0, "benchmark_time": 93.23585918173194, "GFLOP/s": 2633.642573066022, "strategy_time": 0, "framework_time": 1.974067883566022, "timestamp": "2023-06-23 07:47:14.372139+00:00"}, "16,1,4,2,0,1": {"block_size_x": 16, "block_size_y": 1, "tile_size_x": 4, "tile_size_y": 2, "read_only": 0, "use_padding": 1, "time": 2.866399995982647, "times": [2.910207986831665, 2.8723199367523193, 2.866175889968872, 2.861056089401245, 2.8620800971984863, 2.865151882171631, 2.8641281127929688, 2.866175889968872, 2.866175889968872, 2.866175889968872, 2.8682239055633545, 2.8671998977661133, 2.866175889968872, 2.8620800971984863, 2.8631041049957275, 2.8671998977661133, 2.866175889968872, 2.860032081604004, 2.866175889968872, 2.8620800971984863, 2.875391960144043, 2.8631041049957275, 2.860032081604004, 2.8641281127929688, 2.866175889968872, 2.8620800971984863, 2.8631041049957275, 2.8620800971984863, 2.866175889968872, 2.8631041049957275, 2.8641281127929688, 2.8671998977661133], "compile_time": 3529.6233179979026, "verification_time": 0, "benchmark_time": 93.26409106142819, "GFLOP/s": 2633.8777597617977, "strategy_time": 0, "framework_time": 1.5741519164294004, "timestamp": "2023-06-23 07:47:17.996633+00:00"}, "16,1,4,2,1,0": {"block_size_x": 16, "block_size_y": 1, "tile_size_x": 4, "tile_size_y": 2, "read_only": 1, "use_padding": 0, "time": 2.753503978252411, "times": [2.791424036026001, 2.752511978149414, 2.7586560249328613, 2.7555840015411377, 2.7535359859466553, 2.752511978149414, 2.7535359859466553, 2.751487970352173, 2.752511978149414, 2.7555840015411377, 2.7535359859466553, 2.7504639625549316, 2.7555840015411377, 2.747391939163208, 2.747391939163208, 2.7545599937438965, 2.7504639625549316, 2.752511978149414, 2.7535359859466553, 2.7494399547576904, 2.7443199157714844, 2.7504639625549316, 2.752511978149414, 2.7545599937438965, 2.752511978149414, 2.747391939163208, 2.756608009338379, 2.748415946960449, 2.7535359859466553, 2.752511978149414, 2.751487970352173, 2.7555840015411377], "compile_time": 3251.9512351136655, "verification_time": 0, "benchmark_time": 89.7282250225544, "GFLOP/s": 2741.869000237167, "strategy_time": 0, "framework_time": 1.8622488714754581, "timestamp": "2023-06-23 07:47:21.340219+00:00"}, "16,1,4,2,1,1": {"block_size_x": 16, "block_size_y": 1, "tile_size_x": 4, "tile_size_y": 2, "read_only": 1, "use_padding": 1, "time": 2.7540159821510315, "times": [2.7985920906066895, 2.7555840015411377, 2.748415946960449, 2.752511978149414, 2.7545599937438965, 2.7504639625549316, 2.747391939163208, 2.752511978149414, 2.7555840015411377, 2.7535359859466553, 2.752511978149414, 2.752511978149414, 2.7545599937438965, 2.752511978149414, 2.7535359859466553, 2.748415946960449, 2.752511978149414, 2.7494399547576904, 2.7535359859466553, 2.7545599937438965, 2.7637760639190674, 2.7504639625549316, 2.748415946960449, 2.75763201713562, 2.748415946960449, 2.7555840015411377, 2.751487970352173, 2.7504639625549316, 2.7504639625549316, 2.7596800327301025, 2.752511978149414, 2.746367931365967], "compile_time": 3540.5295761302114, "verification_time": 0, "benchmark_time": 89.67083785682917, "GFLOP/s": 2741.3592546050695, "strategy_time": 0, "framework_time": 1.6799280419945717, "timestamp": "2023-06-23 07:47:24.972131+00:00"}, "16,1,4,3,0,0": {"block_size_x": 16, "block_size_y": 1, "tile_size_x": 4, "tile_size_y": 3, "read_only": 0, "use_padding": 0, "time": 3.5070719867944717, "times": [3.546112060546875, 3.507200002670288, 3.5082240104675293, 3.5143680572509766, 3.5051519870758057, 3.5235838890075684, 3.507200002670288, 3.506175994873047, 3.4959359169006348, 3.507200002670288, 3.506175994873047, 3.5092480182647705, 3.501055955886841, 3.4990079402923584, 3.5082240104675293, 3.501055955886841, 3.49183988571167, 3.512320041656494, 3.5041279792785645, 3.507200002670288, 3.511296033859253, 3.5133440494537354, 3.5082240104675293, 3.5092480182647705, 3.5174400806427, 3.497983932495117, 3.497983932495117, 3.507200002670288, 3.497983932495117, 3.5051519870758057, 3.501055955886841, 3.497983932495117], "compile_time": 3605.97974807024, "verification_time": 0, "benchmark_time": 113.9887950848788, "GFLOP/s": 2152.7209103285636, "strategy_time": 0, "framework_time": 1.7434668261557817, "timestamp": "2023-06-23 07:47:28.693874+00:00"}, "16,1,4,3,0,1": {"block_size_x": 16, "block_size_y": 1, "tile_size_x": 4, "tile_size_y": 3, "read_only": 0, "use_padding": 1, "time": 3.5084799975156784, "times": [3.551232099533081, 3.511296033859253, 3.5082240104675293, 3.4959359169006348, 3.5092480182647705, 3.5133440494537354, 3.4990079402923584, 3.511296033859253, 3.4938879013061523, 3.5051519870758057, 3.5041279792785645, 3.497983932495117, 3.5287039279937744, 3.5051519870758057, 3.5153920650482178, 3.5102720260620117, 3.5051519870758057, 3.4949119091033936, 3.5092480182647705, 3.5194880962371826, 3.5133440494537354, 3.5184640884399414, 3.502079963684082, 3.511296033859253, 3.5082240104675293, 3.511296033859253, 3.501055955886841, 3.501055955886841, 3.497983932495117, 3.502079963684082, 3.516416072845459, 3.4990079402923584], "compile_time": 3887.4356008600444, "verification_time": 0, "benchmark_time": 113.98968705907464, "GFLOP/s": 2151.8569880249865, "strategy_time": 0, "framework_time": 1.6552722081542015, "timestamp": "2023-06-23 07:47:32.696987+00:00"}, "16,1,4,3,1,0": {"block_size_x": 16, "block_size_y": 1, "tile_size_x": 4, "tile_size_y": 3, "read_only": 1, "use_padding": 0, "time": 3.3479679822921753, "times": [3.452928066253662, 3.363840103149414, 3.3464319705963135, 3.368959903717041, 3.3525760173797607, 3.354624032974243, 3.3228800296783447, 3.3413119316101074, 3.3423359394073486, 3.344383955001831, 3.340287923812866, 3.33516788482666, 3.354624032974243, 3.362816095352173, 3.3505280017852783, 3.329024076461792, 3.34335994720459, 3.3556480407714844, 3.3454079627990723, 3.33516788482666, 3.340287923812866, 3.3454079627990723, 3.34335994720459, 3.339263916015625, 3.348479986190796, 3.3320960998535156, 3.3361918926239014, 3.344383955001831, 3.3413119316101074, 3.3320960998535156, 3.3423359394073486, 3.3474559783935547], "compile_time": 3680.436477996409, "verification_time": 0, "benchmark_time": 108.95375697873533, "GFLOP/s": 2255.023715857369, "strategy_time": 0, "framework_time": 1.731575233861804, "timestamp": "2023-06-23 07:47:36.488162+00:00"}, "16,1,4,3,1,1": {"block_size_x": 16, "block_size_y": 1, "tile_size_x": 4, "tile_size_y": 3, "read_only": 1, "use_padding": 1, "time": 3.3549760058522224, "times": [3.3966081142425537, 3.363840103149414, 3.3669118881225586, 3.3566720485687256, 3.3423359394073486, 3.3648641109466553, 3.3607680797576904, 3.3474559783935547, 3.3464319705963135, 3.3679358959198, 3.368959903717041, 3.3474559783935547, 3.374079942703247, 3.353600025177002, 3.362816095352173, 3.3607680797576904, 3.3464319705963135, 3.3505280017852783, 3.3556480407714844, 3.340287923812866, 3.354624032974243, 3.3525760173797607, 3.3505280017852783, 3.353600025177002, 3.3464319705963135, 3.3177599906921387, 3.3454079627990723, 3.353600025177002, 3.353600025177002, 3.3607680797576904, 3.34335994720459, 3.3525760173797607], "compile_time": 3683.0279300920665, "verification_time": 0, "benchmark_time": 108.94972016103566, "GFLOP/s": 2250.3133217139753, "strategy_time": 0, "framework_time": 1.9380305893719196, "timestamp": "2023-06-23 07:47:40.282117+00:00"}, "16,1,4,4,0,0": {"block_size_x": 16, "block_size_y": 1, "tile_size_x": 4, "tile_size_y": 4, "read_only": 0, "use_padding": 0, "time": 2.7134719491004944, "times": [2.7535359859466553, 2.7156479358673096, 2.712575912475586, 2.7115519046783447, 2.707456111907959, 2.712575912475586, 2.718719959259033, 2.713599920272827, 2.716671943664551, 2.7095038890838623, 2.717695951461792, 2.7105278968811035, 2.7258880138397217, 2.708479881286621, 2.7156479358673096, 2.713599920272827, 2.7095038890838623, 2.707456111907959, 2.718719959259033, 2.7064321041107178, 2.708479881286621, 2.712575912475586, 2.712575912475586, 2.708479881286621, 2.7095038890838623, 2.7115519046783447, 2.7043840885162354, 2.712575912475586, 2.7156479358673096, 2.7105278968811035, 2.712575912475586, 2.7064321041107178], "compile_time": 4355.434394208714, "verification_time": 0, "benchmark_time": 88.91811198554933, "GFLOP/s": 2782.31997294194, "strategy_time": 0, "framework_time": 1.6065908130258322, "timestamp": "2023-06-23 07:47:44.728114+00:00"}, "16,1,4,4,0,1": {"block_size_x": 16, "block_size_y": 1, "tile_size_x": 4, "tile_size_y": 4, "read_only": 0, "use_padding": 1, "time": 2.715007945895195, "times": [2.7504639625549316, 2.7258880138397217, 2.7064321041107178, 2.712575912475586, 2.7197439670562744, 2.722815990447998, 2.707456111907959, 2.7105278968811035, 2.713599920272827, 2.717695951461792, 2.7156479358673096, 2.713599920272827, 2.7095038890838623, 2.717695951461792, 2.718719959259033, 2.713599920272827, 2.7105278968811035, 2.7156479358673096, 2.712575912475586, 2.7115519046783447, 2.7146239280700684, 2.7105278968811035, 2.712575912475586, 2.7146239280700684, 2.7146239280700684, 2.718719959259033, 2.7115519046783447, 2.7115519046783447, 2.718719959259033, 2.708479881286621, 2.7043840885162354, 2.713599920272827], "compile_time": 4358.543473063037, "verification_time": 0, "benchmark_time": 88.74530787579715, "GFLOP/s": 2780.745894837774, "strategy_time": 0, "framework_time": 1.5054831746965647, "timestamp": "2023-06-23 07:47:49.176946+00:00"}, "16,1,4,4,1,0": {"block_size_x": 16, "block_size_y": 1, "tile_size_x": 4, "tile_size_y": 4, "read_only": 1, "use_padding": 0, "time": 2.627007968723774, "times": [2.668544054031372, 2.6265599727630615, 2.6265599