cache_files/convolution_A4000.json
{
"device_name": "NVIDIA RTX A4000",
"kernel_name": "convolution_kernel",
"problem_size": [
4096,
4096
],
"tune_params_keys": [
"block_size_x",
"block_size_y",
"tile_size_x",
"tile_size_y",
"read_only",
"use_padding"
],
"tune_params": {
"block_size_x": [
16,
32,
48,
64,
80,
96,
112,
128,
144,
160,
176,
192,
208,
224,
240,
256
],
"block_size_y": [
1,
2,
4,
8,
16
],
"tile_size_x": [
1,
2,
3,
4
],
"tile_size_y": [
1,
2,
3,
4
],
"read_only": [
0,
1
],
"use_padding": [
0,
1
]
},
"objective": "time",
"cache": {
"16,1,1,1,0,0": {"block_size_x": 16, "block_size_y": 1, "tile_size_x": 1, "tile_size_y": 1, "read_only": 0, "use_padding": 0, "time": 10.663481950759888, "times": [10.423295974731445, 10.386431694030762, 10.382335662841797, 10.394623756408691, 10.736639976501465, 10.727423667907715, 10.696703910827637, 10.693632125854492, 10.699775695800781, 10.701824188232422, 10.694656372070312, 10.696703910827637, 10.696703910827637, 10.697728157043457, 10.695679664611816, 10.693632125854492, 10.703871726989746, 10.699775695800781, 10.691583633422852, 10.700799942016602, 10.697728157043457, 10.700799942016602, 10.705920219421387, 10.702848434448242, 10.700799942016602, 10.710016250610352, 10.699775695800781, 10.699616432189941, 10.695679664611816, 10.710016250610352, 10.695679664611816, 10.69871997833252], "compile_time": 1022.9933448135853, "verification_time": 0, "benchmark_time": 342.5770211033523, "GFLOP/s": 708.0001855737186, "strategy_time": 0, "framework_time": 75.64633945003152, "timestamp": "2023-05-18 08:31:56.477748+00:00"},
"16,1,1,1,0,1": {"block_size_x": 16, "block_size_y": 1, "tile_size_x": 1, "tile_size_y": 1, "read_only": 0, "use_padding": 1, "time": 11.12239208817482, "times": [10.93836784362793, 10.900416374206543, 10.904576301574707, 11.057151794433594, 11.170816421508789, 11.177984237670898, 11.165696144104004, 11.176896095275879, 11.171839714050293, 11.143168449401855, 11.142975807189941, 11.14022445678711, 11.140095710754395, 11.142144203186035, 11.13702392578125, 11.141119956970215, 11.147263526916504, 11.143168449401855, 11.14419174194336, 11.13702392578125, 11.13907241821289, 11.14419174194336, 11.134976387023926, 11.142144203186035, 11.141119956970215, 11.147199630737305, 11.14521598815918, 11.130880355834961, 11.142144203186035, 11.13907241821289, 11.14521598815918, 11.143168449401855], "compile_time": 1018.4151660650969, "verification_time": 0, "benchmark_time": 357.32117388397455, "GFLOP/s": 678.7880826487668, "strategy_time": 0, "framework_time": 1.9486574456095695, "timestamp": "2023-05-18 08:31:57.855465+00:00"},
"16,1,1,1,1,0": {"block_size_x": 16, "block_size_y": 1, "tile_size_x": 1, "tile_size_y": 1, "read_only": 1, "use_padding": 0, "time": 11.11707603931427, "times": [10.860544204711914, 10.821632385253906, 10.817536354064941, 10.972160339355469, 11.180000305175781, 11.175935745239258, 11.176799774169922, 11.184127807617188, 11.182111740112305, 11.186176300048828, 11.174912452697754, 11.140095710754395, 11.142975807189941, 11.14521598815918, 11.142144203186035, 11.14419174194336, 11.141119956970215, 11.141119956970215, 11.146240234375, 11.148287773132324, 11.146240234375, 11.13907241821289, 11.13907241821289, 11.143168449401855, 11.14419174194336, 11.151359558105469, 11.144160270690918, 11.142144203186035, 11.147263526916504, 11.14521598815918, 11.14521598815918, 11.13599967956543], "compile_time": 1019.6873578242958, "verification_time": 0, "benchmark_time": 357.0005842484534, "GFLOP/s": 679.1126707509403, "strategy_time": 0, "framework_time": 1.4362568035721779, "timestamp": "2023-05-18 08:31:59.233620+00:00"},
"16,1,1,1,1,1": {"block_size_x": 16, "block_size_y": 1, "tile_size_x": 1, "tile_size_y": 1, "read_only": 1, "use_padding": 1, "time": 11.779015958309174, "times": [11.571200370788574, 11.545599937438965, 11.780096054077148, 11.820032119750977, 11.799551963806152, 11.798527717590332, 11.788224220275879, 11.794431686401367, 11.795455932617188, 11.798527717590332, 11.793408393859863, 11.785216331481934, 11.790335655212402, 11.790335655212402, 11.790335655212402, 11.789183616638184, 11.782143592834473, 11.799551963806152, 11.793408393859863, 11.794431686401367, 11.794431686401367, 11.797504425048828, 11.79635238647461, 11.793408393859863, 11.795392036437988, 11.794303894042969, 11.79638385772705, 11.792384147644043, 11.79747200012207, 11.787263870239258, 11.793279647827148, 11.790335655212402], "compile_time": 1014.535166323185, "verification_time": 0, "benchmark_time": 378.44500597566366, "GFLOP/s": 640.9488896798925, "strategy_time": 0, "framework_time": 1.554338727146387, "timestamp": "2023-05-18 08:32:00.628184+00:00"},
"16,1,1,2,0,0": {"block_size_x": 16, "block_size_y": 1, "tile_size_x": 1, "tile_size_y": 2, "read_only": 0, "use_padding": 0, "time": 6.144665941596031, "times": [5.898240089416504, 5.864448070526123, 5.8664960861206055, 5.8652801513671875, 6.12556791305542, 6.230016231536865, 6.231040000915527, 6.235136032104492, 6.2320637702941895, 6.2320637702941895, 6.218751907348633, 6.176767826080322, 6.171648025512695, 6.17471981048584, 6.176767826080322, 6.170623779296875, 6.169600009918213, 6.173696041107178, 6.177792072296143, 6.173696041107178, 6.172671794891357, 6.169600009918213, 6.17574405670166, 6.17471981048584, 6.17574405670166, 6.168575763702393, 6.172671794891357, 6.170623779296875, 6.169600009918213, 6.17471981048584, 6.171648025512695, 6.168575763702393], "compile_time": 1139.1484751366079, "verification_time": 0, "benchmark_time": 198.27723922207952, "GFLOP/s": 1228.6668261153688, "strategy_time": 0, "framework_time": 1.4359066262841225, "timestamp": "2023-05-18 08:32:01.967075+00:00"},
"16,1,1,2,0,1": {"block_size_x": 16, "block_size_y": 1, "tile_size_x": 1, "tile_size_y": 2, "read_only": 0, "use_padding": 1, "time": 6.3450659811496735, "times": [6.091775894165039, 6.063104152679443, 6.0497918128967285, 6.057983875274658, 6.338367938995361, 6.451200008392334, 6.459392070770264, 6.4245758056640625, 6.390783786773682, 6.392831802368164, 6.395904064178467, 6.392831802368164, 6.392864227294922, 6.383615970611572, 6.3744001388549805, 6.363135814666748, 6.370304107666016, 6.370304107666016, 6.374239921569824, 6.383615970611572, 6.372352123260498, 6.371232032775879, 6.390783786773682, 6.385663986206055, 6.37337589263916, 6.375423908233643, 6.377376079559326, 6.370304107666016, 6.37337589263916, 6.38156795501709, 6.376448154449463, 6.3731842041015625], "compile_time": 1138.957217335701, "verification_time": 0, "benchmark_time": 204.72952397540212, "GFLOP/s": 1189.8611019064688, "strategy_time": 0, "framework_time": 1.4514154754579067, "timestamp": "2023-05-18 08:32:03.312243+00:00"},
"16,1,1,2,1,0": {"block_size_x": 16, "block_size_y": 1, "tile_size_x": 1, "tile_size_y": 2, "read_only": 1, "use_padding": 0, "time": 6.191619977355003, "times": [5.890048027038574, 5.857247829437256, 5.8521599769592285, 5.855231761932373, 5.854207992553711, 5.853184223175049, 6.2218241691589355, 6.323200225830078, 6.322303771972656, 6.2863359451293945, 6.265920162200928, 6.264832019805908, 6.26585578918457, 6.267744064331055, 6.263807773590088, 6.261727809906006, 6.260735988616943, 6.269951820373535, 6.263807773590088, 6.269855976104736, 6.2649922370910645, 6.263807773590088, 6.26585578918457, 6.266016006469727, 6.261760234832764, 6.266880035400391, 6.26585578918457, 6.262784004211426, 6.255616188049316, 6.256576061248779, 6.264832019805908, 6.266880035400391], "compile_time": 1142.8916798904538, "verification_time": 0, "benchmark_time": 199.5156561024487, "GFLOP/s": 1219.349253929046, "strategy_time": 0, "framework_time": 1.4513470232486725, "timestamp": "2023-05-18 08:32:04.656132+00:00"},
"16,1,1,2,1,1": {"block_size_x": 16, "block_size_y": 1, "tile_size_x": 1, "tile_size_y": 2, "read_only": 1, "use_padding": 1, "time": 6.323882028460503, "times": [6.072319984436035, 6.03436803817749, 6.025216102600098, 6.0344319343566895, 6.036479949951172, 6.236159801483154, 6.465536117553711, 6.467584133148193, 6.4634881019592285, 6.467584133148193, 6.470592021942139, 6.458367824554443, 6.425600051879883, 6.4245758056640625, 6.400000095367432, 6.350719928741455, 6.349823951721191, 6.343616008758545, 6.34768009185791, 6.338560104370117, 6.343679904937744, 6.343679904937744, 6.346752166748047, 6.345632076263428, 6.3447041511535645, 6.348800182342529, 6.350783824920654, 6.35584020614624, 6.336512088775635, 6.350848197937012, 6.342656135559082, 6.341631889343262], "compile_time": 1141.7096978984773, "verification_time": 0, "benchmark_time": 203.779686242342, "GFLOP/s": 1193.8469386403028, "strategy_time": 0, "framework_time": 1.4284132048487663, "timestamp": "2023-05-18 08:32:06.003078+00:00"},
"16,1,1,3,0,0": {"block_size_x": 16, "block_size_y": 1, "tile_size_x": 1, "tile_size_y": 3, "read_only": 0, "use_padding": 0, "time": 4.512983977794647, "times": [4.274176120758057, 4.2393598556518555, 4.238239765167236, 4.2342400550842285, 4.23529577255249, 4.235263824462891, 4.235199928283691, 4.560959815979004, 4.654047966003418, 4.6561279296875, 4.655104160308838, 4.622335910797119, 4.60595178604126, 4.60595178604126, 4.607999801635742, 4.597760200500488, 4.578303813934326, 4.581376075744629, 4.577280044555664, 4.576255798339844, 4.575232028961182, 4.5793280601501465, 4.578144073486328, 4.577280044555664, 4.577280044555664, 4.567039966583252, 4.5649919509887695, 4.562943935394287, 4.56601619720459, 4.563968181610107, 4.56601619720459, 4.56601619720459], "compile_time": 1277.3615261539817, "verification_time": 0, "benchmark_time": 145.9924392402172, "GFLOP/s": 1672.8947492717052, "strategy_time": 0, "framework_time": 1.5071304515004158, "timestamp": "2023-05-18 08:32:07.427969+00:00"},
"16,1,1,3,0,1": {"block_size_x": 16, "block_size_y": 1, "tile_size_x": 1, "tile_size_y": 3, "read_only": 0, "use_padding": 1, "time": 4.533012002706528, "times": [4.3079681396484375, 4.270080089569092, 4.268032073974609, 4.2690558433532715, 4.291423797607422, 4.436992168426514, 4.439040184020996, 4.438015937805176, 4.433919906616211, 4.555776119232178, 4.6141438484191895, 4.611072063446045, 4.61516809463501, 4.612095832824707, 4.617216110229492, 4.6111040115356445, 4.6141438484191895, 4.613120079040527, 4.60697603225708, 4.604928016662598, 4.602784156799316, 4.604928016662598, 4.600831985473633, 4.602880001068115, 4.602719783782959, 4.603903770446777, 4.601856231689453, 4.600831985473633, 4.601856231689453, 4.603903770446777, 4.59878396987915, 4.600831985473633], "compile_time": 1281.5295057371259, "verification_time": 0, "benchmark_time": 146.80026099085808, "GFLOP/s": 1665.5034655748248, "strategy_time": 0, "framework_time": 1.4154491946101189, "timestamp": "2023-05-18 08:32:08.857745+00:00"},
"16,1,1,3,1,0": {"block_size_x": 16, "block_size_y": 1, "tile_size_x": 1, "tile_size_y": 3, "read_only": 1, "use_padding": 0, "time": 4.679315969347954, "times": [4.424704074859619, 4.388864040374756, 4.385791778564453, 4.386816024780273, 4.384768009185791, 4.386816024780273, 4.702208042144775, 4.823904037475586, 4.823040008544922, 4.820864200592041, 4.7769598960876465, 4.760575771331787, 4.761600017547607, 4.759552001953125, 4.741119861602783, 4.728831768035889, 4.731904029846191, 4.729919910430908, 4.7308478355407715, 4.732800006866455, 4.728831768035889, 4.729856014251709, 4.730879783630371, 4.72870397567749, 4.731904029846191, 4.7267842292785645, 4.729856014251709, 4.728991985321045, 4.729856014251709, 4.730879783630371, 4.729856014251709, 4.729824066162109], "compile_time": 1284.9856540560722, "verification_time": 0, "benchmark_time": 151.55735379084945, "GFLOP/s": 1613.4296656722734, "strategy_time": 0, "framework_time": 1.6512097790837288, "timestamp": "2023-05-18 08:32:10.295969+00:00"},
"16,1,1,3,1,1": {"block_size_x": 16, "block_size_y": 1, "tile_size_x": 1, "tile_size_y": 3, "read_only": 1, "use_padding": 1, "time": 4.736545979976654, "times": [4.465663909912109, 4.427775859832764, 4.425631999969482, 4.4266557693481445, 4.424704074859619, 4.425663948059082, 4.597599983215332, 4.869120121002197, 4.865920066833496, 4.863903999328613, 4.876287937164307, 4.89785623550415, 4.8957438468933105, 4.896768093109131, 4.874144077301025, 4.81382417678833, 4.811776161193848, 4.81382417678833, 4.808703899383545, 4.7860798835754395, 4.785151958465576, 4.781951904296875, 4.783103942871094, 4.777984142303467, 4.772863864898682, 4.772831916809082, 4.772863864898682, 4.770815849304199, 4.7699198722839355, 4.77177619934082, 4.7717437744140625, 4.770815849304199], "compile_time": 1284.4173009507358, "verification_time": 0, "benchmark_time": 153.19355577230453, "GFLOP/s": 1593.9351653960323, "strategy_time": 0, "framework_time": 1.4747590757906437, "timestamp": "2023-05-18 08:32:11.735084+00:00"},
"16,1,1,4,0,0": {"block_size_x": 16, "block_size_y": 1, "tile_size_x": 1, "tile_size_y": 4, "read_only": 0, "use_padding": 0, "time": 3.668404959142208, "times": [3.4693119525909424, 3.433471918106079, 3.4303998947143555, 3.4314239025115967, 3.4303998947143555, 3.4303998947143555, 3.4314239025115967, 3.7068800926208496, 3.7651519775390625, 3.764224052429199, 3.7652480602264404, 3.7652480602264404, 3.762176036834717, 3.7560319900512695, 3.753983974456787, 3.753983974456787, 3.753983974456787, 3.7355520725250244, 3.7171199321746826, 3.719167947769165, 3.718143939971924, 3.718143939971924, 3.718143939971924, 3.7171199321746826, 3.7180159091949463, 3.718143939971924, 3.7171199321746826, 3.7171199321746826, 3.718143939971924, 3.7180159091949463, 3.718143939971924, 3.7171199321746826], "compile_time": 1409.871983807534, "verification_time": 0, "benchmark_time": 118.9738349057734, "GFLOP/s": 2058.0462855347832, "strategy_time": 0, "framework_time": 1.5603713691234589, "timestamp": "2023-05-18 08:32:13.265520+00:00"},
"16,1,1,4,0,1": {"block_size_x": 16, "block_size_y": 1, "tile_size_x": 1, "tile_size_y": 4, "read_only": 0, "use_padding": 1, "time": 3.6743629947304726, "times": [3.471359968185425, 3.4344959259033203, 3.4314239025115967, 3.4314239025115967, 3.4314239025115967, 3.4303998947143555, 3.432447910308838, 3.431391954421997, 3.497983932495117, 3.792896032333374, 3.7939200401306152, 3.791872024536133, 3.790816068649292, 3.7898240089416504, 3.7908480167388916, 3.791872024536133, 3.791872024536133, 3.79203200340271, 3.792736053466797, 3.7693440914154053, 3.767296075820923, 3.7662720680236816, 3.7652480602264404, 3.767296075820923, 3.7509119510650635, 3.7273600101470947, 3.728384017944336, 3.728384017944336, 3.7273600101470947, 3.729311943054199, 3.7222399711608887, 3.719167947769165], "compile_time": 1412.635455839336, "verification_time": 0, "benchmark_time": 119.31485310196877, "GFLOP/s": 2054.709132120954, "strategy_time": 0, "framework_time": 1.478015910834074, "timestamp": "2023-05-18 08:32:14.798976+00:00"},
"16,1,1,4,1,0": {"block_size_x": 16, "block_size_y": 1, "tile_size_x": 1, "tile_size_y": 4, "read_only": 1, "use_padding": 0, "time": 3.857206955552101, "times": [3.670016050338745, 3.6331520080566406, 3.6270079612731934, 3.6270079612731934, 3.6270079612731934, 3.694591999053955, 3.7130239009857178, 3.708928108215332, 3.7130239009857178, 3.7109758853912354, 3.8492159843444824, 3.9813120365142822, 3.9813120365142822, 3.9823360443115234, 3.982271909713745, 3.965951919555664, 3.941375970840454, 3.941279888153076, 3.941375970840454, 3.940351963043213, 3.940351963043213, 3.9342079162597656, 3.930111885070801, 3.9342079162597656, 3.933056116104126, 3.9331839084625244, 3.9331839084625244, 3.930111885070801, 3.9331839084625244, 3.9331839084625244, 3.932159900665283, 3.932159900665283], "compile_time": 1410.0827490910888, "verification_time": 0, "benchmark_time": 125.22699683904648, "GFLOP/s": 1957.3093398923852, "strategy_time": 0, "framework_time": 1.4882748946547508, "timestamp": "2023-05-18 08:32:16.335804+00:00"},
"16,1,1,4,1,1": {"block_size_x": 16, "block_size_y": 1, "tile_size_x": 1, "tile_size_y": 4, "read_only": 1, "use_padding": 1, "time": 3.8877930343151093, "times": [3.685375928878784, 3.6485118865966797, 3.6464641094207764, 3.6476800441741943, 3.6485118865966797, 3.6485118865966797, 3.821568012237549, 3.906559944152832, 3.904416084289551, 3.9034879207611084, 3.903424024581909, 3.951616048812866, 3.95468807220459, 3.95468807220459, 3.95468807220459, 3.955712080001831, 3.9545280933380127, 3.9545280933380127, 3.955712080001831, 3.9536640644073486, 3.95468807220459, 3.9566400051116943, 3.95468807220459, 3.9526400566101074, 3.955712080001831, 3.9526400566101074, 3.955712080001831, 3.9536640644073486, 3.95468807220459, 3.95468807220459, 3.955615997314453, 3.9536640644073486], "compile_time": 1409.296136815101, "verification_time": 0, "benchmark_time": 126.06655899435282, "GFLOP/s": 1941.9107790366202, "strategy_time": 0, "framework_time": 1.4377515763044357, "timestamp": "2023-05-18 08:32:17.872636+00:00"},
"16,1,2,1,0,0": {"block_size_x": 16, "block_size_y": 1, "tile_size_x": 2, "tile_size_y": 1, "read_only": 0, "use_padding": 0, "time": 8.237450018525124, "times": [7.894015789031982, 7.8540802001953125, 7.8540802001953125, 7.85100793838501, 7.983104228973389, 8.373248100280762, 8.375295639038086, 8.424448013305664, 8.419327735900879, 8.382464408874512, 8.349696159362793, 8.338432312011719, 8.27888011932373, 8.282079696655273, 8.278016090393066, 8.282112121582031, 8.276991844177246, 8.276991844177246, 8.276991844177246, 8.283136367797852, 8.278016090393066, 8.28006362915039, 8.275839805603027, 8.210432052612305, 8.255392074584961, 8.276991844177246, 8.282112121582031, 8.282112121582031, 8.279040336608887, 8.281984329223633, 8.27791976928711, 8.284095764160156], "compile_time": 1757.0301480591297, "verification_time": 0, "benchmark_time": 265.2154709212482, "GFLOP/s": 916.5150845251195, "strategy_time": 0, "framework_time": 1.5163482166826725, "timestamp": "2023-05-18 08:32:19.896427+00:00"},
"16,1,2,1,0,1": {"block_size_x": 16, "block_size_y": 1, "tile_size_x": 2, "tile_size_y": 1, "read_only": 0, "use_padding": 1, "time": 8.229906037449837, "times": [7.833600044250488, 7.795711994171143, 7.7946882247924805, 7.790592193603516, 8.29644775390625, 8.344575881958008, 8.342528343200684, 8.346752166748047, 8.338432312011719, 8.283136367797852, 8.279040336608887, 8.282112121582031, 8.279040336608887, 8.284159660339355, 8.28006362915039, 8.282112121582031, 8.281087875366211, 8.280960083007812, 8.28006362915039, 8.282048225402832, 8.282079696655273, 8.284159660339355, 8.282048225402832, 8.282015800476074, 8.281120300292969, 8.283136367797852, 8.28006362915039, 8.279040336608887, 8.28502368927002, 8.281087875366211, 8.278976440429688, 8.281087875366211], "compile_time": 1757.907629944384, "verification_time": 0, "benchmark_time": 265.1126589626074, "GFLOP/s": 917.355212276446, "strategy_time": 0, "framework_time": 1.4378810301423073, "timestamp": "2023-05-18 08:32:21.920915+00:00"},
"16,1,2,1,1,0": {"block_size_x": 16, "block_size_y": 1, "tile_size_x": 2, "tile_size_y": 1, "read_only": 1, "use_padding": 0, "time": 8.279950931668282, "times": [7.84876823425293, 7.8151679039001465, 7.814080238342285, 8.321023941040039, 8.331263542175293, 8.41318416595459, 8.463359832763672, 8.442879676818848, 8.392704010009766, 8.393728256225586, 8.366080284118652, 8.329183578491211, 8.324095726013184, 8.301440238952637, 8.30361557006836, 8.29849624633789, 8.299519538879395, 8.30463981628418, 8.302592277526855, 8.29849624633789, 8.299519538879395, 8.302592277526855, 8.29644775390625, 8.29747200012207, 8.301568031311035, 8.299519538879395, 8.300543785095215, 8.29747200012207, 8.301568031311035, 8.30246353149414, 8.29644775390625, 8.29849624633789], "compile_time": 1761.0930521041155, "verification_time": 0, "benchmark_time": 266.41027722507715, "GFLOP/s": 911.8106208968611, "strategy_time": 0, "framework_time": 1.5817196108400822, "timestamp": "2023-05-18 08:32:23.950029+00:00"},
"16,1,2,1,1,1": {"block_size_x": 16, "block_size_y": 1, "tile_size_x": 2, "tile_size_y": 1, "read_only": 1, "use_padding": 1, "time": 9.12040701508522, "times": [7.85203218460083, 7.812096118927002, 7.812096118927002, 7.811071872711182, 8.137727737426758, 8.461312294006348, 8.463359832763672, 9.513983726501465, 9.671680450439453, 9.644031524658203, 9.632767677307129, 9.637887954711914, 9.63379192352295, 9.636863708496094, 9.633824348449707, 9.637887954711914, 9.63481616973877, 9.63481616973877, 9.639936447143555, 9.63475227355957, 9.640959739685059, 9.630720138549805, 9.632767677307129, 9.636735916137695, 9.63379192352295, 9.63481616973877, 9.632767677307129, 9.4136323928833, 8.361984252929688, 8.368000030517578, 8.365056037902832, 8.365056037902832], "compile_time": 1759.6830232068896, "verification_time": 0, "benchmark_time": 293.14053198322654, "GFLOP/s": 827.7862147503573, "strategy_time": 0, "framework_time": 1.5499000437557697, "timestamp": "2023-05-18 08:32:26.004432+00:00"},
"16,1,2,2,0,0": {"block_size_x": 16, "block_size_y": 1, "tile_size_x": 2, "tile_size_y": 2, "read_only": 0, "use_padding": 0, "time": 5.224920004606247, "times": [5.479423999786377, 5.440415859222412, 5.431295871734619, 5.427199840545654, 5.434368133544922, 5.429247856140137, 5.433343887329102, 5.429247856140137, 5.42412805557251, 5.412831783294678, 5.405695915222168, 5.410816192626953, 5.409791946411133, 5.409791946411133, 5.411839962005615, 5.410816192626953, 5.40774393081665, 5.40774393081665, 5.40774393081665, 5.4128642082214355, 5.410816192626953, 5.409696102142334, 5.400544166564941, 4.729856014251709, 4.727807998657227, 4.7267842292785645, 4.723711967468262, 4.7226881980896, 4.727807998657227, 4.727807998657227, 4.725759983062744, 4.727807998657227], "compile_time": 2037.4304968863726, "verification_time": 0, "benchmark_time": 168.71115704998374, "GFLOP/s": 1444.9498161396164, "strategy_time": 0, "framework_time": 1.554789487272501, "timestamp": "2023-05-18 08:32:28.212157+00:00"},
"16,1,2,2,0,1": {"block_size_x": 16, "block_size_y": 1, "tile_size_x": 2, "tile_size_y": 2, "read_only": 0, "use_padding": 1, "time": 5.212017014622688, "times": [5.476352214813232, 5.439487934112549, 5.437439918518066, 5.433343887329102, 5.4323201179504395, 5.4323201179504395, 5.426176071166992, 5.427199840545654, 5.405695915222168, 5.409791946411133, 5.411839962005615, 5.406720161437988, 5.409791946411133, 5.406720161437988, 5.410816192626953, 5.40774393081665, 5.411839962005615, 5.4128642082214355, 5.409791946411133, 5.4127678871154785, 5.411839962005615, 5.414912223815918, 5.005311965942383, 4.724736213684082, 4.7226881980896, 4.726624011993408, 4.725759983062744, 4.725759983062744, 4.725599765777588, 4.724736213684082, 4.728831768035889, 4.726719856262207], "compile_time": 2031.9688562303782, "verification_time": 0, "benchmark_time": 168.32963284105062, "GFLOP/s": 1448.5269673561388, "strategy_time": 0, "framework_time": 1.429304014891386, "timestamp": "2023-05-18 08:32:30.413915+00:00"},
"16,1,2,2,1,0": {"block_size_x": 16, "block_size_y": 1, "tile_size_x": 2, "tile_size_y": 2, "read_only": 1, "use_padding": 0, "time": 5.131057024002075, "times": [5.4179840087890625, 5.3831682205200195, 5.371903896331787, 5.376927852630615, 5.377024173736572, 5.364736080169678, 5.356544017791748, 5.355519771575928, 5.348351955413818, 5.354464054107666, 5.349376201629639, 5.352447986602783, 5.351424217224121, 5.346303939819336, 5.348351955413818, 5.354496002197266, 5.348351955413818, 5.350399971008301, 5.347328186035156, 5.348351955413818, 5.182464122772217, 4.708288192749023, 4.712416172027588, 4.70630407333374, 4.706175804138184, 4.710400104522705, 4.709248065948486, 4.710400104522705, 4.710400104522705, 4.71347188949585, 4.711423873901367, 4.709375858306885], "compile_time": 2039.7027092985809, "verification_time": 0, "benchmark_time": 165.89563759043813, "GFLOP/s": 1471.382439268121, "strategy_time": 0, "framework_time": 1.409528311342001, "timestamp": "2023-05-18 08:32:32.620952+00:00"},
"16,1,2,2,1,1": {"block_size_x": 16, "block_size_y": 1, "tile_size_x": 2, "tile_size_y": 2, "read_only": 1, "use_padding": 1, "time": 5.120883956551552, "times": [5.417856216430664, 5.381087779998779, 5.372928142547607, 5.378047943115234, 5.375999927520752, 5.355519771575928, 5.352447986602783, 5.352447986602783, 5.355519771575928, 5.355519771575928, 5.354496002197266, 5.3534722328186035, 5.354496002197266, 5.355423927307129, 5.355519771575928, 5.354496002197266, 5.351424217224121, 5.352384090423584, 5.350399971008301, 5.342207908630371, 4.708352088928223, 4.707327842712402, 4.70527982711792, 4.707263946533203, 4.709375858306885, 4.707327842712402, 4.708352088928223, 4.70630407333374, 4.7472639083862305, 4.7472639083862305, 4.7472639083862305, 4.745215892791748], "compile_time": 2035.6842689216137, "verification_time": 0, "benchmark_time": 165.3713369742036, "GFLOP/s": 1474.305464458145, "strategy_time": 0, "framework_time": 1.4499532990157604, "timestamp": "2023-05-18 08:32:34.823488+00:00"},
"16,1,2,3,0,0": {"block_size_x": 16, "block_size_y": 1, "tile_size_x": 2, "tile_size_y": 3, "read_only": 0, "use_padding": 0, "time": 4.288179963827133, "times": [4.3376641273498535, 4.294655799865723, 4.290559768676758, 4.292543888092041, 4.293536186218262, 4.296703815460205, 4.291584014892578, 4.2936320304870605, 4.291584014892578, 4.289567947387695, 4.290495872497559, 4.289535999298096, 4.290559768676758, 4.290559768676758, 4.295680046081543, 4.292543888092041, 4.288512229919434, 4.288447856903076, 4.291584014892578, 4.2782721519470215, 4.279295921325684, 4.279295921325684, 4.280320167541504, 4.281343936920166, 4.277247905731201, 4.277247905731201, 4.276224136352539, 4.2802557945251465, 4.281343936920166, 4.279295921325684, 4.282368183135986, 4.279295921325684], "compile_time": 2277.6613403111696, "verification_time": 0, "benchmark_time": 138.8759920373559, "GFLOP/s": 1760.5947660046359, "strategy_time": 0, "framework_time": 1.522147562354803, "timestamp": "2023-05-18 08:32:37.241576+00:00"},
"16,1,2,3,0,1": {"block_size_x": 16, "block_size_y": 1, "tile_size_x": 2, "tile_size_y": 3, "read_only": 0, "use_padding": 1, "time": 4.2864280343055725, "times": [4.334591865539551, 4.2987518310546875, 4.290559768676758, 4.292575836181641, 4.287487983703613, 4.294655799865723, 4.291520118713379, 4.2936320304870605, 4.291584014892578, 4.288512229919434, 4.29260778427124, 4.295680046081543, 4.29260778427124, 4.287487983703613, 4.287487983703613, 4.276224136352539, 4.283391952514648, 4.282368183135986, 4.280320167541504, 4.2782721519470215, 4.273151874542236, 4.2782721519470215, 4.276224136352539, 4.276224136352539, 4.282368183135986, 4.274176120758057, 4.282368183135986, 4.280320167541504, 4.2782721519470215, 4.280288219451904, 4.280320167541504, 4.283391952514648], "compile_time": 2278.196972794831, "verification_time": 0, "benchmark_time": 138.91082629561424, "GFLOP/s": 1761.3143483518452, "strategy_time": 0, "framework_time": 1.406222116202116, "timestamp": "2023-05-18 08:32:39.660120+00:00"},
"16,1,2,3,1,0": {"block_size_x": 16, "block_size_y": 1, "tile_size_x": 2, "tile_size_y": 3, "read_only": 1, "use_padding": 0, "time": 4.424702033400536, "times": [4.469664096832275, 4.426752090454102, 4.428800106048584, 4.430848121643066, 4.425727844238281, 4.430848121643066, 4.429823875427246, 4.423679828643799, 4.423679828643799, 4.426752090454102, 4.428800106048584, 4.426752090454102, 4.426752090454102, 4.43177604675293, 4.427775859832764, 4.428800106048584, 4.424704074859619, 4.426752090454102, 4.426752090454102, 4.428800106048584, 4.424736022949219, 4.423679828643799, 4.422656059265137, 4.419583797454834, 4.4113922119140625, 4.413440227508545, 4.413440227508545, 4.412352085113525, 4.4115519523620605, 4.414463996887207, 4.413440227508545, 4.415487766265869], "compile_time": 2116.932191886008, "verification_time": 0, "benchmark_time": 143.07782612740993, "GFLOP/s": 1706.2724547347111, "strategy_time": 0, "framework_time": 1.4809900894761086, "timestamp": "2023-05-18 08:32:41.921639+00:00"},
"16,1,2,3,1,1": {"block_size_x": 16, "block_size_y": 1, "tile_size_x": 2, "tile_size_y": 3, "read_only": 1, "use_padding": 1, "time": 4.423155948519707, "times": [4.471776008605957, 4.428800106048584, 4.429823875427246, 4.430848121643066, 4.425600051879883, 4.433919906616211, 4.424704074859619, 4.426752090454102, 4.425727844238281, 4.428736209869385, 4.425727844238281, 4.424704074859619, 4.423679828643799, 4.428800106048584, 4.425727844238281, 4.427775859832764, 4.423679828643799, 4.427775859832764, 4.417535781860352, 4.415487766265869, 4.4113922119140625, 4.414463996887207, 4.413407802581787, 4.412415981292725, 4.4165120124816895, 4.415487766265869, 4.414336204528809, 4.414463996887207, 4.415487766265869, 4.410367965698242, 4.417535781860352, 4.417535781860352], "compile_time": 2277.9099657200277, "verification_time": 0, "benchmark_time": 142.9036590270698, "GFLOP/s": 1706.868870975862, "strategy_time": 0, "framework_time": 1.4895270578563213, "timestamp": "2023-05-18 08:32:44.343971+00:00"},
"16,1,2,4,0,0": {"block_size_x": 16, "block_size_y": 1, "tile_size_x": 2, "tile_size_y": 4, "read_only": 0, "use_padding": 0, "time": 3.1321049854159355, "times": [3.1784958839416504, 3.1395840644836426, 3.133375883102417, 3.136415958404541, 3.1353919506073, 3.1354880332946777, 3.1385600566864014, 3.1343679428100586, 3.1354880332946777, 3.13753604888916, 3.1344640254974365, 3.1343679428100586, 3.1344640254974365, 3.1353280544281006, 3.136512041091919, 3.1354880332946777, 3.1385600566864014, 3.1334400177001953, 3.1251840591430664, 3.1242239475250244, 3.1252479553222656, 3.1252479553222656, 3.1242239475250244, 3.122175931930542, 3.1242239475250244, 3.1242239475250244, 3.1262080669403076, 3.122175931930542, 3.1242239475250244, 3.123199939727783, 3.1242239475250244, 3.1252479553222656], "compile_time": 2480.696071870625, "verification_time": 0, "benchmark_time": 101.63490613922477, "GFLOP/s": 2410.4387417260896, "strategy_time": 0, "framework_time": 1.529051922261715, "timestamp": "2023-05-18 08:32:46.927860+00:00"},
"16,1,2,4,0,1": {"block_size_x": 16, "block_size_y": 1, "tile_size_x": 2, "tile_size_y": 4, "read_only": 0, "use_padding": 1, "time": 3.1333240047097206, "times": [3.1784000396728516, 3.1385600566864014, 3.136512041091919, 3.136512041091919, 3.1354880332946777, 3.1344640254974365, 3.136512041091919, 3.1334400177001953, 3.1354880332946777, 3.1354880332946777, 3.1322879791259766, 3.136512041091919, 3.1354880332946777, 3.131392002105713, 3.1344640254974365, 3.136512041091919, 3.13753604888916, 3.1344640254974365, 3.136512041091919, 3.1353600025177, 3.132416009902954, 3.1354880332946777, 3.134399890899658, 3.1252479553222656, 3.123199939727783, 3.1242239475250244, 3.121151924133301, 3.1242239475250244, 3.1230719089508057, 3.123199939727783, 3.1241281032562256, 3.1242239475250244], "compile_time": 2479.6531512402, "verification_time": 0, "benchmark_time": 101.61738330498338, "GFLOP/s": 2409.5009608492205, "strategy_time": 0, "framework_time": 1.4738873578608036, "timestamp": "2023-05-18 08:32:49.510633+00:00"},
"16,1,2,4,1,0": {"block_size_x": 16, "block_size_y": 1, "tile_size_x": 2, "tile_size_y": 4, "read_only": 1, "use_padding": 0, "time": 3.1577179804444313, "times": [3.2020480632781982, 3.16211199760437, 3.15993595123291, 3.156991958618164, 3.1590399742126465, 3.161087989807129, 3.161087989807129, 3.161087989807129, 3.156991958618164, 3.1580159664154053, 3.1549439430236816, 3.156991958618164, 3.156991958618164, 3.155967950820923, 3.1568639278411865, 3.1580159664154053, 3.157952070236206, 3.1600639820098877, 3.156991958618164, 3.1539199352264404, 3.1558399200439453, 3.1539199352264404, 3.1579840183258057, 3.156991958618164, 3.1560959815979004, 3.1549439430236816, 3.1549439430236816, 3.1447041034698486, 3.1447041034698486, 3.1447360515594482, 3.147775888442993, 3.167232036590576], "compile_time": 2482.0780782029033, "verification_time": 0, "benchmark_time": 102.91307885199785, "GFLOP/s": 2390.887104787431, "strategy_time": 0, "framework_time": 1.4233137480914593, "timestamp": "2023-05-18 08:32:52.097078+00:00"},
"16,1,2,4,1,1": {"block_size_x": 16, "block_size_y": 1, "tile_size_x": 2, "tile_size_y": 4, "read_only": 1, "use_padding": 1, "time": 3.1570589542388916, "times": [3.1989760398864746, 3.161087989807129, 3.1580159664154053, 3.156991958618164, 3.155967950820923, 3.156991958618164, 3.1539199352264404, 3.1600639820098877, 3.156991958618164, 3.1549439430236816, 3.156991958618164, 3.1559998989105225, 3.1549439430236816, 3.1560959815979004, 3.1590399742126465, 3.152895927429199, 3.1549439430236816, 3.1549439430236816, 3.1549439430236816, 3.1580159664154053, 3.155967950820923, 3.156991958618164, 3.151871919631958, 3.1539199352264404, 3.152895927429199, 3.1549439430236816, 3.1539199352264404, 3.157952070236206, 3.155967950820923, 3.1549439430236816, 3.151871919631958, 3.151871919631958], "compile_time": 2479.4630049727857, "verification_time": 0, "benchmark_time": 102.76133427396417, "GFLOP/s": 2391.3861950101286, "strategy_time": 0, "framework_time": 1.425296999514103, "timestamp": "2023-05-18 08:32:54.680757+00:00"},
"16,1,3,1,0,0": {"block_size_x": 16, "block_size_y": 1, "tile_size_x": 3, "tile_size_y": 1, "read_only": 0, "use_padding": 0, "time": 8.92859798669815, "times": [9.279359817504883, 9.242624282836914, 9.242527961730957, 9.239551544189453, 9.239551544189453, 9.219072341918945, 9.208831787109375, 9.20678424835205, 9.20576000213623, 9.20678424835205, 9.207807540893555, 9.20678424835205, 9.20678424835205, 9.20678424835205, 9.207807540893555, 9.20576000213623, 9.20576000213623, 9.20576000213623, 9.207807540893555, 9.20582389831543, 9.205792427062988, 9.20678424835205, 9.207807540893555, 9.20576000213623, 9.11257553100586, 7.917568206787109, 7.917568206787109, 7.91644811630249, 7.916543960571289, 7.91644811630249, 7.917568206787109, 7.916543960571289], "compile_time": 2646.647034212947, "verification_time": 0, "benchmark_time": 286.8887120857835, "GFLOP/s": 845.5691712458813, "strategy_time": 0, "framework_time": 1.5437686815857887, "timestamp": "2023-05-18 08:32:57.615866+00:00"},
"16,1,3,1,0,1": {"block_size_x": 16, "block_size_y": 1, "tile_size_x": 3, "tile_size_y": 1, "read_only": 0, "use_padding": 1, "time": 8.378427028656006, "times": [9.280447959899902, 9.243647575378418, 9.241600036621094, 9.240575790405273, 9.239520072937012, 9.239551544189453, 9.240575790405273, 9.23852825164795, 9.23852825164795, 9.23852825164795, 8.965120315551758, 7.947264194488525, 7.947264194488525, 7.947264194488525, 7.9482879638671875, 7.9482879638671875, 7.947264194488525, 7.947264194488525, 7.947264194488525, 7.947264194488525, 7.947264194488525, 7.947423934936523, 7.947231769561768, 7.947264194488525, 7.9482879638671875, 7.938975811004639, 7.917471885681152, 7.916543960571289, 7.915520191192627, 7.916543960571289, 7.916543960571289, 7.916543960571289], "compile_time": 2641.1294979043305, "verification_time": 0, "benchmark_time": 269.69329081475735, "GFLOP/s": 901.0936270230982, "strategy_time": 0, "framework_time": 1.4736182056367397, "timestamp": "2023-05-18 08:33:00.528197+00:00"},
"16,1,3,1,1,0": {"block_size_x": 16, "block_size_y": 1, "tile_size_x": 3, "tile_size_y": 1, "read_only": 1, "use_padding": 0, "time": 8.757874131202698, "times": [9.280511856079102, 9.245696067810059, 9.245696067810059, 9.242624282836914, 9.241600036621094, 9.242624282836914, 9.241600036621094, 9.242624282836914, 9.242624282836914, 9.241600036621094, 9.242527961730957, 9.234432220458984, 9.210816383361816, 9.209856033325195, 9.208831787109375, 9.209728240966797, 9.208831787109375, 9.210880279541016, 9.210880279541016, 9.208800315856934, 8.509440422058105, 7.919616222381592, 7.920639991760254, 7.919616222381592, 7.919616222381592, 7.920639991760254, 7.919616222381592, 7.919616222381592, 7.919616222381592, 7.920639991760254, 7.920639991760254, 7.919487953186035], "compile_time": 2638.222166802734, "verification_time": 0, "benchmark_time": 281.4571368508041, "GFLOP/s": 862.052489781925, "strategy_time": 0, "framework_time": 1.4129742048680782, "timestamp": "2023-05-18 08:33:03.449319+00:00"},
"16,1,3,1,1,1": {"block_size_x": 16, "block_size_y": 1, "tile_size_x": 3, "tile_size_y": 1, "read_only": 1, "use_padding": 1, "time": 9.12804999947548, "times": [9.283583641052246, 9.246591567993164, 9.245696067810059, 9.243647575378418, 9.240575790405273, 9.241600036621094, 9.242624282836914, 9.241600036621094, 9.240575790405273, 9.241600036621094, 9.218048095703125, 9.209856033325195, 9.210816383361816, 9.209856033325195, 9.208831787109375, 9.209728240966797, 9.209856033325195, 9.209856033325195, 9.209856033325195, 9.209856033325195, 9.209856033325195, 9.208831787109375, 9.209792137145996, 9.208831787109375, 9.209856033325195, 9.209856033325195, 9.209792137145996, 9.209856033325195, 9.209856033325195, 8.790016174316406, 7.926784038543701, 7.919616222381592], "compile_time": 2630.463746841997, "verification_time": 0, "benchmark_time": 293.45656326040626, "GFLOP/s": 827.0931031747008, "strategy_time": 0, "framework_time": 1.4232737012207508, "timestamp": "2023-05-18 08:33:06.374691+00:00"},
"16,1,3,2,0,0": {"block_size_x": 16, "block_size_y": 1, "tile_size_x": 3, "tile_size_y": 2, "read_only": 0, "use_padding": 0, "time": 4.741226032376289, "times": [4.968448162078857, 4.933472156524658, 4.928512096405029, 4.928415775299072, 4.928512096405029, 4.9273600578308105, 4.928512096405029, 4.927487850189209, 4.927487850189209, 4.927487850189209, 4.926464080810547, 4.928512096405029, 4.927487850189209, 4.928512096405029, 4.927487850189209, 4.927487850189209, 4.926464080810547, 4.926464080810547, 4.92739200592041, 4.926464080810547, 4.926464080810547, 4.396031856536865, 4.3816962242126465, 4.3816962242126465, 4.382719993591309, 4.369376182556152, 4.363264083862305, 4.362239837646484, 4.363264083862305, 4.386720180511475, 4.404128074645996, 4.403200149536133], "compile_time": 2875.639544799924, "verification_time": 0, "benchmark_time": 152.87791518494487, "GFLOP/s": 1592.3617959669573, "strategy_time": 0, "framework_time": 1.4905799180269241, "timestamp": "2023-05-18 08:33:09.404729+00:00"},
"16,1,3,2,0,1": {"block_size_x": 16, "block_size_y": 1, "tile_size_x": 3, "tile_size_y": 2, "read_only": 0, "use_padding": 1, "time": 4.919035017490387, "times": [4.967423915863037, 4.931583881378174, 4.928512096405029, 4.927487850189209, 4.927487850189209, 4.925439834594727, 4.925439834594727, 4.926464080810547, 4.926464080810547, 4.927487850189209, 4.927487850189209, 4.926464080810547, 4.926464080810547, 4.927487850189209, 4.926464080810547, 4.925439834594727, 4.927487850189209, 4.926464080810547, 4.915200233459473, 4.904895782470703, 4.9049601554870605, 4.9049601554870605, 4.9049601554870605, 4.9049601554870605, 4.905983924865723, 4.905888080596924, 4.9049601554870605, 4.9049601554870605, 4.9049601554870605, 4.9049601554870605, 4.9049601554870605, 4.9049601554870605], "compile_time": 2876.2431950308383, "verification_time": 0, "benchmark_time": 158.59378222376108, "GFLOP/s": 1534.8024913739605, "strategy_time": 0, "framework_time": 1.4904388226568699, "timestamp": "2023-05-18 08:33:12.441086+00:00"},
"16,1,3,2,1,0": {"block_size_x": 16, "block_size_y": 1, "tile_size_x": 3, "tile_size_y": 2, "read_only": 1, "use_padding": 0, "time": 4.915708035230637, "times": [4.971424102783203, 4.933631896972656, 4.930560111999512, 4.931583881378174, 4.931583881378174, 4.931551933288574, 4.931583881378174, 4.928512096405029, 4.928512096405029, 4.929535865783691, 4.916224002838135, 4.907008171081543, 4.907008171081543, 4.905983924865723, 4.908031940460205, 4.907008171081543, 4.907008171081543, 4.905983924865723, 4.905983924865723, 4.907008171081543, 4.907008171081543, 4.907008171081543, 4.905983924865723, 4.907008171081543, 4.907008171081543, 4.905983924865723, 4.907008171081543, 4.905983924865723, 4.905983924865723, 4.907008171081543, 4.9049601554870605, 4.905983924865723], "compile_time": 2878.9745159447193, "verification_time": 0, "benchmark_time": 158.90252962708473, "GFLOP/s": 1535.8412553982732, "strategy_time": 0, "framework_time": 1.4680884778499603, "timestamp": "2023-05-18 08:33:15.480461+00:00"},
"16,1,3,2,1,1": {"block_size_x": 16, "block_size_y": 1, "tile_size_x": 3, "tile_size_y": 2, "read_only": 1, "use_padding": 1, "time": 4.923675999045372, "times": [4.968448162078857, 4.932608127593994, 4.928512096405029, 4.929535865783691, 4.929440021514893, 4.927487850189209, 4.929471969604492, 4.927487850189209, 4.927487850189209, 4.926464080810547, 4.926464080810547, 4.925439834594727, 4.926464080810547, 4.925439834594727, 4.92739200592041, 4.927487850189209, 4.926464080810547, 4.926464080810547, 4.925439834594727, 4.926464080810547, 4.925439834594727, 4.926464080810547, 4.925439834594727, 4.926464080810547, 4.926464080810547, 4.90499210357666, 4.9049601554870605, 4.9049601554870605, 4.905983924865723, 4.905983924865723, 4.9049601554870605, 4.905055999755859], "compile_time": 2866.513335611671, "verification_time": 0, "benchmark_time": 158.67599612101912, "GFLOP/s": 1533.3558100621942, "strategy_time": 0, "framework_time": 1.441828440874815, "timestamp": "2023-05-18 08:33:18.507121+00:00"},
"16,1,3,3,0,0": {"block_size_x": 16, "block_size_y": 1, "tile_size_x": 3, "tile_size_y": 3, "read_only": 0, "use_padding": 0, "time": 3.5055659785866737, "times": [3.547136068344116, 3.516416072845459, 3.511296033859253, 3.512320041656494, 3.511296033859253, 3.5133440494537354, 3.5133440494537354, 3.5092480182647705, 3.5102720260620117, 3.5102720260620117, 3.5133440494537354, 3.5093119144439697, 3.5092480182647705, 3.510240077972412, 3.512320041656494, 3.5122880935668945, 3.512255907058716, 3.5133440494537354, 3.511296033859253, 3.5000319480895996, 3.492863893508911, 3.492863893508911, 3.4938879013061523, 3.492863893508911, 3.49183988571167, 3.492863893508911, 3.4938879013061523, 3.49183988571167, 3.492863893508911, 3.4938879013061523, 3.4938879013061523, 3.4959359169006348], "compile_time": 3093.765981029719, "verification_time": 0, "benchmark_time": 113.73655404895544, "GFLOP/s": 2153.6457297100433, "strategy_time": 0, "framework_time": 1.5459228307008743, "timestamp": "2023-05-18 08:33:21.716199+00:00"},
"16,1,3,3,0,1": {"block_size_x": 16, "block_size_y": 1, "tile_size_x": 3, "tile_size_y": 3, "read_only": 0, "use_padding": 1, "time": 3.4925960078835487, "times": [3.540895938873291, 3.5041279792785645, 3.502079963684082, 3.501055955886841, 3.5000319480895996, 3.501055955886841, 3.501055955886841, 3.500960111618042, 3.499936103820801, 3.501055955886841, 3.5000319480895996, 3.5000319480895996, 3.5000319480895996, 3.4990079402923584, 3.5000319480895996, 3.4959359169006348, 3.482624053955078, 3.481600046157837, 3.4835519790649414, 3.4836480617523193, 3.482624053955078, 3.482624053955078, 3.482624053955078, 3.481600046157837, 3.4805760383605957, 3.4836480617523193, 3.481600046157837, 3.481600046157837, 3.4805760383605957, 3.482624053955078, 3.481600046157837, 3.482624053955078], "compile_time": 3096.3695528917015, "verification_time": 0, "benchmark_time": 113.5560660623014, "GFLOP/s": 2161.6434259669822, "strategy_time": 0, "framework_time": 1.3079079799354076, "timestamp": "2023-05-18 08:33:24.927463+00:00"},
"16,1,3,3,1,0": {"block_size_x": 16, "block_size_y": 1, "tile_size_x": 3, "tile_size_y": 3, "read_only": 1, "use_padding": 0, "time": 3.49890299141407, "times": [3.5491840839385986, 3.5163519382476807, 3.5082240104675293, 3.5092480182647705, 3.512320041656494, 3.511296033859253, 3.511296033859253, 3.5102720260620117, 3.5092480182647705, 3.5082240104675293, 3.490816116333008, 3.490816116333008, 3.49183988571167, 3.49183988571167, 3.490816116333008, 3.490816116333008, 3.4897921085357666, 3.49183988571167, 3.49183988571167, 3.4917759895324707, 3.492863893508911, 3.490816116333008, 3.49183988571167, 3.490783929824829, 3.4938879013061523, 3.492863893508911, 3.49183988571167, 3.49183988571167, 3.4959359169006348, 3.49183988571167, 3.490816116333008, 3.4917120933532715], "compile_time": 3104.5292639173567, "verification_time": 0, "benchmark_time": 113.4622199460864, "GFLOP/s": 2157.7469334034877, "strategy_time": 0, "framework_time": 1.6975663602352142, "timestamp": "2023-05-18 08:33:28.147181+00:00"},
"16,1,3,3,1,1": {"block_size_x": 16, "block_size_y": 1, "tile_size_x": 3, "tile_size_y": 3, "read_only": 1, "use_padding": 1, "time": 3.4803520143032074, "times": [3.5399680137634277, 3.5031039714813232, 3.4990079402923584, 3.4990079402923584, 3.5009920597076416, 3.4990079402923584, 3.497983932495117, 3.496959924697876, 3.490816116333008, 3.481600046157837, 3.4805760383605957, 3.4805760383605957, 3.4805760383605957, 3.4805760383605957, 3.4805760383605957, 3.481600046157837, 3.4805760383605957, 3.4805760383605957, 3.4805760383605957, 3.4795520305633545, 3.481600046157837, 3.4795520305633545, 3.481600046157837, 3.4795520305633545, 3.4805760383605957, 3.4795520305633545, 3.4805760383605957, 3.4785919189453125, 3.4805760383605957, 3.4805760383605957, 3.4805760383605957, 3.2737278938293457], "compile_time": 3089.045836124569, "verification_time": 0, "benchmark_time": 113.06739086285233, "GFLOP/s": 2169.2481590864354, "strategy_time": 0, "framework_time": 1.47699611261487, "timestamp": "2023-05-18 08:33:31.350801+00:00"},
"16,1,3,4,0,0": {"block_size_x": 16, "block_size_y": 1, "tile_size_x": 3, "tile_size_y": 4, "read_only": 0, "use_padding": 0, "time": 2.9347160011529922, "times": [2.978816032409668, 2.9480960369110107, 2.93887996673584, 2.939903974533081, 2.9409279823303223, 2.9378559589385986, 2.9460480213165283, 2.93887996673584, 2.9368319511413574, 2.93887996673584, 2.9419519901275635, 2.9419519901275635, 2.939903974533081, 2.935807943344116, 2.93887996673584, 2.941920042037964, 2.93887996673584, 2.925568103790283, 2.9214720726013184, 2.9276158809661865, 2.925568103790283, 2.927488088607788, 2.9214720726013184, 2.925568103790283, 2.9286398887634277, 2.9194560050964355, 2.925568103790283, 2.9286398887634277, 2.924544095993042, 2.93068790435791, 2.925568103790283, 2.9286398887634277], "compile_time": 3563.208966050297, "verification_time": 0, "benchmark_time": 95.47330439090729, "GFLOP/s": 2572.5648400164964, "strategy_time": 0, "framework_time": 1.5544998459517956, "timestamp": "2023-05-18 08:33:35.011067+00:00"},
"16,1,3,4,0,1": {"block_size_x": 16, "block_size_y": 1, "tile_size_x": 3, "tile_size_y": 4, "read_only": 0, "use_padding": 1, "time": 2.94234898686409, "times": [2.98688006401062, 2.9429759979248047, 2.9489920139312744, 2.945024013519287, 2.9428799152374268, 2.9470720291137695, 2.9409921169281006, 2.9429759979248047, 2.941823959350586, 2.9409279823303223, 2.9419519901275635, 2.9408960342407227, 2.945024013519287, 2.9429759979248047, 2.93887996673584, 2.9429759979248047, 2.9378559589385986, 2.9440319538116455, 2.9419519901275635, 2.9398720264434814, 2.93887996673584, 2.945024013519287, 2.9429759979248047, 2.93887996673584, 2.9399681091308594, 2.9409279823303223, 2.945024013519287, 2.9407999515533447, 2.938783884048462, 2.9276158809661865, 2.929663896560669, 2.929663896560669], "compile_time": 3567.000672221184, "verification_time": 0, "benchmark_time": 96.10566822811961, "GFLOP/s": 2565.8911412974176, "strategy_time": 0, "framework_time": 1.4849384315311909, "timestamp": "2023-05-18 08:33:38.675689+00:00"},
"16,1,3,4,1,0": {"block_size_x": 16, "block_size_y": 1, "tile_size_x": 3, "tile_size_y": 4, "read_only": 1, "use_padding": 0, "time": 2.9455030113458633, "times": [2.9849600791931152, 2.9480960369110107, 2.944000005722046, 2.945024013519287, 2.942944049835205, 2.9460480213165283, 2.944000005722046, 2.9419519901275635, 2.945024013519287, 2.939903974533081, 2.9419519901275635, 2.9470720291137695, 2.944000005722046, 2.945024013519287, 2.944000005722046, 2.944000005722046, 2.945024013519287, 2.945024013519287, 2.9470720291137695, 2.9429759979248047, 2.939903974533081, 2.9419519901275635, 2.9429759979248047, 2.9470720291137695, 2.9409279823303223, 2.9460480213165283, 2.944000005722046, 2.9409279823303223, 2.9460480213165283, 2.945024013519287, 2.9460480213165283, 2.9470720291137695], "compile_time": 3564.829138107598, "verification_time": 0, "benchmark_time": 96.22270707041025, "GFLOP/s": 2563.143602610122, "strategy_time": 0, "framework_time": 1.5528257936239243, "timestamp": "2023-05-18 08:33:42.338324+00:00"},
"16,1,3,4,1,1": {"block_size_x": 16, "block_size_y": 1, "tile_size_x": 3, "tile_size_y": 4, "read_only": 1, "use_padding": 1, "time": 2.942142993211746, "times": [2.9859840869903564, 2.948064088821411, 2.9471681118011475, 2.9480960369110107, 2.9429759979248047, 2.9460480213165283, 2.9460480213165283, 2.944000005722046, 2.9419519901275635, 2.9419519901275635, 2.950144052505493, 2.9419519901275635, 2.9419519901275635, 2.9460480213165283, 2.9419519901275635, 2.9418880939483643, 2.949120044708252, 2.945024013519287, 2.9409279823303223, 2.944000005722046, 2.9470720291137695, 2.949120044708252, 2.93887996673584, 2.9316799640655518, 2.9327359199523926, 2.9286398887634277, 2.9317119121551514, 2.93068790435791, 2.93068790435791, 2.933759927749634, 2.929663896560669, 2.9286398887634277], "compile_time": 3556.256534997374, "verification_time": 0, "benchmark_time": 96.0033368319273, "GFLOP/s": 2566.070791738926, "strategy_time": 0, "framework_time": 1.4738067984580994, "timestamp": "2023-05-18 08:33:45.992087+00:00"},
"16,1,4,1,0,0": {"block_size_x": 16, "block_size_y": 1, "tile_size_x": 4, "tile_size_y": 1, "read_only": 0, "use_padding": 0, "time": 8.886270955204964, "times": [9.13203239440918, 9.09823989868164, 9.096192359924316, 9.094240188598633, 9.095168113708496, 9.094143867492676, 9.094143867492676, 9.085951805114746, 9.064448356628418, 9.065471649169922, 9.065471649169922, 9.065471649169922, 9.064448356628418, 9.066495895385742, 9.064448356628418, 9.067520141601562, 9.066495895385742, 9.06544017791748, 9.065471649169922, 9.066399574279785, 9.064448356628418, 9.065471649169922, 9.066495895385742, 9.066495895385742, 9.065471649169922, 9.065471649169922, 9.065471649169922, 8.3886079788208, 7.734272003173828, 7.734272003173828, 7.732223987579346, 7.734272003173828], "compile_time": 3298.2802321203053, "verification_time": 0, "benchmark_time": 285.9091777354479, "GFLOP/s": 849.5967811535028, "strategy_time": 0, "framework_time": 1.5330491587519646, "timestamp": "2023-05-18 08:33:49.577838+00:00"},
"16,1,4,1,0,1": {"block_size_x": 16, "block_size_y": 1, "tile_size_x": 4, "tile_size_y": 1, "read_only": 0, "use_padding": 1, "time": 8.943569004535675, "times": [9.136128425598145, 9.09823989868164, 9.0982084274292, 9.09823989868164, 9.096192359924316, 9.095168113708496, 9.094143867492676, 9.094143867492676, 9.092096328735352, 9.06447982788086, 9.065343856811523, 9.065471649169922, 9.065471649169922, 9.065471649169922, 9.065471649169922, 9.063455581665039, 9.063424110412598, 9.064448356628418, 9.065471649169922, 9.063424110412598, 9.063424110412598, 9.064448356628418, 9.066495895385742, 9.066495895385742, 9.064448356628418, 9.063424110412598, 9.064319610595703, 9.064448356628418, 8.839072227478027, 7.738239765167236, 7.7342400550842285, 7.7506561279296875], "compile_time": 3300.142256077379, "verification_time": 0, "benchmark_time": 287.75699716061354, "GFLOP/s": 844.1537373023222, "strategy_time": 0, "framework_time": 1.4691189862787724, "timestamp": "2023-05-18 08:33:53.167235+00:00"},
"16,1,4,1,1,0": {"block_size_x": 16, "block_size_y": 1, "tile_size_x": 4, "tile_size_y": 1, "read_only": 1, "use_padding": 0, "time": 8.950777053833008, "times": [9.088000297546387, 9.055232048034668, 9.051136016845703, 9.049087524414062, 9.047039985656738, 9.047039985656738, 9.049087524414062, 9.048064231872559, 9.046015739440918, 9.047039985656738, 9.025471687316895, 9.018367767333984, 9.01734447479248, 9.01734447479248, 9.018367767333984, 9.01734447479248, 9.018367767333984, 9.018336296081543, 9.01734447479248, 9.01734447479248, 9.01734447479248, 9.018303871154785, 9.018367767333984, 9.018367767333984, 9.01734447479248, 9.018367767333984, 9.018367767333984, 9.01734447479248, 9.018367767333984, 9.01734447479248, 7.8397440910339355, 7.692224025726318], "compile_time": 3298.461210913956, "verification_time": 0, "benchmark_time": 288.0313699133694, "GFLOP/s": 843.4739413788614, "strategy_time": 0, "framework_time": 1.4771339483559132, "timestamp": "2023-05-18 08:33:56.755233+00:00"},
"16,1,4,1,1,1": {"block_size_x": 16, "block_size_y": 1, "tile_size_x": 4, "tile_size_y": 1, "read_only": 1, "use_padding": 1, "time": 8.954938128590584, "times": [9.086976051330566, 9.052063941955566, 9.050111770629883, 9.048064231872559, 9.049087524414062, 9.048064231872559, 9.048064231872559, 9.045951843261719, 9.047039985656738, 9.048064231872559, 9.029631614685059, 9.01734447479248, 9.018367767333984, 9.019392013549805, 9.018367767333984, 9.01734447479248, 9.01734447479248, 9.01734447479248, 9.01734447479248, 9.018367767333984, 9.01734447479248, 9.01734447479248, 9.018367767333984, 9.018367767333984, 9.01734447479248, 9.01734447479248, 9.017312049865723, 9.01734447479248, 9.01734447479248, 9.019392013549805, 7.974912166595459, 7.6912641525268555], "compile_time": 3308.3159727975726, "verification_time": 0, "benchmark_time": 288.10152132064104, "GFLOP/s": 843.082005881849, "strategy_time": 0, "framework_time": 1.3263928703963757, "timestamp": "2023-05-18 08:34:00.353010+00:00"},
"16,1,4,2,0,0": {"block_size_x": 16, "block_size_y": 1, "tile_size_x": 4, "tile_size_y": 2, "read_only": 0, "use_padding": 0, "time": 4.901721969246864, "times": [4.948991775512695, 4.91315221786499, 4.908031940460205, 4.909056186676025, 4.909023761749268, 4.914175987243652, 4.908031940460205, 4.905983924865723, 4.905983924865723, 4.908991813659668, 4.909023761749268, 4.908031940460205, 4.907008171081543, 4.9079999923706055, 4.905983924865723, 4.905983924865723, 4.907008171081543, 4.9049601554870605, 4.9060797691345215, 4.907008171081543, 4.887551784515381, 4.888576030731201, 4.886528015136719, 4.888576030731201, 4.886528015136719, 4.887551784515381, 4.888576030731201, 4.888576030731201, 4.888576030731201, 4.887551784515381, 4.888448238372803, 4.887551784515381], "compile_time": 3604.3779719620943, "verification_time": 0, "benchmark_time": 158.41187303885818, "GFLOP/s": 1540.2234658282744, "strategy_time": 0, "framework_time": 1.4633783139288425, "timestamp": "2023-05-18 08:34:04.117300+00:00"},
"16,1,4,2,0,1": {"block_size_x": 16, "block_size_y": 1, "tile_size_x": 4, "tile_size_y": 2, "read_only": 0, "use_padding": 1, "time": 4.894680976867676, "times": [4.9541120529174805, 4.918272018432617, 4.907008171081543, 4.909056186676025, 4.908031940460205, 4.909056186676025, 4.907008171081543, 4.890624046325684, 4.886528015136719, 4.888576030731201, 4.888576030731201, 4.888576030731201, 4.888576030731201, 4.888576030731201, 4.887551784515381, 4.887519836425781, 4.887551784515381, 4.888576030731201, 4.889599800109863, 4.889599800109863, 4.888576030731201, 4.888576030731201, 4.888576030731201, 4.889599800109863, 4.887551784515381, 4.889599800109863, 4.888576030731201, 4.888576030731201, 4.888512134552002, 4.889472007751465, 4.889599800109863, 4.889599800109863], "compile_time": 3602.4611252360046, "verification_time": 0, "benchmark_time": 158.4309982135892, "GFLOP/s": 1542.4390753309972, "strategy_time": 0, "framework_time": 1.5876106917858124, "timestamp": "2023-05-18 08:34:07.879809+00:00"},
"16,1,4,2,1,0": {"block_size_x": 16, "block_size_y": 1, "tile_size_x": 4, "tile_size_y": 2, "read_only": 1, "use_padding": 0, "time": 4.741487950086594, "times": [4.923391819000244, 4.884479999542236, 4.879360198974609, 4.883391857147217, 4.8803839683532715, 4.883456230163574, 4.880320072174072, 4.882431983947754, 4.8772478103637695, 4.86297607421875, 4.859903812408447, 4.860928058624268, 4.860928058624268, 4.860928058624268, 4.860928058624268, 4.859903812408447, 4.859903812408447, 4.860928058624268, 4.858880043029785, 4.860928058624268, 4.858880043029785, 4.860799789428711, 4.859903812408447, 4.861824035644531, 4.859903812408447, 4.430751800537109, 4.257823944091797, 4.258815765380859, 4.25984001159668, 4.258815765380859, 4.25984001159668, 4.258815765380859], "compile_time": 3530.578027945012, "verification_time": 0, "benchmark_time": 153.0892001464963, "GFLOP/s": 1592.2738346012497, "strategy_time": 0, "framework_time": 1.446437556296587, "timestamp": "2023-05-18 08:34:11.564953+00:00"},
"16,1,4,2,1,1": {"block_size_x": 16, "block_size_y": 1, "tile_size_x": 4, "tile_size_y": 2, "read_only": 1, "use_padding": 1, "time": 4.874894976615906, "times": [4.919295787811279, 4.883456230163574, 4.881279945373535, 4.882431983947754, 4.882431983947754, 4.880256175994873, 4.882431983947754, 4.8803839683532715, 4.880256175994873, 4.881408214569092, 4.8803839683532715, 4.8803839683532715, 4.881408214569092, 4.879360198974609, 4.881375789642334, 4.879360198974609, 4.8803839683532715, 4.8803839683532715, 4.8803839683532715, 4.8803839683532715, 4.863999843597412, 4.860928058624268, 4.86195182800293, 4.86195182800293, 4.859903812408447, 4.86195182800293, 4.86195182800293, 4.860928058624268, 4.859903812408447, 4.86195182800293, 4.860928058624268, 4.862847805023193], "compile_time": 3288.4863219223917, "verification_time": 0, "benchmark_time": 157.66343101859093, "GFLOP/s": 1548.6994563400717, "strategy_time": 0, "framework_time": 1.4790394343435764, "timestamp": "2023-05-18 08:34:15.012610+00:00"},
"16,1,4,3,0,0": {"block_size_x": 16, "block_size_y": 1, "tile_size_x": 4, "tile_size_y": 3, "read_only": 0, "use_padding": 0, "time": 3.891865022480488, "times": [3.9383039474487305, 3.8983678817749023, 3.892224073410034, 3.8880319595336914, 3.902463912963867, 3.8973441123962402, 3.8993918895721436, 3.8932480812072754, 3.895296096801758, 3.8973441123962402, 3.895296096801758, 3.8942720890045166, 3.8932480812072754, 3.8881280422210693, 3.8993918895721436, 3.896320104598999, 3.8901760578155518, 3.8901760578155518, 3.891200065612793, 3.906559944152832, 3.8992960453033447, 3.8840320110321045, 3.902463912963867, 3.8973441123962402, 3.896320104598999, 3.8645761013031006, 3.872767925262451, 3.8778879642486572, 3.8717761039733887, 3.875839948654175, 3.875839948654175, 3.8747520446777344], "compile_time": 3940.1873373426497, "verification_time": 0, "benchmark_time": 126.16364983841777, "GFLOP/s": 1939.8789928197853, "strategy_time": 0, "framework_time": 1.501079648733139, "timestamp": "2023-05-18 08:34:19.080492+00:00"},
"16,1,4,3,0,1": {"block_size_x": 16, "block_size_y": 1, "tile_size_x": 4, "tile_size_y": 3, "read_only": 0, "use_padding": 1, "time": 3.8269010186195374, "times": [3.945472002029419, 3.892224073410034, 3.896320104598999, 3.875839948654175, 3.895296096801758, 3.8993918895721436, 3.8849918842315674, 3.8932480812072754, 3.8973441123962402, 3.888063907623291, 3.8850560188293457, 3.8850560188293457, 3.9034879207611084, 3.896320104598999, 3.8635520935058594, 3.886080026626587, 3.8972480297088623, 3.891200065612793, 3.880959987640381, 3.892224073410034, 3.9034879207611084, 3.886080026626587, 3.8942720890045166, 3.8973441123962402, 3.9004158973693848, 3.891103982925415, 3.8840320110321045, 3.54915189743042, 3.4498560428619385, 3.4447360038757324, 3.457024097442627, 3.4539520740509033], "compile_time": 3943.2805459946394, "verification_time": 0, "benchmark_time": 124.13362134248018, "GFLOP/s": 1972.809634549521, "strategy_time": 0, "framework_time": 1.5258355997502804, "timestamp": "2023-05-18 08:34:23.149461+00:00"},
"16,1,4,3,1,0": {"block_size_x": 16, "block_size_y": 1, "tile_size_x": 4, "tile_size_y": 3, "read_only": 1, "use_padding": 0, "time": 3.9065619856119156, "times": [3.954848051071167, 3.906559944152832, 3.9127039909362793, 3.9127039909362793, 3.9188480377197266, 3.924992084503174, 3.9045119285583496, 3.915776014328003, 3.9033920764923096, 3.905535936355591, 3.910655975341797, 3.9270401000976562, 3.905535936355591, 3.887104034423828, 3.902463912963867, 3.891295909881592, 3.8942720890045166, 3.8993918895721436, 3.8972480297088623, 3.9086079597473145, 3.9045119285583496, 3.910655975341797, 3.901439905166626, 3.8840320110321045, 3.9096319675445557, 3.8932480812072754, 3.9086079597473145, 3.902463912963867, 3.9086079597473145, 3.906559944152832, 3.9034879207611084, 3.8932480812072754], "compile_time": 3944.2343609407544, "verification_time": 0, "benchmark_time": 126.44022796303034, "GFLOP/s": 1932.5809312142333, "strategy_time": 0, "framework_time": 1.499477308243513, "timestamp": "2023-05-18 08:34:27.221664+00:00"},
"16,1,4,3,1,1": {"block_size_x": 16, "block_size_y": 1, "tile_size_x": 4, "tile_size_y": 3, "read_only": 1, "use_padding": 1, "time": 3.9030039981007576, "times": [3.9383039474487305, 3.92192006111145, 3.9004158973693848, 3.909600019454956, 3.904416084289551, 3.910655975341797, 3.9004158973693848, 3.8973441123962402, 3.916800022125244, 3.8983678817749023, 3.9045119285583496, 3.920896053314209, 3.9147520065307617, 3.9137279987335205, 3.895296096801758, 3.9086079597473145, 3.901439905166626, 3.9178240299224854, 3.901439905166626, 3.8983678817749023, 3.8840320110321045, 3.905535936355591, 3.895296096801758, 3.881983995437622, 3.8932480812072754, 3.9004158973693848, 3.8932480812072754, 3.8891520500183105, 3.9075839519500732, 3.895296096801758, 3.892224073410034, 3.8830080032348633], "compile_time": 3749.1224058903754, "verification_time": 0, "benchmark_time": 126.36548932641745, "GFLOP/s": 1934.3426764804199, "strategy_time": 0, "framework_time": 1.7154598608613014, "timestamp": "2023-05-18 08:34:31.098897+00:00"},
"16,1,4,4,0,0": {"block_size_x": 16, "block_size_y": 1, "tile_size_x": 4, "tile_size_y": 4, "read_only": 0, "use_padding": 0, "time": 2.822782017290592, "times": [2.870271921157837, 2.8323841094970703, 2.8293120861053467, 2.8272640705108643, 2.8272640705108643, 2.826240062713623, 2.8263039588928223, 2.8241920471191406, 2.8261120319366455, 2.8272640705108643, 2.8282880783081055, 2.8272640705108643, 2.8293120861053467, 2.8282880783081055, 2.825216054916382, 2.8272640705108643, 2.826240062713623, 2.8272640705108643, 2.815999984741211, 2.8139519691467285, 2.815999984741211, 2.8139519691467285, 2.8129279613494873, 2.8139519691467285, 2.811903953552246, 2.810879945755005, 2.8139519691467285, 2.8139519691467285, 2.8139519691467285, 2.8149759769439697, 2.8129279613494873, 2.8139519691467285], "compile_time": 4195.0571071356535, "verification_time": 0, "benchmark_time": 91.77860012277961, "GFLOP/s": 2674.576766379757, "strategy_time": 0, "framework_time": 1.4916318468749523, "timestamp": "2023-05-18 08:34:35.387254+00:00"},
"16,1,4,4,0,1": {"block_size_x": 16, "block_size_y": 1, "tile_size_x": 4, "tile_size_y": 4, "read_only": 0, "use_padding": 1, "time": 2.8236120268702507, "times": [2.871295928955078, 2.831360101699829, 2.8282880783081055, 2.826240062713623, 2.825216054916382, 2.8261120319366455, 2.825216054916382, 2.8282880783081055, 2.8293120861053467, 2.828320026397705, 2.8282880783081055, 2.825216054916382, 2.825216054916382, 2.8242239952087402, 2.829184055328369, 2.8241920471191406, 2.8241920471191406, 2.826240062713623, 2.8272640705108643, 2.826240062713623, 2.826240062713623, 2.815999984741211, 2.812864065170288, 2.8129279613494873, 2.8128960132598877, 2.8139519691467285, 2.8120639324188232, 2.815999984741211, 2.8139519691467285, 2.8129279613494873, 2.8129279613494873, 2.8129279613494873], "compile_time": 4196.190929040313, "verification_time": 0, "benchmark_time": 91.91770991310477, "GFLOP/s": 2673.790566180685, "strategy_time": 0, "framework_time": 1.5826420858502388, "timestamp": "2023-05-18 08:34:39.676974+00:00"},
