cache_files/convolution_W6600.json
{
"device_name": "AMD Radeon PRO W6600",
"kernel_name": "convolution_kernel",
"problem_size": [
4096,
4096
],
"tune_params_keys": [
"block_size_x",
"block_size_y",
"tile_size_x",
"tile_size_y",
"read_only",
"use_padding"
],
"tune_params": {
"block_size_x": [
16,
32,
48,
64,
80,
96,
112,
128,
144,
160,
176,
192,
208,
224,
240,
256
],
"block_size_y": [
1,
2,
4,
8,
16
],
"tile_size_x": [
1,
2,
3,
4
],
"tile_size_y": [
1,
2,
3,
4
],
"read_only": [
0,
1
],
"use_padding": [
0,
1
]
},
"objective": "time",
"cache": {
"16,1,1,1,0,0": {"block_size_x": 16, "block_size_y": 1, "tile_size_x": 1, "tile_size_y": 1, "read_only": 0, "use_padding": 0, "time": 33.67730700969696, "times": [33.65721130371094, 33.686767578125, 33.685813903808594, 33.657352447509766, 33.69009017944336, 33.69402313232422, 33.66341018676758, 33.6912956237793, 33.693931579589844, 33.657562255859375, 33.69021224975586, 33.68699264526367, 33.65501022338867, 33.684043884277344, 33.68821334838867, 33.685577392578125, 33.65725326538086, 33.68859100341797, 33.68825149536133, 33.65676498413086, 33.68749237060547, 33.68598556518555, 33.65529251098633, 33.68577575683594, 33.685691833496094, 33.655704498291016, 33.68777084350586, 33.68780517578125, 33.6557731628418, 33.68507385253906, 33.686012268066406, 33.65707778930664], "compile_time": 303.40102687478065, "verification_time": 0, "benchmark_time": 1082.0353226736188, "GFLOP/s": 224.17906508457293, "strategy_time": 0, "framework_time": 42.74964798241854, "timestamp": "2023-06-26 14:42:48.349958+00:00"},
"16,1,1,1,0,1": {"block_size_x": 16, "block_size_y": 1, "tile_size_x": 1, "tile_size_y": 1, "read_only": 0, "use_padding": 1, "time": 33.673911929130554, "times": [33.683170318603516, 33.68756866455078, 33.6468505859375, 33.67791748046875, 33.68177032470703, 33.65145492553711, 33.682891845703125, 33.681976318359375, 33.65121078491211, 33.68757629394531, 33.68669128417969, 33.69089126586914, 33.656532287597656, 33.68803787231445, 33.69061279296875, 33.65855026245117, 33.685611724853516, 33.68882369995117, 33.657493591308594, 33.685672760009766, 33.68565368652344, 33.65120315551758, 33.6845703125, 33.68324279785156, 33.6485710144043, 33.677425384521484, 33.67797088623047, 33.645076751708984, 33.67997360229492, 33.680233001708984, 33.64881134033203, 33.68114471435547], "compile_time": 300.27570202946663, "verification_time": 0, "benchmark_time": 1081.9379659369588, "GFLOP/s": 224.2016673289711, "strategy_time": 0, "framework_time": 2.498767338693142, "timestamp": "2023-06-26 14:42:49.734685+00:00"},
"16,1,1,1,1,0": {"block_size_x": 16, "block_size_y": 1, "tile_size_x": 1, "tile_size_y": 1, "read_only": 1, "use_padding": 0, "time": 33.62116575241089, "times": [33.62173080444336, 33.59685134887695, 33.63081359863281, 33.62131881713867, 33.5886116027832, 33.61907958984375, 33.6216926574707, 33.597747802734375, 33.62425231933594, 33.62789535522461, 33.600650787353516, 33.630828857421875, 33.63093185424805, 33.60576629638672, 33.6358528137207, 33.635276794433594, 33.60285186767578, 33.633209228515625, 33.63377380371094, 33.63267517089844, 33.603092193603516, 33.63120651245117, 33.6320915222168, 33.60621643066406, 33.63133239746094, 33.63129425048828, 33.605770111083984, 33.63410949707031, 33.632450103759766, 33.60490798950195, 33.634212493896484, 33.63880920410156], "compile_time": 298.3394665643573, "verification_time": 0, "benchmark_time": 1080.2355324849486, "GFLOP/s": 224.55340351958574, "strategy_time": 0, "framework_time": 0.8288733661174774, "timestamp": "2023-06-26 14:42:51.114103+00:00"},
"16,1,1,1,1,1": {"block_size_x": 16, "block_size_y": 1, "tile_size_x": 1, "tile_size_y": 1, "read_only": 1, "use_padding": 1, "time": 33.61140012741089, "times": [33.590572357177734, 33.62165069580078, 33.6169319152832, 33.586830139160156, 33.6240119934082, 33.62447738647461, 33.593772888183594, 33.623600006103516, 33.622413635253906, 33.59172821044922, 33.62193298339844, 33.62177658081055, 33.59197235107422, 33.62214660644531, 33.624813079833984, 33.59184646606445, 33.61981201171875, 33.62104797363281, 33.590091705322266, 33.6235466003418, 33.62377166748047, 33.59217834472656, 33.622493743896484, 33.61936950683594, 33.59081268310547, 33.622169494628906, 33.62061309814453, 33.59104919433594, 33.62117385864258, 33.623897552490234, 33.62133026123047, 33.59096908569336], "compile_time": 298.0635464191437, "verification_time": 0, "benchmark_time": 1079.9400825053453, "GFLOP/s": 224.6186463932219, "strategy_time": 0, "framework_time": 0.7683951407670975, "timestamp": "2023-06-26 14:42:52.492889+00:00"},
"16,1,1,2,0,0": {"block_size_x": 16, "block_size_y": 1, "tile_size_x": 1, "tile_size_y": 2, "read_only": 0, "use_padding": 0, "time": 17.81735795736313, "times": [18.176528930664062, 17.802047729492188, 17.804048538208008, 17.8017520904541, 17.803848266601562, 17.810728073120117, 17.804367065429688, 17.804061889648438, 17.810688018798828, 17.805408477783203, 17.807207107543945, 17.810579299926758, 17.807048797607422, 17.8073673248291, 17.812088012695312, 17.80571174621582, 17.810327529907227, 17.8050479888916, 17.806367874145508, 17.809051513671875, 17.802528381347656, 17.803007125854492, 17.80552864074707, 17.799680709838867, 17.8020076751709, 17.80620765686035, 17.802688598632812, 17.805484771728516, 17.808048248291016, 17.801767349243164, 17.808927536010742, 17.805301666259766], "compile_time": 361.1666252836585, "verification_time": 0, "benchmark_time": 573.5032903030515, "GFLOP/s": 423.7298940766929, "strategy_time": 0, "framework_time": 0.9164074435830116, "timestamp": "2023-06-26 14:42:53.428488+00:00"},
"16,1,1,2,0,1": {"block_size_x": 16, "block_size_y": 1, "tile_size_x": 1, "tile_size_y": 2, "read_only": 0, "use_padding": 1, "time": 17.850487411022186, "times": [18.370328903198242, 17.83496856689453, 17.828689575195312, 17.826276779174805, 17.8333683013916, 17.826568603515625, 17.82373046875, 17.831241607666016, 17.824687957763672, 17.824127197265625, 17.83156967163086, 17.825349807739258, 17.832250595092773, 17.8264102935791, 17.827129364013672, 17.83361053466797, 17.8264102935791, 17.827810287475586, 17.834930419921875, 17.828670501708984, 17.828968048095703, 17.850210189819336, 17.83749008178711, 17.834287643432617, 17.849327087402344, 17.82676887512207, 17.845849990844727, 17.846799850463867, 17.8330078125, 17.846370697021484, 17.85652732849121, 17.841859817504883], "compile_time": 361.91668920218945, "verification_time": 0, "benchmark_time": 574.565913528204, "GFLOP/s": 422.9434763410571, "strategy_time": 0, "framework_time": 0.21394342184066772, "timestamp": "2023-06-26 14:43:30.468270+00:00"},
"16,1,1,2,1,0": {"block_size_x": 16, "block_size_y": 1, "tile_size_x": 1, "tile_size_y": 2, "read_only": 1, "use_padding": 0, "time": 17.858005702495575, "times": [18.134328842163086, 17.8264102935791, 17.831050872802734, 17.82676124572754, 17.825687408447266, 17.830049514770508, 17.827049255371094, 17.82733154296875, 17.842967987060547, 17.834287643432617, 17.843408584594727, 17.84823989868164, 17.8421688079834, 17.845529556274414, 17.860248565673828, 17.84354019165039, 17.847728729248047, 17.85904884338379, 17.859207153320312, 17.864208221435547, 17.86052894592285, 17.86092758178711, 17.864608764648438, 17.862367630004883, 17.865407943725586, 17.862567901611328, 17.861408233642578, 17.86421775817871, 17.861248016357422, 17.86096954345703, 17.866689682006836, 17.84598731994629], "compile_time": 359.4527915120125, "verification_time": 0, "benchmark_time": 574.796175584197, "GFLOP/s": 422.76541545425516, "strategy_time": 0, "framework_time": 0.7770750671625137, "timestamp": "2023-06-26 14:43:31.403312+00:00"},
"16,1,1,2,1,1": {"block_size_x": 16, "block_size_y": 1, "tile_size_x": 1, "tile_size_y": 2, "read_only": 1, "use_padding": 1, "time": 17.85967618227005, "times": [18.171287536621094, 17.820369720458984, 17.821569442749023, 17.82550048828125, 17.823007583618164, 17.83856964111328, 17.830089569091797, 17.85276985168457, 17.855127334594727, 17.860570907592773, 17.85536766052246, 17.86126708984375, 17.855167388916016, 17.854209899902344, 17.858930587768555, 17.854278564453125, 17.854888916015625, 17.859329223632812, 17.852249145507812, 17.853628158569336, 17.855287551879883, 17.850088119506836, 17.850967407226562, 17.855756759643555, 17.85308837890625, 17.85633087158203, 17.851367950439453, 17.853248596191406, 17.858007431030273, 17.853370666503906, 17.854169845581055, 17.85977554321289], "compile_time": 358.3534574136138, "verification_time": 0, "benchmark_time": 574.8599637299776, "GFLOP/s": 422.72587268378965, "strategy_time": 0, "framework_time": 0.8231634274125099, "timestamp": "2023-06-26 14:43:32.337363+00:00"},
"16,1,1,3,0,0": {"block_size_x": 16, "block_size_y": 1, "tile_size_x": 1, "tile_size_y": 3, "read_only": 0, "use_padding": 0, "time": 47.61716103553772, "times": [50.495147705078125, 46.339134216308594, 46.31418228149414, 46.52217102050781, 46.7922248840332, 46.81852722167969, 47.41370391845703, 47.74815368652344, 47.719383239746094, 47.69062423706055, 47.69918441772461, 47.722434997558594, 47.747825622558594, 47.73091125488281, 47.66758346557617, 47.717769622802734, 47.733863830566406, 47.73806381225586, 47.76482391357422, 47.70945739746094, 47.77150344848633, 47.73418426513672, 47.728904724121094, 47.6850471496582, 47.76406478881836, 47.77888488769531, 47.68598556518555, 47.685577392578125, 47.670745849609375, 47.69877624511719, 47.7097053527832, 47.75060272216797], "compile_time": 472.96612337231636, "verification_time": 0, "benchmark_time": 1526.7716608941555, "GFLOP/s": 158.55097271266257, "strategy_time": 0, "framework_time": 1.5865666791796684, "timestamp": "2023-06-26 14:43:34.338701+00:00"},
"16,1,1,3,0,1": {"block_size_x": 16, "block_size_y": 1, "tile_size_x": 1, "tile_size_y": 3, "read_only": 0, "use_padding": 1, "time": 50.05317509174347, "times": [52.69902801513672, 49.326961517333984, 49.322509765625, 49.52299880981445, 50.07938766479492, 50.06212615966797, 50.035587310791016, 50.02547836303711, 49.98802947998047, 50.01483917236328, 49.98918914794922, 50.054222106933594, 49.98918914794922, 50.049598693847656, 49.99906921386719, 50.02452850341797, 49.99958801269531, 50.067169189453125, 50.0317497253418, 50.044654846191406, 50.03158950805664, 50.0439453125, 50.0268669128418, 50.05170822143555, 50.049949645996094, 50.04685592651367, 50.03666687011719, 50.01700973510742, 49.99898910522461, 50.04716110229492, 50.006866455078125, 50.018089294433594], "compile_time": 480.01379799097776, "verification_time": 0, "benchmark_time": 1604.763121344149, "GFLOP/s": 150.83453119930786, "strategy_time": 0, "framework_time": 1.898905262351036, "timestamp": "2023-06-26 14:43:36.425391+00:00"},
"16,1,1,3,1,0": {"block_size_x": 16, "block_size_y": 1, "tile_size_x": 1, "tile_size_y": 3, "read_only": 1, "use_padding": 0, "time": 47.33377814292908, "times": [50.24538803100586, 46.11435317993164, 46.13258361816406, 46.33429718017578, 46.68366241455078, 46.63750457763672, 46.89246368408203, 47.32437515258789, 47.432586669921875, 47.29609680175781, 47.415985107421875, 47.38234329223633, 47.426509857177734, 47.48345184326172, 47.42158889770508, 47.44197082519531, 47.44386672973633, 47.388484954833984, 47.43826675415039, 47.48652648925781, 47.3551025390625, 47.408329010009766, 47.47282791137695, 47.417545318603516, 47.505062103271484, 47.40707015991211, 47.47578811645508, 47.44783020019531, 47.4680290222168, 47.45726013183594, 47.38290786743164, 47.46084213256836], "compile_time": 471.9637269154191, "verification_time": 0, "benchmark_time": 1517.5620298832655, "GFLOP/s": 159.50020252350834, "strategy_time": 0, "framework_time": 0.7350845262408257, "timestamp": "2023-06-26 14:43:38.415665+00:00"},
"16,1,1,3,1,1": {"block_size_x": 16, "block_size_y": 1, "tile_size_x": 1, "tile_size_y": 3, "read_only": 1, "use_padding": 1, "time": 49.79563510417938, "times": [53.23683166503906, 49.029964447021484, 49.027347564697266, 49.25955581665039, 49.78386688232422, 49.735103607177734, 49.74778747558594, 49.73842239379883, 49.7699089050293, 49.715911865234375, 49.74138641357422, 49.733192443847656, 49.745147705078125, 49.741668701171875, 49.759986877441406, 49.74524688720703, 49.73230743408203, 49.75717544555664, 49.75050735473633, 49.73750686645508, 49.73802947998047, 49.74000930786133, 49.7705078125, 49.75814437866211, 49.73890686035156, 49.740234375, 49.74462890625, 49.75052261352539, 49.754547119140625, 49.74295425415039, 49.746826171875, 49.746185302734375], "compile_time": 471.4793134480715, "verification_time": 0, "benchmark_time": 1596.452779136598, "GFLOP/s": 151.61463819479116, "strategy_time": 0, "framework_time": 0.875360332429409, "timestamp": "2023-06-26 14:43:40.484488+00:00"},
"16,1,1,4,0,0": {"block_size_x": 16, "block_size_y": 1, "tile_size_x": 1, "tile_size_y": 4, "read_only": 0, "use_padding": 0, "time": 9.977298885583878, "times": [11.361685752868652, 9.92840576171875, 9.934725761413574, 9.930086135864258, 9.930726051330566, 9.931406021118164, 9.929827690124512, 9.938085556030273, 9.930365562438965, 9.931406021118164, 9.93116569519043, 9.932206153869629, 9.938085556030273, 9.93148422241211, 9.93128490447998, 9.932005882263184, 9.93100643157959, 9.937886238098145, 9.930926322937012, 9.931486129760742, 9.931295394897461, 9.932085037231445, 9.939166069030762, 9.931646347045898, 9.932846069335938, 9.931965827941895, 9.931965827941895, 9.939273834228516, 9.93244457244873, 9.932366371154785, 9.93176555633545, 9.932485580444336], "compile_time": 467.5010060891509, "verification_time": 0, "benchmark_time": 322.5931553170085, "GFLOP/s": 756.6924962936182, "strategy_time": 0, "framework_time": 0.86160097271204, "timestamp": "2023-06-26 14:43:41.275457+00:00"},
"16,1,1,4,0,1": {"block_size_x": 16, "block_size_y": 1, "tile_size_x": 1, "tile_size_y": 4, "read_only": 0, "use_padding": 1, "time": 10.229887694120407, "times": [11.753127098083496, 10.179286003112793, 10.180886268615723, 10.18924617767334, 10.17712688446045, 10.178261756896973, 10.179765701293945, 10.188925743103027, 10.17684555053711, 10.178886413574219, 10.174766540527344, 10.17504596710205, 10.188084602355957, 10.180246353149414, 10.184565544128418, 10.180286407470703, 10.180525779724121, 10.192046165466309, 10.177726745605469, 10.179155349731445, 10.180126190185547, 10.18056583404541, 10.189645767211914, 10.175765991210938, 10.179645538330078, 10.182246208190918, 10.174934387207031, 10.186925888061523, 10.176165580749512, 10.18000602722168, 10.17564582824707, 10.179925918579102], "compile_time": 467.52809546887875, "verification_time": 0, "benchmark_time": 330.6815540418029, "GFLOP/s": 738.0088057407698, "strategy_time": 0, "framework_time": 0.8930200710892677, "timestamp": "2023-06-26 14:43:42.074573+00:00"},
"16,1,1,4,1,0": {"block_size_x": 16, "block_size_y": 1, "tile_size_x": 1, "tile_size_y": 4, "read_only": 1, "use_padding": 0, "time": 9.958725571632385, "times": [11.0970458984375, 9.919805526733398, 9.919445991516113, 9.922005653381348, 9.91860580444336, 9.919845581054688, 9.92039966583252, 9.921566009521484, 9.926325798034668, 9.921686172485352, 9.921126365661621, 9.919646263122559, 9.920446395874023, 9.925959587097168, 9.920406341552734, 9.9212064743042, 9.920845985412598, 9.920366287231445, 9.925926208496094, 9.92176628112793, 9.921758651733398, 9.92116641998291, 9.92176628112793, 9.925485610961914, 9.921806335449219, 9.92232608795166, 9.922446250915527, 9.922650337219238, 9.92684555053711, 9.921886444091797, 9.923605918884277, 9.923046112060547], "compile_time": 465.58874007314444, "verification_time": 0, "benchmark_time": 321.5712895616889, "GFLOP/s": 758.1037498920138, "strategy_time": 0, "framework_time": 0.7545556873083115, "timestamp": "2023-06-26 14:43:42.862501+00:00"},
"16,1,1,4,1,1": {"block_size_x": 16, "block_size_y": 1, "tile_size_x": 1, "tile_size_y": 4, "read_only": 1, "use_padding": 1, "time": 9.953189730644226, "times": [10.941205978393555, 9.919405937194824, 9.919405937194824, 9.917925834655762, 9.925246238708496, 9.919445991516113, 9.921216011047363, 9.920805931091309, 9.921606063842773, 9.927725791931152, 9.920326232910156, 9.919245719909668, 9.919205665588379, 9.920395851135254, 9.927685737609863, 9.920125961303711, 9.920326232910156, 9.920685768127441, 9.920126914978027, 9.927165985107422, 9.920044898986816, 9.919965744018555, 9.919726371765137, 9.919365882873535, 9.927125930786133, 9.919646263122559, 9.919365882873535, 9.920166969299316, 9.920565605163574, 9.927125930786133, 9.91956615447998, 9.920125961303711], "compile_time": 466.7085111141205, "verification_time": 0, "benchmark_time": 321.73817325383425, "GFLOP/s": 758.5253978185079, "strategy_time": 0, "framework_time": 0.7985252887010574, "timestamp": "2023-06-26 14:43:43.651760+00:00"},
"16,1,2,1,0,0": {"block_size_x": 16, "block_size_y": 1, "tile_size_x": 2, "tile_size_y": 1, "read_only": 0, "use_padding": 0, "time": 32.15221726894379, "times": [32.1473388671875, 32.14470291137695, 32.137779235839844, 32.148433685302734, 32.16849899291992, 32.138553619384766, 32.167301177978516, 32.146480560302734, 32.13726043701172, 32.16719055175781, 32.16817855834961, 32.137298583984375, 32.16101837158203, 32.16408920288086, 32.13454055786133, 32.164581298828125, 32.13405990600586, 32.16526794433594, 32.16518020629883, 32.13766098022461, 32.16822052001953, 32.16632843017578, 32.134700775146484, 32.16585922241211, 32.16862106323242, 32.13650131225586, 32.1456184387207, 32.16818618774414, 32.138301849365234, 32.16512680053711, 32.16326141357422, 32.114810943603516], "compile_time": 424.4070081040263, "verification_time": 0, "benchmark_time": 1033.0309430137277, "GFLOP/s": 234.8126456364921, "strategy_time": 0, "framework_time": 0.8181929588317871, "timestamp": "2023-06-26 14:43:45.110030+00:00"},
"16,1,2,1,0,1": {"block_size_x": 16, "block_size_y": 1, "tile_size_x": 2, "tile_size_y": 1, "read_only": 0, "use_padding": 1, "time": 32.15384078025818, "times": [32.12022018432617, 32.168922424316406, 32.16865921020508, 32.13568115234375, 32.16790008544922, 32.16512680053711, 32.13454055786133, 32.16619873046875, 32.118141174316406, 32.16663360595703, 32.16461944580078, 32.1351203918457, 32.168418884277344, 32.16718673706055, 32.116458892822266, 32.16741943359375, 32.169578552246094, 32.138607025146484, 32.16749954223633, 32.166648864746094, 32.13993835449219, 32.16902160644531, 32.149139404296875, 32.14038848876953, 32.151859283447266, 32.141929626464844, 32.17353820800781, 32.17185974121094, 32.141380310058594, 32.17279815673828, 32.17414093017578, 32.123329162597656], "compile_time": 425.30835792422295, "verification_time": 0, "benchmark_time": 1033.111429773271, "GFLOP/s": 234.80078947941405, "strategy_time": 0, "framework_time": 0.7177460938692093, "timestamp": "2023-06-26 14:43:46.569182+00:00"},
"16,1,2,1,1,0": {"block_size_x": 16, "block_size_y": 1, "tile_size_x": 2, "tile_size_y": 1, "read_only": 1, "use_padding": 0, "time": 32.11166441440582, "times": [32.09389877319336, 32.118385314941406, 32.11429977416992, 32.08755111694336, 32.1159782409668, 32.11668395996094, 32.091461181640625, 32.11899185180664, 32.12221908569336, 32.09455108642578, 32.12302017211914, 32.12297821044922, 32.09593963623047, 32.12382125854492, 32.09706115722656, 32.12689208984375, 32.125858306884766, 32.097190856933594, 32.12342071533203, 32.124881744384766, 32.097938537597656, 32.1293830871582, 32.12614059448242, 32.09721374511719, 32.125858306884766, 32.1243782043457, 32.09822082519531, 32.12735366821289, 32.09746170043945, 32.10044479370117, 32.122779846191406, 32.09100341796875], "compile_time": 422.52153251320124, "verification_time": 0, "benchmark_time": 1031.8056028336287, "GFLOP/s": 235.109183459611, "strategy_time": 0, "framework_time": 0.7673241198062897, "timestamp": "2023-06-26 14:43:48.024291+00:00"},
"16,1,2,1,1,1": {"block_size_x": 16, "block_size_y": 1, "tile_size_x": 2, "tile_size_y": 1, "read_only": 1, "use_padding": 1, "time": 32.11232936382294, "times": [32.11585998535156, 32.08644485473633, 32.121700286865234, 32.092811584472656, 32.1256217956543, 32.12044143676758, 32.092899322509766, 32.12407302856445, 32.12337875366211, 32.0971794128418, 32.12485885620117, 32.119850158691406, 32.0971794128418, 32.12396240234375, 32.12582015991211, 32.10023880004883, 32.12678146362305, 32.12083053588867, 32.09381866455078, 32.11919021606445, 32.09357833862305, 32.121421813964844, 32.12253952026367, 32.09623336791992, 32.12665939331055, 32.122493743896484, 32.088741302490234, 32.11901092529297, 32.118900299072266, 32.091251373291016, 32.12089920043945, 32.119869232177734], "compile_time": 422.26899042725563, "verification_time": 0, "benchmark_time": 1031.9509292021394, "GFLOP/s": 235.10431505804692, "strategy_time": 0, "framework_time": 0.7414547726511955, "timestamp": "2023-06-26 14:43:49.479266+00:00"},
"16,1,2,2,0,0": {"block_size_x": 16, "block_size_y": 1, "tile_size_x": 2, "tile_size_y": 2, "read_only": 0, "use_padding": 0, "time": 17.069392144680023, "times": [17.669452667236328, 17.0482120513916, 17.050012588500977, 17.052064895629883, 17.046972274780273, 17.04789161682129, 17.053892135620117, 17.049291610717773, 17.047292709350586, 17.05333137512207, 17.047252655029297, 17.048511505126953, 17.054452896118164, 17.049171447753906, 17.049612045288086, 17.051780700683594, 17.04901123046875, 17.04633140563965, 17.053651809692383, 17.04793930053711, 17.046852111816406, 17.052452087402344, 17.048091888427734, 17.048669815063477, 17.05413246154785, 17.048372268676758, 17.053892135620117, 17.049091339111328, 17.04937171936035, 17.055051803588867, 17.04949188232422, 17.0489501953125], "compile_time": 634.0776532888412, "verification_time": 0, "benchmark_time": 549.3912855163217, "GFLOP/s": 442.29736688971735, "strategy_time": 0, "framework_time": 0.8984291926026344, "timestamp": "2023-06-26 14:43:50.663648+00:00"},
"16,1,2,2,0,1": {"block_size_x": 16, "block_size_y": 1, "tile_size_x": 2, "tile_size_y": 2, "read_only": 0, "use_padding": 1, "time": 17.070928871631622, "times": [17.664531707763672, 17.055612564086914, 17.052412033081055, 17.050392150878906, 17.055452346801758, 17.04941177368164, 17.048891067504883, 17.052631378173828, 17.047771453857422, 17.04981231689453, 17.055452346801758, 17.0484619140625, 17.04789161682129, 17.053531646728516, 17.04981231689453, 17.050371170043945, 17.055011749267578, 17.051332473754883, 17.051332473754883, 17.054319381713867, 17.049972534179688, 17.049171447753906, 17.054731369018555, 17.050012588500977, 17.051212310791016, 17.05573272705078, 17.04869270324707, 17.055578231811523, 17.050771713256836, 17.050891876220703, 17.057571411132812, 17.050949096679688], "compile_time": 632.855573669076, "verification_time": 0, "benchmark_time": 549.3311891332269, "GFLOP/s": 442.25755123062623, "strategy_time": 0, "framework_time": 0.7599443197250366, "timestamp": "2023-06-26 14:43:51.846608+00:00"},
"16,1,2,2,1,0": {"block_size_x": 16, "block_size_y": 1, "tile_size_x": 2, "tile_size_y": 2, "read_only": 1, "use_padding": 0, "time": 17.051116943359375, "times": [17.356571197509766, 17.04073143005371, 17.043411254882812, 17.04108428955078, 17.041292190551758, 17.042932510375977, 17.042171478271484, 17.0422420501709, 17.040292739868164, 17.039892196655273, 17.03921127319336, 17.039974212646484, 17.04005241394043, 17.040651321411133, 17.0411319732666, 17.042539596557617, 17.04121208190918, 17.041011810302734, 17.04073143005371, 17.041091918945312, 17.04197120666504, 17.040491104125977, 17.04117202758789, 17.04270362854004, 17.040651321411133, 17.042011260986328, 17.043212890625, 17.04157066345215, 17.040851593017578, 17.04121208190918, 17.04041290283203, 17.04125213623047], "compile_time": 631.2172180041671, "verification_time": 0, "benchmark_time": 548.5825026407838, "GFLOP/s": 442.77141638749237, "strategy_time": 0, "framework_time": 0.7617054507136345, "timestamp": "2023-06-26 14:43:53.027183+00:00"},
"16,1,2,2,1,1": {"block_size_x": 16, "block_size_y": 1, "tile_size_x": 2, "tile_size_y": 2, "read_only": 1, "use_padding": 1, "time": 17.050088047981262, "times": [17.358171463012695, 17.038251876831055, 17.037811279296875, 17.042680740356445, 17.038251876831055, 17.037412643432617, 17.038372039794922, 17.038511276245117, 17.038331985473633, 17.04157257080078, 17.037492752075195, 17.039459228515625, 17.040691375732422, 17.039371490478516, 17.039531707763672, 17.039871215820312, 17.04081153869629, 17.04121208190918, 17.04193115234375, 17.04060935974121, 17.039772033691406, 17.041772842407227, 17.040611267089844, 17.03925132751465, 17.040891647338867, 17.04081153869629, 17.04165267944336, 17.042219161987305, 17.04073143005371, 17.040851593017578, 17.041372299194336, 17.042530059814453], "compile_time": 632.5216451659799, "verification_time": 0, "benchmark_time": 548.9396415650845, "GFLOP/s": 442.7981356315572, "strategy_time": 0, "framework_time": 0.752313993871212, "timestamp": "2023-06-26 14:43:54.209411+00:00"},
"16,1,2,3,0,0": {"block_size_x": 16, "block_size_y": 1, "tile_size_x": 2, "tile_size_y": 3, "read_only": 0, "use_padding": 0, "time": 66.04009771347046, "times": [70.54993438720703, 65.63672637939453, 65.69692993164062, 65.61441040039062, 65.72013092041016, 65.82032775878906, 65.93575286865234, 65.9518051147461, 65.92389678955078, 65.96987915039062, 65.98059844970703, 65.86194610595703, 65.89266967773438, 65.92487335205078, 65.93582916259766, 65.86258697509766, 65.97415924072266, 65.92453002929688, 65.96697998046875, 65.93852996826172, 65.94263458251953, 65.97859954833984, 65.95954895019531, 66.00663757324219, 65.85340118408203, 65.83446502685547, 65.92176055908203, 65.94171142578125, 65.921630859375, 65.98158264160156, 65.93899536132812, 65.91966247558594], "compile_time": 967.1831568703055, "verification_time": 0, "benchmark_time": 2116.5508460253477, "GFLOP/s": 114.3206545931571, "strategy_time": 0, "framework_time": 0.8406210690736771, "timestamp": "2023-06-26 14:43:57.293999+00:00"},
"16,1,2,3,0,1": {"block_size_x": 16, "block_size_y": 1, "tile_size_x": 2, "tile_size_y": 3, "read_only": 0, "use_padding": 1, "time": 66.19285345077515, "times": [69.63606262207031, 65.77144622802734, 65.88473510742188, 65.82096099853516, 65.75144958496094, 66.17698669433594, 66.13345336914062, 66.15186309814453, 66.12183380126953, 66.13890075683594, 66.16197967529297, 66.05872344970703, 66.15203094482422, 66.02669525146484, 66.07616424560547, 66.13756561279297, 66.11675262451172, 66.1480941772461, 66.13504028320312, 66.13922882080078, 66.17971801757812, 66.11864471435547, 66.11510467529297, 66.09230041503906, 66.07301330566406, 66.14625549316406, 66.10197448730469, 66.10283660888672, 66.08788299560547, 66.14546966552734, 66.04877471923828, 66.21936798095703], "compile_time": 966.8233478441834, "verification_time": 0, "benchmark_time": 2121.293356642127, "GFLOP/s": 114.05683251915451, "strategy_time": 0, "framework_time": 0.7390854880213737, "timestamp": "2023-06-26 14:44:00.382868+00:00"},
"16,1,2,3,1,0": {"block_size_x": 16, "block_size_y": 1, "tile_size_x": 2, "tile_size_y": 3, "read_only": 1, "use_padding": 0, "time": 66.09739279747009, "times": [69.72938537597656, 65.68696594238281, 65.740234375, 65.67892456054688, 65.68141174316406, 65.9849853515625, 66.01593017578125, 66.00383758544922, 65.97769165039062, 65.99132537841797, 66.01741790771484, 65.9322509765625, 66.14944458007812, 66.07820129394531, 66.01368713378906, 65.92549896240234, 66.05659484863281, 66.0282974243164, 66.07604217529297, 66.09828186035156, 66.05793762207031, 66.11304473876953, 66.00292205810547, 65.99690246582031, 66.01397705078125, 66.02108001708984, 65.94609832763672, 66.0301513671875, 66.03902435302734, 66.0594253540039, 65.98953247070312, 65.98006439208984], "compile_time": 972.0738623291254, "verification_time": 0, "benchmark_time": 2118.2808578014374, "GFLOP/s": 114.22155822595425, "strategy_time": 0, "framework_time": 0.747225247323513, "timestamp": "2023-06-26 14:44:03.473984+00:00"},
"16,1,2,3,1,1": {"block_size_x": 16, "block_size_y": 1, "tile_size_x": 2, "tile_size_y": 3, "read_only": 1, "use_padding": 1, "time": 66.0164725780487, "times": [69.33404541015625, 65.61962890625, 65.63790130615234, 65.62033081054688, 65.59432983398438, 66.00435638427734, 65.9774398803711, 65.84361267089844, 66.01760864257812, 65.9114990234375, 65.90299224853516, 65.8961410522461, 65.9477310180664, 65.97144317626953, 65.9552993774414, 65.92951202392578, 65.95559692382812, 65.9885482788086, 65.95352935791016, 65.92253112792969, 65.91342163085938, 65.9464111328125, 65.95970916748047, 65.90059661865234, 66.00105285644531, 65.98418426513672, 65.95291900634766, 66.0045394897461, 65.95677947998047, 66.04804992675781, 65.92037963867188, 65.95500183105469], "compile_time": 969.0152453258634, "verification_time": 0, "benchmark_time": 2115.5875781551003, "GFLOP/s": 114.361566214769, "strategy_time": 0, "framework_time": 0.9842263534665108, "timestamp": "2023-06-26 14:44:06.559585+00:00"},
"16,1,2,4,0,0": {"block_size_x": 16, "block_size_y": 1, "tile_size_x": 2, "tile_size_y": 4, "read_only": 0, "use_padding": 0, "time": 9.619825422763824, "times": [10.988368034362793, 9.575008392333984, 9.572367668151855, 9.580608367919922, 9.576726913452148, 9.574048042297363, 9.574417114257812, 9.573686599731445, 9.580207824707031, 9.573047637939453, 9.573967933654785, 9.575447082519531, 9.572848320007324, 9.572931289672852, 9.580607414245605, 9.5736083984375, 9.57532787322998, 9.57376766204834, 9.575166702270508, 9.580568313598633, 9.574629783630371, 9.574207305908203, 9.573568344116211, 9.576007843017578, 9.5792875289917, 9.575846672058105, 9.574446678161621, 9.575260162353516, 9.574807167053223, 9.582488059997559, 9.576087951660156, 9.575048446655273], "compile_time": 1130.4298033937812, "verification_time": 0, "benchmark_time": 310.62162667512894, "GFLOP/s": 784.8112484593217, "strategy_time": 0, "framework_time": 0.9930562227964401, "timestamp": "2023-06-26 14:44:08.001643+00:00"},
"16,1,2,4,0,1": {"block_size_x": 16, "block_size_y": 1, "tile_size_x": 2, "tile_size_y": 4, "read_only": 0, "use_padding": 1, "time": 9.621518343687057, "times": [11.033008575439453, 9.57388687133789, 9.560526847839355, 9.58124828338623, 9.575207710266113, 9.575648307800293, 9.576398849487305, 9.576167106628418, 9.575847625732422, 9.581968307495117, 9.574048042297363, 9.575648307800293, 9.575488090515137, 9.575005531311035, 9.581526756286621, 9.573528289794922, 9.575608253479004, 9.57416820526123, 9.573448181152344, 9.581368446350098, 9.57449722290039, 9.576446533203125, 9.575887680053711, 9.575528144836426, 9.582568168640137, 9.574128150939941, 9.576288223266602, 9.574505805969238, 9.57548713684082, 9.581647872924805, 9.575287818908691, 9.576567649841309], "compile_time": 1136.4165833219886, "verification_time": 0, "benchmark_time": 311.1855462193489, "GFLOP/s": 784.6731597153371, "strategy_time": 0, "framework_time": 0.940939411520958, "timestamp": "2023-06-26 14:44:09.450200+00:00"},
"16,1,2,4,1,0": {"block_size_x": 16, "block_size_y": 1, "tile_size_x": 2, "tile_size_y": 4, "read_only": 1, "use_padding": 0, "time": 9.606845408678055, "times": [10.951848983764648, 9.568927764892578, 9.567808151245117, 9.563088417053223, 9.56376838684082, 9.566568374633789, 9.56142520904541, 9.560566902160645, 9.563567161560059, 9.562288284301758, 9.56496810913086, 9.563247680664062, 9.562527656555176, 9.56450080871582, 9.564006805419922, 9.566408157348633, 9.564127922058105, 9.564047813415527, 9.564488410949707, 9.561247825622559, 9.566099166870117, 9.561006546020508, 9.561327934265137, 9.562447547912598, 9.56216812133789, 9.565688133239746, 9.563247680664062, 9.56116771697998, 9.562207221984863, 9.562248229980469, 9.562968254089355, 9.55904769897461], "compile_time": 1126.9646091386676, "verification_time": 0, "benchmark_time": 310.5382388457656, "GFLOP/s": 785.8716237049223, "strategy_time": 0, "framework_time": 0.9101890027523041, "timestamp": "2023-06-26 14:44:10.888627+00:00"},
"16,1,2,4,1,1": {"block_size_x": 16, "block_size_y": 1, "tile_size_x": 2, "tile_size_y": 4, "read_only": 1, "use_padding": 1, "time": 9.602297961711884, "times": [10.935528755187988, 9.559328079223633, 9.543047904968262, 9.564448356628418, 9.560248374938965, 9.563008308410645, 9.558968544006348, 9.56116771697998, 9.558728218078613, 9.560888290405273, 9.56060791015625, 9.56436824798584, 9.560768127441406, 9.556121826171875, 9.560128211975098, 9.559288024902344, 9.561287879943848, 9.558208465576172, 9.56000804901123, 9.559368133544922, 9.558833122253418, 9.562848091125488, 9.559368133544922, 9.557368278503418, 9.557448387145996, 9.557408332824707, 9.561528205871582, 9.560022354125977, 9.558327674865723, 9.556648254394531, 9.557488441467285, 9.560728073120117], "compile_time": 1130.6901155039668, "verification_time": 0, "benchmark_time": 310.0806325674057, "GFLOP/s": 786.2437960271379, "strategy_time": 0, "framework_time": 0.8002948015928268, "timestamp": "2023-06-26 14:44:12.330212+00:00"},
"16,1,3,1,0,0": {"block_size_x": 16, "block_size_y": 1, "tile_size_x": 3, "tile_size_y": 1, "read_only": 0, "use_padding": 0, "time": 67.81727170944214, "times": [70.72212982177734, 66.31041717529297, 66.33555603027344, 67.8703842163086, 67.85602569580078, 67.82356262207031, 67.7667236328125, 67.78975677490234, 67.77828979492188, 67.81317901611328, 67.80502319335938, 67.80364990234375, 67.87864685058594, 67.84281158447266, 67.80335998535156, 67.8388900756836, 67.8067626953125, 67.79463958740234, 67.82840728759766, 67.83496856689453, 67.82865905761719, 67.8299789428711, 67.83448791503906, 67.828369140625, 67.82447814941406, 67.81329345703125, 67.80290985107422, 67.83595275878906, 67.80841827392578, 67.83474731445312, 67.81425476074219, 67.79396057128906], "compile_time": 622.4312810227275, "verification_time": 0, "benchmark_time": 2173.531739041209, "GFLOP/s": 111.32484409497197, "strategy_time": 0, "framework_time": 0.8867206051945686, "timestamp": "2023-06-26 14:44:15.127075+00:00"},
"16,1,3,1,0,1": {"block_size_x": 16, "block_size_y": 1, "tile_size_x": 3, "tile_size_y": 1, "read_only": 0, "use_padding": 1, "time": 71.95384979248047, "times": [74.13872528076172, 70.48974609375, 70.48275756835938, 71.79190826416016, 72.00292205810547, 71.99444580078125, 71.90655517578125, 71.92400360107422, 71.9404296875, 71.91401672363281, 71.94903564453125, 72.03174591064453, 71.97931671142578, 71.98011016845703, 71.98704528808594, 71.97409057617188, 72.02330780029297, 71.98416137695312, 71.98651885986328, 71.94245147705078, 71.98605346679688, 72.01304626464844, 71.97185516357422, 72.05913543701172, 71.99911499023438, 72.04352569580078, 71.97147369384766, 71.98176574707031, 72.04336547851562, 72.02376556396484, 71.9992904663086, 72.00750732421875], "compile_time": 624.7151661664248, "verification_time": 0, "benchmark_time": 2305.505532771349, "GFLOP/s": 104.9248542193914, "strategy_time": 0, "framework_time": 0.8209021762013435, "timestamp": "2023-06-26 14:44:18.058131+00:00"},
"16,1,3,1,1,0": {"block_size_x": 16, "block_size_y": 1, "tile_size_x": 3, "tile_size_y": 1, "read_only": 1, "use_padding": 0, "time": 67.69325232505798, "times": [70.408447265625, 66.11188507080078, 66.25176239013672, 67.80145263671875, 67.73540496826172, 67.6780014038086, 67.67886352539062, 67.6685562133789, 67.70854949951172, 67.65540313720703, 67.68359375, 67.69283294677734, 67.7316665649414, 67.699462890625, 67.70903015136719, 67.71620178222656, 67.70079803466797, 67.69779205322266, 67.6812744140625, 67.71783447265625, 67.67908477783203, 67.6988754272461, 67.69651794433594, 67.70307159423828, 67.6844253540039, 67.73429107666016, 67.6812515258789, 67.68641662597656, 67.69088745117188, 67.70037078857422, 67.73171997070312, 67.76834869384766], "compile_time": 620.7602182403207, "verification_time": 0, "benchmark_time": 2169.5606019347906, "GFLOP/s": 111.52880000131582, "strategy_time": 0, "framework_time": 0.7765134796500206, "timestamp": "2023-06-26 14:44:20.849242+00:00"},
"16,1,3,1,1,1": {"block_size_x": 16, "block_size_y": 1, "tile_size_x": 3, "tile_size_y": 1, "read_only": 1, "use_padding": 1, "time": 71.91766405105591, "times": [74.29306030273438, 70.41767120361328, 70.40168762207031, 72.03277587890625, 71.96257019042969, 71.9583511352539, 71.91950988769531, 71.92878723144531, 71.87569427490234, 71.9281997680664, 71.9368667602539, 71.91708374023438, 71.90538024902344, 71.9372787475586, 71.91862487792969, 71.93399810791016, 71.98465728759766, 71.91407012939453, 71.95539855957031, 71.92774963378906, 71.9294204711914, 71.90038299560547, 71.96075439453125, 71.9649887084961, 71.89214324951172, 71.96923828125, 71.93539428710938, 71.94269561767578, 71.93729400634766, 71.94446563720703, 71.98211669921875, 71.95693969726562], "compile_time": 627.5177523493767, "verification_time": 0, "benchmark_time": 2304.280746728182, "GFLOP/s": 104.97764769779329, "strategy_time": 0, "framework_time": 0.7692044600844383, "timestamp": "2023-06-26 14:44:23.781824+00:00"},
"16,1,3,2,0,0": {"block_size_x": 16, "block_size_y": 1, "tile_size_x": 3, "tile_size_y": 2, "read_only": 0, "use_padding": 0, "time": 129.82681798934937, "times": [134.19833374023438, 129.6425323486328, 129.70692443847656, 129.7408905029297, 129.75941467285156, 129.76197814941406, 129.7157745361328, 129.5355987548828, 129.73280334472656, 129.66917419433594, 129.64578247070312, 129.548095703125, 129.8971405029297, 129.9342498779297, 129.51405334472656, 129.7864990234375, 129.61402893066406, 129.74215698242188, 129.8839569091797, 129.43353271484375, 130.0667266845703, 129.7493438720703, 129.632568359375, 129.49560546875, 129.50942993164062, 129.61790466308594, 129.7213592529297, 129.60560607910156, 129.7299041748047, 129.56153869628906, 129.61776733398438, 129.6875], "compile_time": 1012.9694771021605, "verification_time": 0, "benchmark_time": 4157.830166630447, "GFLOP/s": 58.15244736737952, "strategy_time": 0, "framework_time": 0.8780332282185555, "timestamp": "2023-06-26 14:44:28.953516+00:00"},
"16,1,3,2,0,1": {"block_size_x": 16, "block_size_y": 1, "tile_size_x": 3, "tile_size_y": 2, "read_only": 0, "use_padding": 1, "time": 88.54077482223511, "times": [91.9624252319336, 88.09446716308594, 88.1230239868164, 88.10025024414062, 88.27911376953125, 88.53240966796875, 88.46029663085938, 88.47480010986328, 88.44140625, 88.49565124511719, 88.4344482421875, 88.45785522460938, 88.45634460449219, 88.43325805664062, 88.46601104736328, 88.49674987792969, 88.46473693847656, 88.52095031738281, 88.49444580078125, 88.4477310180664, 88.48863983154297, 88.46117401123047, 88.4544677734375, 88.44821166992188, 88.44747924804688, 88.45552825927734, 88.47271728515625, 88.46984100341797, 88.51806640625, 88.50163269042969, 88.47708892822266, 88.47357177734375], "compile_time": 1042.6297774538398, "verification_time": 0, "benchmark_time": 2836.4246524870396, "GFLOP/s": 85.2685919584255, "strategy_time": 0, "framework_time": 0.7576281204819679, "timestamp": "2023-06-26 14:44:32.833343+00:00"},
"16,1,3,2,1,0": {"block_size_x": 16, "block_size_y": 1, "tile_size_x": 3, "tile_size_y": 2, "read_only": 1, "use_padding": 0, "time": 126.14314484596252, "times": [129.5446014404297, 125.84502410888672, 126.20260620117188, 126.1485366821289, 126.21644592285156, 126.06684875488281, 125.84479522705078, 126.02836608886719, 126.0435791015625, 126.1981201171875, 126.1539077758789, 126.10557556152344, 125.86207580566406, 125.90380859375, 125.99616241455078, 125.98712921142578, 125.99153137207031, 125.83262634277344, 126.09904479980469, 125.8712387084961, 125.82533264160156, 126.14482879638672, 126.06344604492188, 126.22621154785156, 126.00323486328125, 126.10676574707031, 126.02115631103516, 126.09256744384766, 126.04164123535156, 126.06704711914062, 126.18910217285156, 125.8572769165039], "compile_time": 1014.9480877444148, "verification_time": 0, "benchmark_time": 4040.063375607133, "GFLOP/s": 59.850634049271875, "strategy_time": 0, "framework_time": 0.7753064855933189, "timestamp": "2023-06-26 14:44:37.889144+00:00"},
"16,1,3,2,1,1": {"block_size_x": 16, "block_size_y": 1, "tile_size_x": 3, "tile_size_y": 2, "read_only": 1, "use_padding": 1, "time": 87.19606590270996, "times": [90.39480590820312, 86.63616180419922, 86.67266082763672, 86.63426208496094, 87.12448120117188, 87.16568756103516, 87.11869049072266, 87.15961456298828, 87.13650512695312, 87.16267395019531, 87.12333679199219, 87.13092041015625, 87.13896179199219, 87.12965393066406, 87.11843872070312, 87.12954711914062, 87.16731262207031, 87.1266098022461, 87.1520767211914, 87.15394592285156, 87.1429443359375, 87.09256744384766, 87.1627197265625, 87.10789489746094, 87.14618682861328, 87.16217041015625, 87.17552185058594, 87.16573333740234, 87.09813690185547, 87.15092468261719, 87.15196990966797, 87.1409912109375], "compile_time": 1041.4936067536473, "verification_time": 0, "benchmark_time": 2793.5565961524844, "GFLOP/s": 86.58357601160262, "strategy_time": 0, "framework_time": 0.7449649274349213, "timestamp": "2023-06-26 14:44:41.724953+00:00"},
"16,1,3,3,0,0": {"block_size_x": 16, "block_size_y": 1, "tile_size_x": 3, "tile_size_y": 3, "read_only": 0, "use_padding": 0, "time": 24.55682533979416, "times": [26.527719497680664, 24.492517471313477, 24.49259376525879, 24.49823570251465, 24.489837646484375, 24.49399185180664, 24.488595962524414, 24.49203872680664, 24.49000358581543, 24.496076583862305, 24.493637084960938, 24.496360778808594, 24.488435745239258, 24.498998641967773, 24.48910140991211, 24.49431610107422, 24.492637634277344, 24.497039794921875, 24.490436553955078, 24.496797561645508, 24.493419647216797, 24.49547576904297, 24.49283790588379, 24.492050170898438, 24.490076065063477, 24.497318267822266, 24.49323272705078, 24.492835998535156, 24.49003791809082, 24.49648094177246, 24.488515853881836, 24.49675750732422], "compile_time": 773.0407435446978, "verification_time": 0, "benchmark_time": 788.9572819694877, "GFLOP/s": 307.4398704040008, "strategy_time": 0, "framework_time": 0.7247244939208031, "timestamp": "2023-06-26 14:44:43.287690+00:00"},
"16,1,3,3,0,1": {"block_size_x": 16, "block_size_y": 1, "tile_size_x": 3, "tile_size_y": 3, "read_only": 0, "use_padding": 1, "time": 25.066623747348785, "times": [27.271360397338867, 24.996440887451172, 24.999563217163086, 24.988597869873047, 25.0044002532959, 24.996959686279297, 24.986398696899414, 24.988718032836914, 24.9906005859375, 24.987878799438477, 24.99127769470215, 25.001863479614258, 25.003957748413086, 24.989519119262695, 25.016258239746094, 24.991958618164062, 25.00428009033203, 24.990379333496094, 24.98655891418457, 24.980600357055664, 25.00200080871582, 24.987958908081055, 25.006439208984375, 24.991867065429688, 25.00619888305664, 24.991960525512695, 25.010377883911133, 24.98891830444336, 25.009199142456055, 24.988428115844727, 24.99919891357422, 24.981840133666992], "compile_time": 772.8932378813624, "verification_time": 0, "benchmark_time": 804.9994660541415, "GFLOP/s": 301.1872390991033, "strategy_time": 0, "framework_time": 0.898989848792553, "timestamp": "2023-06-26 14:44:44.866495+00:00"},
"16,1,3,3,1,0": {"block_size_x": 16, "block_size_y": 1, "tile_size_x": 3, "tile_size_y": 3, "read_only": 1, "use_padding": 0, "time": 24.53866469860077, "times": [27.127239227294922, 24.457918167114258, 24.454212188720703, 24.45455551147461, 24.4554386138916, 24.454204559326172, 24.45171546936035, 24.458797454833984, 24.451995849609375, 24.45563507080078, 24.447038650512695, 24.45582389831543, 24.451595306396484, 24.460758209228516, 24.44985580444336, 24.452436447143555, 24.455318450927734, 24.45350456237793, 24.45103645324707, 24.458797454833984, 24.45723533630371, 24.455476760864258, 24.451438903808594, 24.460695266723633, 24.456836700439453, 24.456317901611328, 24.45348358154297, 24.459915161132812, 24.449478149414062, 24.459444046020508, 24.46315574645996, 24.455915451049805], "compile_time": 773.6032251268625, "verification_time": 0, "benchmark_time": 788.548176176846, "GFLOP/s": 307.66740133298686, "strategy_time": 0, "framework_time": 0.7570832967758179, "timestamp": "2023-06-26 14:44:46.429417+00:00"},
"16,1,3,3,1,1": {"block_size_x": 16, "block_size_y": 1, "tile_size_x": 3, "tile_size_y": 3, "read_only": 1, "use_padding": 1, "time": 25.160804986953735, "times": [27.392841339111328, 25.108360290527344, 25.07880401611328, 25.113197326660156, 25.06915855407715, 25.102079391479492, 25.085277557373047, 25.103158950805664, 25.07465934753418, 25.098718643188477, 25.082517623901367, 25.10738754272461, 25.089797973632812, 25.07571792602539, 25.100008010864258, 25.071077346801758, 25.09151840209961, 25.0861873626709, 25.08831787109375, 25.078960418701172, 25.09423828125, 25.0797176361084, 25.077598571777344, 25.080827713012695, 25.07731819152832, 25.076557159423828, 25.09299087524414, 25.104238510131836, 25.094160079956055, 25.09160804748535, 25.088438034057617, 25.090320587158203], "compile_time": 771.4192280545831, "verification_time": 0, "benchmark_time": 808.2273676991463, "GFLOP/s": 300.0598432329434, "strategy_time": 0, "framework_time": 0.7808636873960495, "timestamp": "2023-06-26 14:44:48.009858+00:00"},
"16,1,3,4,0,0": {"block_size_x": 16, "block_size_y": 1, "tile_size_x": 3, "tile_size_y": 4, "read_only": 0, "use_padding": 0, "time": 22.66640019416809, "times": [25.006837844848633, 22.27011489868164, 22.27206802368164, 22.285114288330078, 22.28911590576172, 22.264272689819336, 22.26151466369629, 22.268596649169922, 22.28628921508789, 22.262914657592773, 22.490036010742188, 22.848783493041992, 22.814435958862305, 22.78003692626953, 22.735868453979492, 22.706436157226562, 22.729276657104492, 22.702312469482422, 22.726036071777344, 22.73331642150879, 22.72020149230957, 22.72339630126953, 22.716476440429688, 22.71056365966797, 22.721996307373047, 22.721555709838867, 22.695951461791992, 22.717395782470703, 22.707796096801758, 22.706064224243164, 22.718475341796875, 22.731555938720703], "compile_time": 985.1494701579213, "verification_time": 0, "benchmark_time": 728.5508085042238, "GFLOP/s": 333.0809980996673, "strategy_time": 0, "framework_time": 0.7557747885584831, "timestamp": "2023-06-26 14:44:49.724327+00:00"},
"16,1,3,4,0,1": {"block_size_x": 16, "block_size_y": 1, "tile_size_x": 3, "tile_size_y": 4, "read_only": 0, "use_padding": 1, "time": 24.70623344182968, "times": [27.069841384887695, 24.44995880126953, 24.432283401489258, 24.44203758239746, 24.452198028564453, 24.46157455444336, 24.442638397216797, 24.43863868713379, 24.438844680786133, 24.454038619995117, 24.460237503051758, 24.463623046875, 24.422998428344727, 24.62567710876465, 24.8929443359375, 24.823837280273438, 24.761838912963867, 24.722131729125977, 24.722597122192383, 24.72100067138672, 24.744104385375977, 24.740398406982422, 24.72480010986328, 24.71281623840332, 24.753358840942383, 24.747400283813477, 24.749683380126953, 24.731958389282227, 24.7213191986084, 24.781452178955078, 24.7188777923584, 24.77436065673828], "compile_time": 978.4755613654852, "verification_time": 0, "benchmark_time": 793.9534643664956, "GFLOP/s": 305.5806631867105, "strategy_time": 0, "framework_time": 0.980139710009098, "timestamp": "2023-06-26 14:44:51.497750+00:00"},
"16,1,3,4,1,0": {"block_size_x": 16, "block_size_y": 1, "tile_size_x": 3, "tile_size_y": 4, "read_only": 1, "use_padding": 0, "time": 22.654416978359222, "times": [24.934160232543945, 22.242395401000977, 22.2336483001709, 22.22447395324707, 22.25095558166504, 22.223892211914062, 22.247434616088867, 22.237356185913086, 22.218631744384766, 22.255233764648438, 22.474355697631836, 22.810033798217773, 22.79691505432129, 22.74263572692871, 22.737688064575195, 22.722475051879883, 22.748516082763672, 22.7255802154541, 22.718236923217773, 22.688716888427734, 22.702404022216797, 22.73211669921875, 22.728275299072266, 22.717262268066406, 22.729515075683594, 22.719715118408203, 22.71082305908203, 22.72295570373535, 22.752195358276367, 22.722991943359375, 22.747676849365234, 22.722076416015625], "compile_time": 985.3439535945654, "verification_time": 0, "benchmark_time": 728.216820396483, "GFLOP/s": 333.25718367468664, "strategy_time": 0, "framework_time": 0.8012736216187477, "timestamp": "2023-06-26 14:44:53.212126+00:00"},
"16,1,3,4,1,1": {"block_size_x": 16, "block_size_y": 1, "tile_size_x": 3, "tile_size_y": 4, "read_only": 1, "use_padding": 1, "time": 25.117799043655396, "times": [27.593643188476562, 24.88875961303711, 24.90403938293457, 24.89575958251953, 24.898839950561523, 24.890399932861328, 24.915679931640625, 24.865840911865234, 24.894559860229492, 24.89539909362793, 24.876760482788086, 24.911300659179688, 24.86016082763672, 24.90648078918457, 25.026756286621094, 25.2645206451416, 25.201400756835938, 25.159435272216797, 25.09316062927246, 25.159080505371094, 25.131372451782227, 25.133920669555664, 25.136240005493164, 25.149242401123047, 25.1229190826416, 25.1368408203125, 25.146432876586914, 25.135480880737305, 25.129640579223633, 25.159021377563477, 25.13800048828125, 25.148479461669922], "compile_time": 981.9819247350097, "verification_time": 0, "benchmark_time": 806.7621476948261, "GFLOP/s": 300.5735967103782, "strategy_time": 0, "framework_time": 0.7890127599239349, "timestamp": "2023-06-26 14:44:55.001674+00:00"},
"16,1,4,1,0,0": {"block_size_x": 16, "block_size_y": 1, "tile_size_x": 4, "tile_size_y": 1, "read_only": 0, "use_padding": 0, "time": 30.644975423812866, "times": [30.634727478027344, 30.618928909301758, 30.647655487060547, 30.65384864807129, 30.621488571166992, 30.66119956970215, 30.657207489013672, 30.627967834472656, 30.657730102539062, 30.623647689819336, 30.662168502807617, 30.65924835205078, 30.625408172607422, 30.66084861755371, 30.623050689697266, 30.66200828552246, 30.658008575439453, 30.634748458862305, 30.658248901367188, 30.659488677978516, 30.630760192871094, 30.65816879272461, 30.634767532348633, 30.65966033935547, 30.658687591552734, 30.608247756958008, 30.653440475463867, 30.626127243041992, 30.658607482910156, 30.659940719604492, 30.627328872680664, 30.655847549438477], "compile_time": 716.5038222447038, "verification_time": 0, "benchmark_time": 984.821000136435, "GFLOP/s": 246.36166600197117, "strategy_time": 0, "framework_time": 0.7919026538729668, "timestamp": "2023-06-26 14:44:56.703804+00:00"},
"16,1,4,1,0,1": {"block_size_x": 16, "block_size_y": 1, "tile_size_x": 4, "tile_size_y": 1, "read_only": 0, "use_padding": 1, "time": 30.646183729171753, "times": [30.6676082611084, 30.627328872680664, 30.654560089111328, 30.652767181396484, 30.61952781677246, 30.6536808013916, 30.658727645874023, 30.623367309570312, 30.653667449951172, 30.626968383789062, 30.659568786621094, 30.662107467651367, 30.604888916015625, 30.654808044433594, 30.62491226196289, 30.662328720092773, 30.66520881652832, 30.628747940063477, 30.661888122558594, 30.6632080078125, 30.630508422851562, 30.6564884185791, 30.628768920898438, 30.657888412475586, 30.65772819519043, 30.62784767150879, 30.66436767578125, 30.623048782348633, 30.658567428588867, 30.65825843811035, 30.630048751831055, 30.65848731994629], "compile_time": 713.7241140007973, "verification_time": 0, "benchmark_time": 985.0232833996415, "GFLOP/s": 246.35195255367088, "strategy_time": 0, "framework_time": 0.8211834356188774, "timestamp": "2023-06-26 14:44:58.403387+00:00"},
"16,1,4,1,1,0": {"block_size_x": 16, "block_size_y": 1, "tile_size_x": 4, "tile_size_y": 1, "read_only": 1, "use_padding": 0, "time": 30.35336035490036, "times": [30.366167068481445, 30.33064842224121, 30.362354278564453, 30.368408203125, 30.335527420043945, 30.35910987854004, 30.360248565673828, 30.329927444458008, 30.3640079498291, 30.33252716064453, 30.364927291870117, 30.364028930664062, 30.33504867553711, 30.365327835083008, 30.338031768798828, 30.364688873291016, 30.365968704223633, 30.33283042907715, 30.363248825073242, 30.33460807800293, 30.366788864135742, 30.364208221435547, 30.338607788085938, 30.364667892456055, 30.36524772644043, 30.337688446044922, 30.363697052001953, 30.336767196655273, 30.364728927612305, 30.366518020629883, 30.335607528686523, 30.365367889404297], "compile_time": 715.9811090677977, "verification_time": 0, "benchmark_time": 975.3562361001968, "GFLOP/s": 248.7285464187869, "strategy_time": 0, "framework_time": 0.7500043138861656, "timestamp": "2023-06-26 14:45:00.095488+00:00"},
"16,1,4,1,1,1": {"block_size_x": 16, "block_size_y": 1, "tile_size_x": 4, "tile_size_y": 1, "read_only": 1, "use_padding": 1, "time": 30.350630819797516, "times": [30.368167877197266, 30.33136749267578, 30.35853385925293, 30.331768035888672, 30.36084747314453, 30.360340118408203, 30.333568572998047, 30.360328674316406, 30.359420776367188, 30.329608917236328, 30.360807418823242, 30.330730438232422, 30.365407943725586, 30.36088752746582, 30.3309383392334, 30.3609676361084, 30.335567474365234, 30.362911224365234, 30.361087799072266, 30.333927154541016, 30.361370086669922, 30.33252716064453, 30.363527297973633, 30.363088607788086, 30.331727981567383, 30.35812759399414, 30.359668731689453, 30.334247589111328, 30.361528396606445, 30.33245086669922, 30.3616886138916, 30.363048553466797], "compile_time": 712.9448400810361, "verification_time": 0, "benchmark_time": 975.2625897526741, "GFLOP/s": 248.75091542002974, "strategy_time": 0, "framework_time": 0.7581952959299088, "timestamp": "2023-06-26 14:45:01.784468+00:00"},
"16,1,4,2,0,0": {"block_size_x": 16, "block_size_y": 1, "tile_size_x": 4, "tile_size_y": 2, "read_only": 0, "use_padding": 0, "time": 16.334552705287933, "times": [17.220748901367188, 16.296905517578125, 16.3061466217041, 16.303672790527344, 16.3031063079834, 16.310745239257812, 16.301706314086914, 16.30234146118164, 16.310945510864258, 16.301265716552734, 16.30350685119629, 16.308921813964844, 16.307706832885742, 16.305065155029297, 16.313987731933594, 16.305469512939453, 16.307226181030273, 16.31174659729004, 16.306066513061523, 16.30467987060547, 16.3125057220459, 16.302705764770508, 16.302827835083008, 16.309179306030273, 16.303146362304688, 16.304426193237305, 16.3078670501709, 16.3033504486084, 16.30382537841797, 16.31354522705078, 16.30574607849121, 16.30459976196289], "compile_time": 1155.1029942929745, "verification_time": 0, "benchmark_time": 525.8581191301346, "GFLOP/s": 462.1949150499813, "strategy_time": 0, "framework_time": 0.827631913125515, "timestamp": "2023-06-26 14:45:03.466271+00:00"},
"16,1,4,2,0,1": {"block_size_x": 16, "block_size_y": 1, "tile_size_x": 4, "tile_size_y": 2, "read_only": 0, "use_padding": 1, "time": 16.335473477840424, "times": [17.245988845825195, 16.304466247558594, 16.30186653137207, 16.311397552490234, 16.30694580078125, 16.30810546875, 16.31354522705078, 16.306528091430664, 16.30350685119629, 16.311626434326172, 16.304025650024414, 16.3037109375, 16.310466766357422, 16.304946899414062, 16.304346084594727, 16.30910873413086, 16.305505752563477, 16.30258560180664, 16.310386657714844, 16.30497932434082, 16.303985595703125, 16.312946319580078, 16.30066680908203, 16.306848526000977, 16.30774688720703, 16.30262565612793, 16.30146598815918, 16.309219360351562, 16.300386428833008, 16.302345275878906, 16.30814552307129, 16.304729461669922], "compile_time": 1158.4439920261502, "verification_time": 0, "benchmark_time": 526.0743210092187, "GFLOP/s": 462.16886276614304, "strategy_time": 0, "framework_time": 0.6532976403832436, "timestamp": "2023-06-26 14:45:05.151456+00:00"},
"16,1,4,2,1,0": {"block_size_x": 16, "block_size_y": 1, "tile_size_x": 4, "tile_size_y": 2, "read_only": 1, "use_padding": 0, "time": 16.15311771631241, "times": [16.60610580444336, 16.14026641845703, 16.136985778808594, 16.135028839111328, 16.13518524169922, 16.13750648498535, 16.137346267700195, 16.136812210083008, 16.138425827026367, 16.135345458984375, 16.13326644897461, 16.136581420898438, 16.137025833129883, 16.13870620727539, 16.13718605041504, 16.137121200561523, 16.13714599609375, 16.141786575317383, 16.13762664794922, 16.1380615234375, 16.139665603637695, 16.138826370239258, 16.1386661529541, 16.142471313476562, 16.13914680480957, 16.14030647277832, 16.142986297607422, 16.144290924072266, 16.13922691345215, 16.140626907348633, 16.13994598388672, 16.140090942382812], "compile_time": 1141.5131678804755, "verification_time": 0, "benchmark_time": 520.2238662168384, "GFLOP/s": 467.3863790626501, "strategy_time": 0, "framework_time": 0.7298644632101059, "timestamp": "2023-06-26 14:45:06.813937+00:00"},
"16,1,4,2,1,1": {"block_size_x": 16, "block_size_y": 1, "tile_size_x": 4, "tile_size_y": 2, "read_only": 1, "use_padding": 1, "time": 16.152266025543213, "times": [16.573265075683594, 16.139625549316406, 16.138545989990234, 16.140361785888672, 16.13950538635254, 16.138385772705078, 16.13690757751465, 16.140363693237305, 16.140186309814453, 16.138906478881836, 16.14030647277832, 16.13795280456543, 16.14226531982422, 16.142946243286133, 16.140546798706055, 16.141202926635742, 16.1363468170166, 16.137985229492188, 16.135906219482422, 16.137771606445312, 16.13946533203125, 16.13834571838379, 16.137866973876953, 16.136520385742188, 16.13718605041504, 16.138826370239258, 16.13870620727539, 16.136674880981445, 16.13786506652832, 16.137466430664062, 16.136945724487305, 16.137359619140625], "compile_time": 1141.8604478240013, "verification_time": 0, "benchmark_time": 520.8736639469862, "GFLOP/s": 467.4110238192475, "strategy_time": 0, "framework_time": 0.7014544680714607, "timestamp": "2023-06-26 14:45:08.477386+00:00"},
"16,1,4,3,0,0": {"block_size_x": 16, "block_size_y": 1, "tile_size_x": 4, "tile_size_y": 3, "read_only": 0, "use_padding": 0, "time": 22.011008858680725, "times": [25.026439666748047, 21.751956939697266, 21.776325225830078, 21.763275146484375, 21.79495620727539, 21.77802848815918, 21.793636322021484, 21.765235900878906, 21.73025894165039, 21.786956787109375, 21.793275833129883, 21.770767211914062, 21.79111671447754, 21.789955139160156, 21.785564422607422, 21.832115173339844, 22.1362361907959, 22.07724380493164, 22.04691505432129, 22.034196853637695, 22.0368595123291, 22.02375602722168, 22.029956817626953, 22.045469284057617, 21.999515533447266, 22.000356674194336, 22.011991500854492, 22.056316375732422, 22.01775550842285, 22.008459091186523, 22.052635192871094, 22.044755935668945], "compile_time": 951.7634538933635, "verification_time": 0, "benchmark_time": 707.6777257025242, "GFLOP/s": 342.99868981346225, "strategy_time": 0, "framework_time": 0.8114036172628403, "timestamp": "2023-06-26 14:45:10.137652+00:00"},
"16,1,4,3,0,1": {"block_size_x": 16, "block_size_y": 1, "tile_size_x": 4, "tile_size_y": 3, "read_only": 0, "use_padding": 1, "time": 21.991999924182892, "times": [24.468000411987305, 21.773996353149414, 21.77243423461914, 21.753076553344727, 21.786916732788086, 21.78009605407715, 21.769155502319336, 21.766075134277344, 21.764177322387695, 21.7847957611084, 21.778715133666992, 21.78993797302246, 21.786195755004883, 21.779836654663086, 21.77703857421875, 21.871395111083984, 22.128955841064453, 22.081092834472656, 22.064876556396484, 22.02415657043457, 22.038087844848633, 22.00019645690918, 22.003915786743164, 22.024492263793945, 22.01343536376953, 22.007556915283203, 22.043371200561523, 22.037315368652344, 22.0018367767334, 22.026992797851562, 22.032995223999023, 22.012876510620117], "compile_time": 942.289031110704, "verification_time": 0, "benchmark_time": 706.9845991209149, "GFLOP/s": 343.2951630605514, "strategy_time": 0, "framework_time": 0.6797872483730316, "timestamp": "2023-06-26 14:45:11.787620+00:00"},
"16,1,4,3,1,0": {"block_size_x": 16, "block_size_y": 1, "tile_size_x": 4, "tile_size_y": 3, "read_only": 1, "use_padding": 0, "time": 22.421773612499237, "times": [24.839799880981445, 22.24031639099121, 22.232561111450195, 22.207595825195312, 22.216516494750977, 22.22968292236328, 22.24227523803711, 22.245956420898438, 22.24308967590332, 22.220436096191406, 22.23011589050293, 22.241548538208008, 22.190635681152344, 22.258556365966797, 22.224544525146484, 22.23287582397461, 22.48599624633789, 22.47761344909668, 22.46951675415039, 22.4599552154541, 22.429157257080078, 22.4340763092041, 22.445316314697266, 22.44991683959961, 22.44715690612793, 22.450275421142578, 22.42715835571289, 22.45223617553711, 22.459035873413086, 22.449045181274414, 22.41167640686035, 22.452116012573242], "compile_time": 941.4899069815874, "verification_time": 0, "benchmark_time": 720.5177284777164, "GFLOP/s": 336.71498653395196, "strategy_time": 0, "framework_time": 0.7297750562429428, "timestamp": "2023-06-26 14:45:13.450370+00:00"},
"16,1,4,3,1,1": {"block_size_x": 16, "block_size_y": 1, "tile_size_x": 4, "tile_size_y": 3, "read_only": 1, "use_padding": 1, "time": 22.420757055282593, "times": [24.931520462036133, 22.23643684387207, 22.204492568969727, 22.233156204223633, 22.179555892944336, 22.173343658447266, 22.225276947021484, 22.188196182250977, 22.238672256469727, 22.253755569458008, 22.2352352142334, 22.20423126220703, 22.244075775146484, 22.1837158203125, 22.24983024597168, 22.223316192626953, 22.490198135375977, 22.503419876098633, 22.473636627197266, 22.443876266479492, 22.44475555419922, 22.474756240844727, 22.45023536682129, 22.433835983276367, 22.466276168823242, 22.419876098632812, 22.45767593383789, 22.39559555053711, 22.457355499267578, 22.462688446044922, 22.454076766967773, 22.431156158447266], "compile_time": 944.6933707222342, "verification_time": 0, "benchmark_time": 720.5728655681014, "GFLOP/s": 336.7302531928194, "strategy_time": 0, "framework_time": 0.6966060027480125, "timestamp": "2023-06-26 14:45:15.116347+00:00"},
"16,1,4,4,0,0": {"block_size_x": 16, "block_size_y": 1, "tile_size_x": 4, "tile_size_y": 4, "read_only": 0, "use_padding": 0, "time": 30.92603898048401, "times": [34.67173767089844, 30.17048454284668, 30.180490493774414, 30.132570266723633, 30.16267967224121, 30.171689987182617, 30.191970825195312, 30.60487174987793, 31.143091201782227, 31.03301239013672, 31.0018367767334, 30.95269203186035, 30.974292755126953, 30.95921516418457, 30.94845199584961, 30.998891830444336, 31.00029182434082, 30.987651824951172, 30.958572387695312, 30.920764923095703, 30.959611892700195, 30.957611083984375, 30.94340705871582, 30.96581268310547, 30.93385124206543, 30.949756622314453, 30.931772232055664, 30.999771118164062, 30.9462833404541, 30.948652267456055, 30.94957160949707, 30.98188591003418], "compile_time": 1280.0005730241537, "verification_time": 0, "benchmark_time": 992.7510963752866, "GFLOP/s": 244.12266972709617, "strategy_time": 0, "framework_time": 0.8203014731407166, "timestamp": "2023-06-26 14:45:17.389933+00:00"},
"16,1,4,4,0,1": {"block_size_x": 16, "block_size_y": 1, "tile_size_x": 4, "tile_size_y": 4, "read_only": 0, "use_padding": 1, "time": 30.919886112213135, "times": [33.98557662963867, 30.173540115356445, 30.20256996154785, 30.192129135131836, 30.194883346557617, 30.202529907226562, 30.156129837036133, 30.543920516967773, 31.116971969604492, 31.043771743774414, 30.989748001098633, 30.978092193603516, 30.991371154785156, 30.967683792114258, 31.006771087646484, 30.994291305541992, 30.99579620361328, 30.973411560058594, 30.99369239807129, 30.98321533203125, 30.983171463012695, 30.954051971435547, 30.991008758544922, 31.002012252807617, 31.010051727294922, 30.982324600219727, 30.97637176513672, 30.97517204284668, 30.93047523498535, 30.949932098388672, 30.985891342163086, 31.009796142578125], "compile_time": 1281.3083678483963, "verification_time": 0, "benchmark_time": 991.8589666485786, "GFLOP/s": 244.1712486456379, "strategy_time": 0, "framework_time": 0.7103560492396355, "timestamp": "2023-06-26 14:45:19.663825+00:00"},
